19:24:56.263651 IP6 fe80::dc2f:cbff:fe7c:89f2.5353 > ff02::fb.5353: 0 [2q] PTR (QM)? _ipps._tcp.local. PTR (QM)? _ipp._tcp.local. (45)
19:24:56.925585 IP6 fe80::d439:80ff:fe51:b58f.5353 > ff02::fb.5353: 0 [2q] PTR (QM)? _ipps._tcp.local. PTR (QM)? _ipp._tcp.local. (45)
19:24:57.148947 ARP, Request who-has 10.0.0.7 tell 10.0.0.1, length 28
19:24:57.151444 ARP, Reply 10.0.0.7 is-at da:38:08:c3:b6:a7, length 28
19:24:57.241660 IP6 fe80::c4a1:a0ff:fec0:3fa0 > ff02::2: ICMP6, router solicitation, length 16
19:24:57.378946 IP 10.0.0.1 > 10.0.0.7: ICMP echo request, id 20405, seq 2, length 64
19:24:57.380339 IP 10.0.0.7 > 10.0.0.1: ICMP echo reply, id 20405, seq 2, length 64
19:24:57.397232 IP 10.0.0.1 > 10.0.0.7: ICMP echo request, id 20405, seq 1, length 64
19:24:57.399657 IP 10.0.0.7 > 10.0.0.1: ICMP echo reply, id 20405, seq 1, length 64
19:24:57.405313 IP 10.0.0.1 > 10.0.0.7: ICMP echo request, id 20405, seq 3, length 64
19:24:57.406572 IP 10.0.0.7 > 10.0.0.1: ICMP echo reply, id 20405, seq 3, length 64
19:24:58.059225 IP 10.0.0.1 > 10.0.0.7: ICMP echo request, id 20405, seq 4, length 64
19:24:58.060507 IP 10.0.0.7 > 10.0.0.1: ICMP echo reply, id 20405, seq 4, length 64
19:24:58.516148 IP6 fe80::84d9:30ff:fe01:f809 > ff02::2: ICMP6, router solicitation, length 16
19:24:59.068260 IP 10.0.0.1 > 10.0.0.7: ICMP echo request, id 20405, seq 5, length 64
19:24:59.069427 IP 10.0.0.7 > 10.0.0.1: ICMP echo reply, id 20405, seq 5, length 64
19:24:59.540939 IP6 fe80::cc54:e3ff:fe91:1be2 > ff02::2: ICMP6, router solicitation, length 16
19:24:59.602684 IP6 fe80::94d1:48ff:feca:6b88 > ff02::2: ICMP6, router solicitation, length 16
19:24:59.671950 IP6 fe80::8898:37ff:fe6c:db05 > ff02::2: ICMP6, router solicitation, length 16
19:24:59.821722 IP6 fe80::5c8b:9dff:fea2:9791 > ff02::2: ICMP6, router solicitation, length 16
19:24:59.857110 IP6 fe80::e808:33ff:fe54:271d > ff02::2: ICMP6, router solicitation, length 16
19:25:00.028759 IP6 fe80::2c73:30ff:fe5c:e4d5 > ff02::2: ICMP6, router solicitation, length 16
19:25:00.062605 IP 10.0.0.1 > 10.0.0.7: ICMP echo request, id 20405, seq 6, length 64
19:25:00.064064 IP 10.0.0.7 > 10.0.0.1: ICMP echo reply, id 20405, seq 6, length 64
19:25:00.443331 IP6 fe80::d838:8ff:fec3:b6a7 > ff02::2: ICMP6, router solicitation, length 16
19:25:00.494875 IP6 fe80::818:b8ff:fe4d:c1bc > ff02::2: ICMP6, router solicitation, length 16
19:25:00.774743 IP6 fe80::2814:20ff:fe5c:8e44 > ff02::2: ICMP6, router solicitation, length 16
19:25:00.998796 IP6 fe80::b083:e0ff:fea5:4712 > ff02::2: ICMP6, router solicitation, length 16
19:25:01.067040 IP6 fe80::c040:3fff:fe3e:e77e > ff02::2: ICMP6, router solicitation, length 16
19:25:01.074862 IP 10.0.0.1 > 10.0.0.7: ICMP echo request, id 20405, seq 7, length 64
19:25:01.076128 IP 10.0.0.7 > 10.0.0.1: ICMP echo reply, id 20405, seq 7, length 64
19:25:01.242230 IP6 fe80::e447:74ff:fe98:77d1 > ff02::2: ICMP6, router solicitation, length 16
19:25:01.415768 IP6 fe80::cc31:b6ff:fe6e:1a5e > ff02::2: ICMP6, router solicitation, length 16
19:25:01.582409 IP6 fe80::8898:37ff:fe6c:db05.5353 > ff02::fb.5353: 0 [2q] PTR (QM)? _ipps._tcp.local. PTR (QM)? _ipp._tcp.local. (45)
19:25:01.688345 IP6 fe80::20aa:a5ff:fece:4073 > ff02::2: ICMP6, router solicitation, length 16
19:25:01.776255 IP6 fe80::80ab:56ff:fea1:9d5 > ff02::2: ICMP6, router solicitation, length 16
19:25:01.995759 IP6 fe80::5c8b:9dff:fea2:9791.5353 > ff02::fb.5353: 0 [2q] PTR (QM)? _ipps._tcp.local. PTR (QM)? _ipp._tcp.local. (45)
19:25:02.000771 IP6 fe80::dc2f:cbff:fe7c:89f2 > ff02::2: ICMP6, router solicitation, length 16
19:25:02.066168 IP 10.0.0.1 > 10.0.0.7: ICMP echo request, id 20405, seq 8, length 64
19:25:02.067235 IP 10.0.0.7 > 10.0.0.1: ICMP echo reply, id 20405, seq 8, length 64
19:25:02.181370 IP6 fe80::388a:5cff:fee1:9d33.5353 > ff02::fb.5353: 0 [2q] PTR (QM)? _ipps._tcp.local. PTR (QM)? _ipp._tcp.local. (45)
19:25:02.264885 IP6 fe80::2c73:30ff:fe5c:e4d5.5353 > ff02::fb.5353: 0 [2q] PTR (QM)? _ipps._tcp.local. PTR (QM)? _ipp._tcp.local. (45)
19:25:02.456864 IP6 fe80::94d1:48ff:feca:6b88.5353 > ff02::fb.5353: 0 [2q] PTR (QM)? _ipps._tcp.local. PTR (QM)? _ipp._tcp.local. (45)
19:25:02.496069 ARP, Request who-has 10.0.0.1 tell 10.0.0.7, length 28
19:25:02.566152 IP6 fe80::e808:33ff:fe54:271d.5353 > ff02::fb.5353: 0 [2q] PTR (QM)? _ipps._tcp.local. PTR (QM)? _ipp._tcp.local. (45)
19:25:02.731080 ARP, Reply 10.0.0.1 is-at c6:a1:a0:c0:3f:a0, length 28
19:25:02.820712 IP6 fe80::852:e7ff:fe3d:a90 > ff02::2: ICMP6, router solicitation, length 16
19:25:02.863495 IP6 fe80::7cef:66ff:fed6:69cf.5353 > ff02::fb.5353: 0 [2q] PTR (QM)? _ipps._tcp.local. PTR (QM)? _ipp._tcp.local. (45)
19:25:03.013159 IP6 fe80::d439:80ff:fe51:b58f > ff02::2: ICMP6, router solicitation, length 16
19:25:03.032214 IP6 fe80::2814:20ff:fe5c:8e44.5353 > ff02::fb.5353: 0 [2q] PTR (QM)? _ipps._tcp.local. PTR (QM)? _ipp._tcp.local. (45)
19:25:03.083667 IP 10.0.0.1 > 10.0.0.7: ICMP echo request, id 20405, seq 9, length 64
19:25:03.085179 IP 10.0.0.7 > 10.0.0.1: ICMP echo reply, id 20405, seq 9, length 64
19:25:03.153494 IP6 fe80::84ae:97ff:fe66:9d1e > ff02::2: ICMP6, router solicitation, length 16
19:25:03.312549 IP6 fe80::5cfe:d6ff:fec4:679d > ff02::2: ICMP6, router solicitation, length 16
19:25:03.412961 IP6 fe80::cc54:e3ff:fe91:1be2.5353 > ff02::fb.5353: 0 [2q] PTR (QM)? _ipps._tcp.local. PTR (QM)? _ipp._tcp.local. (45)
19:25:03.452141 IP6 fe80::28c8:3ff:fe8a:7d66.5353 > ff02::fb.5353: 0 [2q] PTR (QM)? _ipps._tcp.local. PTR (QM)? _ipp._tcp.local. (45)
19:25:03.946228 IP6 fe80::c040:3fff:fe3e:e77e.5353 > ff02::fb.5353: 0 [2q] PTR (QM)? _ipps._tcp.local. PTR (QM)? _ipp._tcp.local. (45)
19:25:04.073263 IP 10.0.0.1 > 10.0.0.7: ICMP echo request, id 20405, seq 10, length 64
19:25:04.074819 IP 10.0.0.7 > 10.0.0.1: ICMP echo reply, id 20405, seq 10, length 64
19:25:04.106036 IP6 fe80::818:b8ff:fe4d:c1bc.5353 > ff02::fb.5353: 0 [2q] PTR (QM)? _ipps._tcp.local. PTR (QM)? _ipp._tcp.local. (45)
19:25:04.264576 IP6 fe80::dc2f:cbff:fe7c:89f2.5353 > ff02::fb.5353: 0 [2q] PTR (QM)? _ipps._tcp.local. PTR (QM)? _ipp._tcp.local. (45)
19:25:04.927138 IP6 fe80::d439:80ff:fe51:b58f.5353 > ff02::fb.5353: 0 [2q] PTR (QM)? _ipps._tcp.local. PTR (QM)? _ipp._tcp.local. (45)
19:25:05.071131 IP 10.0.0.1 > 10.0.0.7: ICMP echo request, id 20405, seq 11, length 64
19:25:05.072472 IP 10.0.0.7 > 10.0.0.1: ICMP echo reply, id 20405, seq 11, length 64
19:25:06.072062 IP 10.0.0.1 > 10.0.0.7: ICMP echo request, id 20405, seq 12, length 64
19:25:06.073430 IP 10.0.0.7 > 10.0.0.1: ICMP echo reply, id 20405, seq 12, length 64
19:25:07.073139 IP 10.0.0.1 > 10.0.0.7: ICMP echo request, id 20405, seq 13, length 64
19:25:07.074205 IP 10.0.0.7 > 10.0.0.1: ICMP echo reply, id 20405, seq 13, length 64
19:25:08.074287 IP 10.0.0.1 > 10.0.0.7: ICMP echo request, id 20405, seq 14, length 64
19:25:08.075349 IP 10.0.0.7 > 10.0.0.1: ICMP echo reply, id 20405, seq 14, length 64
19:25:09.076130 IP 10.0.0.1 > 10.0.0.7: ICMP echo request, id 20405, seq 15, length 64
19:25:09.077252 IP 10.0.0.7 > 10.0.0.1: ICMP echo reply, id 20405, seq 15, length 64
19:25:10.077756 IP 10.0.0.1 > 10.0.0.7: ICMP echo request, id 20405, seq 16, length 64
19:25:10.079291 IP 10.0.0.7 > 10.0.0.1: ICMP echo reply, id 20405, seq 16, length 64
19:25:11.078729 IP 10.0.0.1 > 10.0.0.7: ICMP echo request, id 20405, seq 17, length 64
19:25:11.079798 IP 10.0.0.7 > 10.0.0.1: ICMP echo reply, id 20405, seq 17, length 64
19:25:12.080573 IP 10.0.0.1 > 10.0.0.7: ICMP echo request, id 20405, seq 18, length 64
19:25:12.082366 IP 10.0.0.7 > 10.0.0.1: ICMP echo reply, id 20405, seq 18, length 64
19:25:12.105239 IP6 fe80::c4a1:a0ff:fec0:3fa0 > ff02::2: ICMP6, router solicitation, length 16
19:25:13.090625 IP 10.0.0.1 > 10.0.0.7: ICMP echo request, id 20405, seq 19, length 64
19:25:13.092788 IP 10.0.0.7 > 10.0.0.1: ICMP echo reply, id 20405, seq 19, length 64
19:25:13.322669 IP6 fe80::84d9:30ff:fe01:f809 > ff02::2: ICMP6, router solicitation, length 16
19:25:13.811944 IP6 fe80::388a:5cff:fee1:9d33 > ff02::2: ICMP6, router solicitation, length 16
19:25:14.093879 IP 10.0.0.1 > 10.0.0.7: ICMP echo request, id 20405, seq 20, length 64
19:25:14.094993 IP 10.0.0.7 > 10.0.0.1: ICMP echo reply, id 20405, seq 20, length 64
19:25:14.572134 IP6 fe80::b083:e0ff:fea5:4712 > ff02::2: ICMP6, router solicitation, length 16
19:25:14.779661 IP6 fe80::d838:8ff:fec3:b6a7 > ff02::2: ICMP6, router solicitation, length 16
19:25:15.116968 IP 10.0.0.1 > 10.0.0.7: ICMP echo request, id 20405, seq 21, length 64
19:25:15.118922 IP 10.0.0.7 > 10.0.0.1: ICMP echo reply, id 20405, seq 21, length 64
19:25:15.323048 IP6 fe80::818:b8ff:fe4d:c1bc > ff02::2: ICMP6, router solicitation, length 16
19:25:16.107591 IP 10.0.0.1 > 10.0.0.7: ICMP echo request, id 20405, seq 22, length 64
19:25:16.108953 IP 10.0.0.7 > 10.0.0.1: ICMP echo reply, id 20405, seq 22, length 64
19:25:16.359325 IP6 fe80::e447:74ff:fe98:77d1 > ff02::2: ICMP6, router solicitation, length 16
19:25:17.054125 IP6 fe80::94d1:48ff:feca:6b88 > ff02::2: ICMP6, router solicitation, length 16
19:25:17.119447 IP 10.0.0.1 > 10.0.0.7: ICMP echo request, id 20405, seq 23, length 64
19:25:17.132072 IP 10.0.0.7 > 10.0.0.1: ICMP echo reply, id 20405, seq 23, length 64
19:25:17.285982 IP6 fe80::7cef:66ff:fed6:69cf > ff02::2: ICMP6, router solicitation, length 16
19:25:17.669892 IP6 fe80::5c8b:9dff:fea2:9791 > ff02::2: ICMP6, router solicitation, length 16
19:25:17.904207 IP6 fe80::c040:3fff:fe3e:e77e > ff02::2: ICMP6, router solicitation, length 16
19:25:18.035729 IP6 fe80::8898:37ff:fe6c:db05 > ff02::2: ICMP6, router solicitation, length 16
19:25:18.133982 IP 10.0.0.1 > 10.0.0.7: ICMP echo request, id 20405, seq 24, length 64
19:25:18.436594 IP6 fe80::e808:33ff:fe54:271d > ff02::2: ICMP6, router solicitation, length 16
19:25:18.630471 IP6 fe80::cc31:b6ff:fe6e:1a5e > ff02::2: ICMP6, router solicitation, length 16
19:25:18.905418 IP6 fe80::8898:37ff:fe6c:db05.5353 > ff02::fb.5353: 0 [2q] PTR (QM)? _ipps._tcp.local. PTR (QM)? _ipp._tcp.local. (45)
19:25:19.074986 IP6 fe80::852:e7ff:fe3d:a90 > ff02::2: ICMP6, router solicitation, length 16
19:25:19.147152 IP 10.0.0.1 > 10.0.0.7: ICMP echo request, id 20405, seq 25, length 64
19:25:19.148600 IP 10.0.0.7 > 10.0.0.1: ICMP echo reply, id 20405, seq 25, length 64
19:25:19.207281 IP6 fe80::5c8b:9dff:fea2:9791.5353 > ff02::fb.5353: 0 [2q] PTR (QM)? _ipps._tcp.local. PTR (QM)? _ipp._tcp.local. (45)
19:25:19.385753 IP6 fe80::94d1:48ff:feca:6b88.5353 > ff02::fb.5353: 0 [2q] PTR (QM)? _ipps._tcp.local. PTR (QM)? _ipp._tcp.local. (45)
19:25:19.602125 IP6 fe80::2814:20ff:fe5c:8e44 > ff02::2: ICMP6, router solicitation, length 16
19:25:19.791141 IP6 fe80::28c8:3ff:fe8a:7d66 > ff02::2: ICMP6, router solicitation, length 16
19:25:19.984646 IP6 fe80::2814:20ff:fe5c:8e44.5353 > ff02::fb.5353: 0 [2q] PTR (QM)? _ipps._tcp.local. PTR (QM)? _ipp._tcp.local. (45)
19:25:20.123815 IP6 fe80::388a:5cff:fee1:9d33.5353 > ff02::fb.5353: 0 [2q] PTR (QM)? _ipps._tcp.local. PTR (QM)? _ipp._tcp.local. (45)
19:25:20.154689 IP 10.0.0.1 > 10.0.0.7: ICMP echo request, id 20405, seq 26, length 64
19:25:20.156336 IP 10.0.0.7 > 10.0.0.1: ICMP echo reply, id 20405, seq 26, length 64
19:25:20.296836 IP6 fe80::7cef:66ff:fed6:69cf.5353 > ff02::fb.5353: 0 [2q] PTR (QM)? _ipps._tcp.local. PTR (QM)? _ipp._tcp.local. (45)
19:25:20.409813 IP6 fe80::dc2f:cbff:fe7c:89f2.5353 > ff02::fb.5353: 0 [2q] PTR (QM)? _ipps._tcp.local. PTR (QM)? _ipp._tcp.local. (45)
19:25:20.464838 IP6 fe80::28c8:3ff:fe8a:7d66.5353 > ff02::fb.5353: 0 [2q] PTR (QM)? _ipps._tcp.local. PTR (QM)? _ipp._tcp.local. (45)
19:25:20.532278 IP6 fe80::818:b8ff:fe4d:c1bc.5353 > ff02::fb.5353: 0 [2q] PTR (QM)? _ipps._tcp.local. PTR (QM)? _ipp._tcp.local. (45)
19:25:20.584587 IP6 fe80::cc54:e3ff:fe91:1be2.5353 > ff02::fb.5353: 0 [2q] PTR (QM)? _ipps._tcp.local. PTR (QM)? _ipp._tcp.local. (45)
19:25:20.632940 IP6 fe80::2c73:30ff:fe5c:e4d5.5353 > ff02::fb.5353: 0 [2q] PTR (QM)? _ipps._tcp.local. PTR (QM)? _ipp._tcp.local. (45)
19:25:20.660312 IP6 fe80::c040:3fff:fe3e:e77e.5353 > ff02::fb.5353: 0 [2q] PTR (QM)? _ipps._tcp.local. PTR (QM)? _ipp._tcp.local. (45)
19:25:20.662312 IP6 fe80::2c73:30ff:fe5c:e4d5 > ff02::2: ICMP6, router solicitation, length 16
19:25:20.678984 IP6 fe80::d439:80ff:fe51:b58f > ff02::2: ICMP6, router solicitation, length 16
19:25:20.695985 IP6 fe80::dc2f:cbff:fe7c:89f2 > ff02::2: ICMP6, router solicitation, length 16
19:25:20.944686 IP6 fe80::d439:80ff:fe51:b58f.5353 > ff02::fb.5353: 0 [2q] PTR (QM)? _ipps._tcp.local. PTR (QM)? _ipp._tcp.local. (45)
19:25:20.948922 IP6 fe80::20aa:a5ff:fece:4073 > ff02::2: ICMP6, router solicitation, length 16
19:25:21.079682 IP6 fe80::84ae:97ff:fe66:9d1e > ff02::2: ICMP6, router solicitation, length 16
19:25:21.154911 IP 10.0.0.1 > 10.0.0.7: ICMP echo request, id 20405, seq 27, length 64
19:25:21.156027 IP 10.0.0.7 > 10.0.0.1: ICMP echo reply, id 20405, seq 27, length 64
19:25:22.156222 IP 10.0.0.1 > 10.0.0.7: ICMP echo request, id 20405, seq 28, length 64
19:25:22.157414 IP 10.0.0.7 > 10.0.0.1: ICMP echo reply, id 20405, seq 28, length 64
19:25:23.168950 IP 10.0.0.1 > 10.0.0.7: ICMP echo request, id 20405, seq 29, length 64
19:25:23.170183 IP 10.0.0.7 > 10.0.0.1: ICMP echo reply, id 20405, seq 29, length 64
19:25:24.158409 IP 10.0.0.1 > 10.0.0.7: ICMP echo request, id 20405, seq 30, length 64
19:25:24.159444 IP 10.0.0.7 > 10.0.0.1: ICMP echo reply, id 20405, seq 30, length 64
19:25:25.159565 IP 10.0.0.1 > 10.0.0.7: ICMP echo request, id 20405, seq 31, length 64
19:25:25.160680 IP 10.0.0.7 > 10.0.0.1: ICMP echo reply, id 20405, seq 31, length 64
19:25:27.170402 IP 10.0.0.1 > 10.0.0.7: ICMP echo request, id 20405, seq 33, length 64
19:25:27.171554 IP 10.0.0.7 > 10.0.0.1: ICMP echo reply, id 20405, seq 33, length 64
19:25:28.171656 IP 10.0.0.1 > 10.0.0.7: ICMP echo request, id 20405, seq 34, length 64
19:25:28.172719 IP 10.0.0.7 > 10.0.0.1: ICMP echo reply, id 20405, seq 34, length 64
19:25:29.173560 IP 10.0.0.1 > 10.0.0.7: ICMP echo request, id 20405, seq 35, length 64
19:25:29.175064 IP 10.0.0.7 > 10.0.0.1: ICMP echo reply, id 20405, seq 35, length 64
19:25:30.175296 IP 10.0.0.1 > 10.0.0.7: ICMP echo request, id 20405, seq 36, length 64
19:25:30.176558 IP 10.0.0.7 > 10.0.0.1: ICMP echo reply, id 20405, seq 36, length 64
19:25:31.176212 IP 10.0.0.1 > 10.0.0.7: ICMP echo request, id 20405, seq 37, length 64
19:25:31.177486 IP 10.0.0.7 > 10.0.0.1: ICMP echo reply, id 20405, seq 37, length 64
19:25:32.177414 IP 10.0.0.1 > 10.0.0.7: ICMP echo request, id 20405, seq 38, length 64
19:25:32.178584 IP 10.0.0.7 > 10.0.0.1: ICMP echo reply, id 20405, seq 38, length 64
19:25:33.180034 IP 10.0.0.1 > 10.0.0.7: ICMP echo request, id 20405, seq 39, length 64
19:25:33.181094 IP 10.0.0.7 > 10.0.0.1: ICMP echo reply, id 20405, seq 39, length 64
19:25:34.180143 IP 10.0.0.1 > 10.0.0.7: ICMP echo request, id 20405, seq 40, length 64
19:25:34.181268 IP 10.0.0.7 > 10.0.0.1: ICMP echo reply, id 20405, seq 40, length 64
19:25:34.235396 ARP, Request who-has 10.0.0.1 tell 10.0.0.7, length 28
19:25:34.252462 ARP, Reply 10.0.0.1 is-at c6:a1:a0:c0:3f:a0, length 28
19:25:35.182217 IP 10.0.0.1 > 10.0.0.7: ICMP echo request, id 20405, seq 41, length 64
19:25:35.183518 IP 10.0.0.7 > 10.0.0.1: ICMP echo reply, id 20405, seq 41, length 64
19:25:36.194774 IP 10.0.0.1 > 10.0.0.7: ICMP echo request, id 20405, seq 42, length 64
19:25:36.195937 IP 10.0.0.7 > 10.0.0.1: ICMP echo reply, id 20405, seq 42, length 64
19:25:37.195205 IP 10.0.0.1 > 10.0.0.7: ICMP echo request, id 20405, seq 43, length 64
19:25:37.196329 IP 10.0.0.7 > 10.0.0.1: ICMP echo reply, id 20405, seq 43, length 64
19:25:38.196214 IP 10.0.0.1 > 10.0.0.7: ICMP echo request, id 20405, seq 44, length 64
19:25:38.197362 IP 10.0.0.7 > 10.0.0.1: ICMP echo reply, id 20405, seq 44, length 64
19:25:39.197298 IP 10.0.0.1 > 10.0.0.7: ICMP echo request, id 20405, seq 45, length 64
19:25:39.198336 IP 10.0.0.7 > 10.0.0.1: ICMP echo reply, id 20405, seq 45, length 64
19:25:40.198468 IP 10.0.0.1 > 10.0.0.7: ICMP echo request, id 20405, seq 46, length 64
19:25:40.199504 IP 10.0.0.7 > 10.0.0.1: ICMP echo reply, id 20405, seq 46, length 64
19:25:41.200055 IP 10.0.0.1 > 10.0.0.7: ICMP echo request, id 20405, seq 47, length 64
19:25:41.201334 IP 10.0.0.7 > 10.0.0.1: ICMP echo reply, id 20405, seq 47, length 64
19:25:42.202317 IP 10.0.0.1 > 10.0.0.7: ICMP echo request, id 20405, seq 48, length 64
19:25:42.203419 IP 10.0.0.7 > 10.0.0.1: ICMP echo reply, id 20405, seq 48, length 64
19:25:43.206797 IP 10.0.0.1 > 10.0.0.7: ICMP echo request, id 20405, seq 49, length 64
19:25:43.263741 IP6 fe80::b083:e0ff:fea5:4712 > ff02::2: ICMP6, router solicitation, length 16
19:25:43.341792 IP6 fe80::cc54:e3ff:fe91:1be2 > ff02::2: ICMP6, router solicitation, length 16
19:25:43.501086 IP6 fe80::c4a1:a0ff:fec0:3fa0 > ff02::2: ICMP6, router solicitation, length 16
19:25:43.556730 IP6 fe80::84d9:30ff:fe01:f809 > ff02::2: ICMP6, router solicitation, length 16
19:25:44.226410 IP 10.0.0.1 > 10.0.0.7: ICMP echo request, id 20405, seq 50, length 64
19:25:44.227473 IP 10.0.0.7 > 10.0.0.1: ICMP echo reply, id 20405, seq 50, length 64
19:25:45.243493 IP6 fe80::d838:8ff:fec3:b6a7 > ff02::2: ICMP6, router solicitation, length 16
19:25:45.251839 IP 10.0.0.1 > 10.0.0.7: ICMP echo request, id 20405, seq 51, length 64
19:25:45.253790 IP 10.0.0.7 > 10.0.0.1: ICMP echo reply, id 20405, seq 51, length 64
19:25:45.282811 IP6 fe80::e447:74ff:fe98:77d1 > ff02::2: ICMP6, router solicitation, length 16
19:25:45.352555 IP6 fe80::818:b8ff:fe4d:c1bc > ff02::2: ICMP6, router solicitation, length 16
19:25:45.402887 IP6 fe80::388a:5cff:fee1:9d33 > ff02::2: ICMP6, router solicitation, length 16
19:25:46.251966 IP 10.0.0.1 > 10.0.0.7: ICMP echo request, id 20405, seq 52, length 64
19:25:46.253310 IP 10.0.0.7 > 10.0.0.1: ICMP echo reply, id 20405, seq 52, length 64
19:25:47.252015 IP 10.0.0.1 > 10.0.0.7: ICMP echo request, id 20405, seq 53, length 64
19:25:47.253212 IP 10.0.0.7 > 10.0.0.1: ICMP echo reply, id 20405, seq 53, length 64
19:25:48.253502 IP 10.0.0.1 > 10.0.0.7: ICMP echo request, id 20405, seq 54, length 64
19:25:48.254741 IP 10.0.0.7 > 10.0.0.1: ICMP echo reply, id 20405, seq 54, length 64
19:25:48.375189 ARP, Request who-has 10.0.0.7 tell 10.0.0.1, length 28
19:25:48.377229 ARP, Reply 10.0.0.7 is-at da:38:08:c3:b6:a7, length 28
19:25:49.254152 IP 10.0.0.1 > 10.0.0.7: ICMP echo request, id 20405, seq 55, length 64
19:25:49.255534 IP 10.0.0.7 > 10.0.0.1: ICMP echo reply, id 20405, seq 55, length 64
19:25:49.382965 IP6 fe80::8898:37ff:fe6c:db05.5353 > ff02::fb.5353: 0 [2q] PTR (QM)? _ipps._tcp.local. PTR (QM)? _ipp._tcp.local. (45)
19:25:49.417987 IP6 fe80::852:e7ff:fe3d:a90 > ff02::2: ICMP6, router solicitation, length 16
19:25:49.500982 IP6 fe80::7cef:66ff:fed6:69cf > ff02::2: ICMP6, router solicitation, length 16
19:25:49.651682 IP6 fe80::c040:3fff:fe3e:e77e > ff02::2: ICMP6, router solicitation, length 16
19:25:49.726385 IP6 fe80::cc31:b6ff:fe6e:1a5e > ff02::2: ICMP6, router solicitation, length 16
19:25:50.195841 IP6 fe80::388a:5cff:fee1:9d33.5353 > ff02::fb.5353: 0 [2q] PTR (QM)? _ipps._tcp.local. PTR (QM)? _ipp._tcp.local. (45)
19:25:50.257398 IP 10.0.0.1 > 10.0.0.7: ICMP echo request, id 20405, seq 56, length 64
19:25:50.258436 IP 10.0.0.7 > 10.0.0.1: ICMP echo reply, id 20405, seq 56, length 64
19:25:50.277907 IP6 fe80::2c73:30ff:fe5c:e4d5.5353 > ff02::fb.5353: 0 [2q] PTR (QM)? _ipps._tcp.local. PTR (QM)? _ipp._tcp.local. (45)
19:25:50.462897 IP6 fe80::94d1:48ff:feca:6b88.5353 > ff02::fb.5353: 0 [2q] PTR (QM)? _ipps._tcp.local. PTR (QM)? _ipp._tcp.local. (45)
19:25:50.542764 IP6 fe80::e808:33ff:fe54:271d.5353 > ff02::fb.5353: 0 [2q] PTR (QM)? _ipps._tcp.local. PTR (QM)? _ipp._tcp.local. (45)
19:25:50.734428 IP6 fe80::7cef:66ff:fed6:69cf.5353 > ff02::fb.5353: 0 [2q] PTR (QM)? _ipps._tcp.local. PTR (QM)? _ipp._tcp.local. (45)
19:25:50.962285 IP6 fe80::2814:20ff:fe5c:8e44.5353 > ff02::fb.5353: 0 [2q] PTR (QM)? _ipps._tcp.local. PTR (QM)? _ipp._tcp.local. (45)
19:25:51.258247 IP 10.0.0.1 > 10.0.0.7: ICMP echo request, id 20405, seq 57, length 64
19:25:51.259468 IP 10.0.0.7 > 10.0.0.1: ICMP echo reply, id 20405, seq 57, length 64
19:25:51.387383 IP6 fe80::cc54:e3ff:fe91:1be2.5353 > ff02::fb.5353: 0 [2q] PTR (QM)? _ipps._tcp.local. PTR (QM)? _ipp._tcp.local. (45)
19:25:51.461318 IP6 fe80::28c8:3ff:fe8a:7d66 > ff02::2: ICMP6, router solicitation, length 16
19:25:51.570831 IP6 fe80::28c8:3ff:fe8a:7d66.5353 > ff02::fb.5353: 0 [2q] PTR (QM)? _ipps._tcp.local. PTR (QM)? _ipp._tcp.local. (45)
19:25:51.644241 IP6 fe80::94d1:48ff:feca:6b88 > ff02::2: ICMP6, router solicitation, length 16
19:25:51.727080 IP6 fe80::5c8b:9dff:fea2:9791 > ff02::2: ICMP6, router solicitation, length 16
19:25:51.777104 IP6 fe80::8898:37ff:fe6c:db05 > ff02::2: ICMP6, router solicitation, length 16
19:25:51.834613 IP6 fe80::e808:33ff:fe54:271d > ff02::2: ICMP6, router solicitation, length 16
19:25:52.095309 IP6 fe80::818:b8ff:fe4d:c1bc.5353 > ff02::fb.5353: 0 [2q] PTR (QM)? _ipps._tcp.local. PTR (QM)? _ipp._tcp.local. (45)
19:25:52.266593 IP6 fe80::dc2f:cbff:fe7c:89f2.5353 > ff02::fb.5353: 0 [2q] PTR (QM)? _ipps._tcp.local. PTR (QM)? _ipp._tcp.local. (45)
19:25:52.934665 IP6 fe80::d439:80ff:fe51:b58f.5353 > ff02::fb.5353: 0 [2q] PTR (QM)? _ipps._tcp.local. PTR (QM)? _ipp._tcp.local. (45)
19:25:53.282154 IP 10.0.0.1 > 10.0.0.7: ICMP echo request, id 20405, seq 59, length 64
19:25:53.283569 IP 10.0.0.7 > 10.0.0.1: ICMP echo reply, id 20405, seq 59, length 64
19:25:53.471877 IP6 fe80::2814:20ff:fe5c:8e44 > ff02::2: ICMP6, router solicitation, length 16
19:25:53.566266 IP6 fe80::2c73:30ff:fe5c:e4d5 > ff02::2: ICMP6, router solicitation, length 16
19:25:54.283357 IP 10.0.0.1 > 10.0.0.7: ICMP echo request, id 20405, seq 60, length 64
19:25:54.284469 IP 10.0.0.7 > 10.0.0.1: ICMP echo reply, id 20405, seq 60, length 64
19:25:55.284654 IP 10.0.0.1 > 10.0.0.7: ICMP echo request, id 20405, seq 61, length 64
19:25:55.285965 IP 10.0.0.7 > 10.0.0.1: ICMP echo reply, id 20405, seq 61, length 64
19:25:55.483500 IP6 fe80::d439:80ff:fe51:b58f > ff02::2: ICMP6, router solicitation, length 16
19:25:55.539691 IP6 fe80::80ab:56ff:fea1:9d5 > ff02::2: ICMP6, router solicitation, length 16
19:25:55.563014 IP6 fe80::5cfe:d6ff:fec4:679d > ff02::2: ICMP6, router solicitation, length 16
19:25:56.286101 IP 10.0.0.1 > 10.0.0.7: ICMP echo request, id 20405, seq 62, length 64
19:25:56.287200 IP 10.0.0.7 > 10.0.0.1: ICMP echo reply, id 20405, seq 62, length 64
19:25:57.286185 IP 10.0.0.1 > 10.0.0.7: ICMP echo request, id 20405, seq 63, length 64
19:25:57.287359 IP 10.0.0.7 > 10.0.0.1: ICMP echo reply, id 20405, seq 63, length 64
19:25:57.545570 IP6 fe80::dc2f:cbff:fe7c:89f2 > ff02::2: ICMP6, router solicitation, length 16
19:25:57.579354 IP6 fe80::84ae:97ff:fe66:9d1e > ff02::2: ICMP6, router solicitation, length 16
19:25:57.610733 IP6 fe80::20aa:a5ff:fece:4073 > ff02::2: ICMP6, router solicitation, length 16
19:25:58.287520 IP 10.0.0.1 > 10.0.0.7: ICMP echo request, id 20405, seq 64, length 64
19:25:58.288570 IP 10.0.0.7 > 10.0.0.1: ICMP echo reply, id 20405, seq 64, length 64
19:25:59.292936 IP 10.0.0.1 > 10.0.0.7: ICMP echo request, id 20405, seq 65, length 64
19:25:59.294909 IP 10.0.0.7 > 10.0.0.1: ICMP echo reply, id 20405, seq 65, length 64
19:26:00.289889 IP 10.0.0.1 > 10.0.0.7: ICMP echo request, id 20405, seq 66, length 64
19:26:00.291076 IP 10.0.0.7 > 10.0.0.1: ICMP echo reply, id 20405, seq 66, length 64
19:26:01.291291 IP 10.0.0.1 > 10.0.0.7: ICMP echo request, id 20405, seq 67, length 64
19:26:01.292496 IP 10.0.0.7 > 10.0.0.1: ICMP echo reply, id 20405, seq 67, length 64
19:26:02.293173 IP 10.0.0.1 > 10.0.0.7: ICMP echo request, id 20405, seq 68, length 64
19:26:02.294571 IP 10.0.0.7 > 10.0.0.1: ICMP echo reply, id 20405, seq 68, length 64
19:26:03.294599 IP 10.0.0.1 > 10.0.0.7: ICMP echo request, id 20405, seq 69, length 64
19:26:03.295858 IP 10.0.0.7 > 10.0.0.1: ICMP echo reply, id 20405, seq 69, length 64
19:26:04.295628 IP 10.0.0.1 > 10.0.0.7: ICMP echo request, id 20405, seq 70, length 64
19:26:04.296766 IP 10.0.0.7 > 10.0.0.1: ICMP echo reply, id 20405, seq 70, length 64
19:26:05.297533 IP 10.0.0.1 > 10.0.0.7: ICMP echo request, id 20405, seq 71, length 64
19:26:05.298583 IP 10.0.0.7 > 10.0.0.1: ICMP echo reply, id 20405, seq 71, length 64
19:26:05.467518 ARP, Request who-has 10.0.0.1 tell 10.0.0.7, length 28
19:26:05.483808 ARP, Reply 10.0.0.1 is-at c6:a1:a0:c0:3f:a0, length 28
19:26:06.300447 IP 10.0.0.1 > 10.0.0.7: ICMP echo request, id 20405, seq 72, length 64
19:26:06.301764 IP 10.0.0.7 > 10.0.0.1: ICMP echo reply, id 20405, seq 72, length 64
19:26:07.300031 IP 10.0.0.1 > 10.0.0.7: ICMP echo request, id 20405, seq 73, length 64
19:26:07.301276 IP 10.0.0.7 > 10.0.0.1: ICMP echo reply, id 20405, seq 73, length 64
19:26:08.300368 IP 10.0.0.1 > 10.0.0.7: ICMP echo request, id 20405, seq 74, length 64
19:26:08.301494 IP 10.0.0.7 > 10.0.0.1: ICMP echo reply, id 20405, seq 74, length 64
19:26:09.301463 IP 10.0.0.1 > 10.0.0.7: ICMP echo request, id 20405, seq 75, length 64
19:26:09.302968 IP 10.0.0.7 > 10.0.0.1: ICMP echo reply, id 20405, seq 75, length 64
19:26:10.302523 IP 10.0.0.1 > 10.0.0.7: ICMP echo request, id 20405, seq 76, length 64
19:26:10.303745 IP 10.0.0.7 > 10.0.0.1: ICMP echo reply, id 20405, seq 76, length 64
19:26:11.306625 IP 10.0.0.1 > 10.0.0.7: ICMP echo request, id 20405, seq 77, length 64
19:26:11.307908 IP 10.0.0.7 > 10.0.0.1: ICMP echo reply, id 20405, seq 77, length 64
19:26:12.307582 IP 10.0.0.1 > 10.0.0.7: ICMP echo request, id 20405, seq 78, length 64
19:26:12.308675 IP 10.0.0.7 > 10.0.0.1: ICMP echo reply, id 20405, seq 78, length 64
19:26:13.309922 IP 10.0.0.1 > 10.0.0.7: ICMP echo request, id 20405, seq 79, length 64
19:26:13.311031 IP 10.0.0.7 > 10.0.0.1: ICMP echo reply, id 20405, seq 79, length 64
19:26:14.338884 IP 10.0.0.1 > 10.0.0.7: ICMP echo request, id 20405, seq 80, length 64
19:26:14.340155 IP 10.0.0.7 > 10.0.0.1: ICMP echo reply, id 20405, seq 80, length 64
