19:55:15.834696 IP6 fe80::a472:7dff:fee5:a2de.5353 > ff02::fb.5353: 0 [2q] [2n] ANY (QM)? e.d.2.a.5.e.e.f.f.f.d.7.2.7.4.a.0.0.0.0.0.0.0.0.0.0.0.0.0.8.e.f.ip6.arpa. ANY (QM)? sam-VirtualBox.local. (158)
19:55:15.916101 IP6 fe80::f433:19ff:fef9:b3bd.5353 > ff02::fb.5353: 0*- [0q] 2/0/0 (Cache flush) PTR sam-VirtualBox.local., (Cache flush) AAAA fe80::f433:19ff:fef9:b3bd (146)
19:55:15.957521 IP6 fe80::382c:d8ff:fe01:a79.5353 > ff02::fb.5353: 0 [2q] PTR (QM)? _ipps._tcp.local. PTR (QM)? _ipp._tcp.local. (45)
19:55:15.963722 IP6 fe80::a472:7dff:fee5:a2de > ff02::16: HBH ICMP6, multicast listener report v2, 1 group record(s), length 28
19:55:16.028260 IP6 fe80::a472:7dff:fee5:a2de.5353 > ff02::fb.5353: 0*- [0q] 2/0/0 (Cache flush) PTR sam-VirtualBox.local., (Cache flush) AAAA fe80::a472:7dff:fee5:a2de (146)
19:55:16.242783 IP6 fe80::f433:19ff:fef9:b3bd.5353 > ff02::fb.5353: 0 [2q] PTR (QM)? _ipps._tcp.local. PTR (QM)? _ipp._tcp.local. (45)
19:55:16.262429 IP6 fe80::688b:43ff:fe67:30c1 > ff02::16: HBH ICMP6, multicast listener report v2, 1 group record(s), length 28
19:55:16.372941 IP6 fe80::a472:7dff:fee5:a2de.5353 > ff02::fb.5353: 0 [2q] PTR (QM)? _ipps._tcp.local. PTR (QM)? _ipp._tcp.local. (45)
19:55:16.624101 IP6 fe80::382c:d8ff:fe01:a79.5353 > ff02::fb.5353: 0*- [0q] 2/0/0 (Cache flush) PTR sam-VirtualBox.local., (Cache flush) AAAA fe80::382c:d8ff:fe01:a79 (146)
19:55:16.655571 IP6 fe80::cca6:3ff:fef5:d652.5353 > ff02::fb.5353: 0*- [0q] 2/0/0 (Cache flush) PTR sam-VirtualBox.local., (Cache flush) AAAA fe80::cca6:3ff:fef5:d652 (146)
19:55:16.677547 IP6 fe80::58bb:92ff:fe43:52e7.5353 > ff02::fb.5353: 0 [2q] PTR (QM)? _ipps._tcp.local. PTR (QM)? _ipp._tcp.local. (45)
19:55:16.694860 IP6 fe80::fc5c:aff:fe2f:f238.5353 > ff02::fb.5353: 0*- [0q] 2/0/0 (Cache flush) PTR sam-VirtualBox.local., (Cache flush) AAAA fe80::fc5c:aff:fe2f:f238 (146)
19:55:16.741175 ARP, Request who-has 10.0.0.7 tell 10.0.0.1, length 28
19:55:16.744645 ARP, Reply 10.0.0.7 is-at 2e:11:3e:f0:3f:c9, length 28
19:55:16.792831 IP6 fe80::f0c2:bff:fea9:a5a4.5353 > ff02::fb.5353: 0 [2q] PTR (QM)? _ipps._tcp.local. PTR (QM)? _ipp._tcp.local. (45)
19:55:16.844943 IP6 fe80::7891:4aff:fe35:4cd7.5353 > ff02::fb.5353: 0 [2q] PTR (QM)? _ipps._tcp.local. PTR (QM)? _ipp._tcp.local. (45)
19:55:16.864987 IP 10.0.0.1 > 10.0.0.7: ICMP echo request, id 23946, seq 1, length 64
19:55:16.866476 IP 10.0.0.7 > 10.0.0.1: ICMP echo reply, id 23946, seq 1, length 64
19:55:16.869694 IP 10.0.0.1 > 10.0.0.7: ICMP echo request, id 23946, seq 2, length 64
19:55:16.873337 IP 10.0.0.7 > 10.0.0.1: ICMP echo reply, id 23946, seq 2, length 64
19:55:16.922548 IP6 fe80::f433:19ff:fef9:b3bd.5353 > ff02::fb.5353: 0*- [0q] 2/0/0 (Cache flush) PTR sam-VirtualBox.local., (Cache flush) AAAA fe80::f433:19ff:fef9:b3bd (146)
19:55:17.034912 IP6 fe80::a472:7dff:fee5:a2de.5353 > ff02::fb.5353: 0*- [0q] 2/0/0 (Cache flush) PTR sam-VirtualBox.local., (Cache flush) AAAA fe80::a472:7dff:fee5:a2de (146)
19:55:17.113618 IP6 fe80::44a7:c7ff:fe43:2a0.5353 > ff02::fb.5353: 0 [2q] PTR (QM)? _ipps._tcp.local. PTR (QM)? _ipp._tcp.local. (45)
19:55:17.327345 IP6 fe80::f0c2:bff:fea9:a5a4 > ff02::2: ICMP6, router solicitation, length 16
19:55:17.355685 IP6 fe80::58bb:92ff:fe43:52e7.5353 > ff02::fb.5353: 0*- [0q] 2/0/0 (Cache flush) PTR sam-VirtualBox.local., (Cache flush) AAAA fe80::58bb:92ff:fe43:52e7 (146)
19:55:17.364788 IP6 fe80::1443:bdff:fef2:58b5.5353 > ff02::fb.5353: 0 [2q] PTR (QM)? _ipps._tcp.local. PTR (QM)? _ipp._tcp.local. (45)
19:55:17.395829 IP6 fe80::6cad:5eff:fe88:d491.5353 > ff02::fb.5353: 0 [2q] PTR (QM)? _ipps._tcp.local. PTR (QM)? _ipp._tcp.local. (45)
19:55:17.462985 IP6 fe80::288c:74ff:fe5e:2f60.5353 > ff02::fb.5353: 0 [2q] PTR (QM)? _ipps._tcp.local. PTR (QM)? _ipp._tcp.local. (45)
19:55:17.525991 IP6 fe80::7891:4aff:fe35:4cd7.5353 > ff02::fb.5353: 0*- [0q] 2/0/0 (Cache flush) PTR sam-VirtualBox.local., (Cache flush) AAAA fe80::7891:4aff:fe35:4cd7 (146)
19:55:17.544043 IP6 fe80::7812:1cff:fee6:ae49.5353 > ff02::fb.5353: 0 [2q] PTR (QM)? _ipps._tcp.local. PTR (QM)? _ipp._tcp.local. (45)
19:55:17.563532 IP6 fe80::38d7:19ff:fedb:ea0.5353 > ff02::fb.5353: 0 [2q] PTR (QM)? _ipps._tcp.local. PTR (QM)? _ipp._tcp.local. (45)
19:55:17.588354 IP6 fe80::58bb:92ff:fe43:52e7 > ff02::2: ICMP6, router solicitation, length 16
19:55:17.718485 IP 10.0.0.1 > 10.0.0.7: ICMP echo request, id 23946, seq 3, length 64
19:55:17.719598 IP 10.0.0.7 > 10.0.0.1: ICMP echo reply, id 23946, seq 3, length 64
19:55:17.787860 IP6 fe80::44a7:c7ff:fe43:2a0.5353 > ff02::fb.5353: 0*- [0q] 2/0/0 (Cache flush) PTR sam-VirtualBox.local., (Cache flush) AAAA fe80::44a7:c7ff:fe43:2a0 (146)
19:55:17.847482 IP6 fe80::145a:f0ff:fe39:c26c > ff02::2: ICMP6, router solicitation, length 16
19:55:17.960549 IP6 fe80::382c:d8ff:fe01:a79.5353 > ff02::fb.5353: 0 [2q] PTR (QM)? _ipps._tcp.local. PTR (QM)? _ipp._tcp.local. (45)
19:55:17.985237 IP6 fe80::cca6:3ff:fef5:d652.5353 > ff02::fb.5353: 0 [2q] PTR (QM)? _ipps._tcp.local. PTR (QM)? _ipp._tcp.local. (45)
19:55:17.999033 IP6 fe80::fc5c:aff:fe2f:f238.5353 > ff02::fb.5353: 0 [2q] PTR (QM)? _ipps._tcp.local. PTR (QM)? _ipp._tcp.local. (45)
19:55:18.040087 IP6 fe80::1443:bdff:fef2:58b5.5353 > ff02::fb.5353: 0*- [0q] 2/0/0 (Cache flush) PTR sam-VirtualBox.local., (Cache flush) AAAA fe80::1443:bdff:fef2:58b5 (146)
19:55:18.084887 IP6 fe80::6cad:5eff:fe88:d491 > ff02::2: ICMP6, router solicitation, length 16
19:55:18.115218 IP6 fe80::7891:4aff:fe35:4cd7 > ff02::2: ICMP6, router solicitation, length 16
19:55:18.154816 IP6 fe80::7812:1cff:fee6:ae49 > ff02::2: ICMP6, router solicitation, length 16
19:55:18.174710 IP6 fe80::288c:74ff:fe5e:2f60.5353 > ff02::fb.5353: 0*- [0q] 2/0/0 (Cache flush) PTR sam-VirtualBox.local., (Cache flush) AAAA fe80::288c:74ff:fe5e:2f60 (146)
19:55:18.202058 IP6 fe80::7812:1cff:fee6:ae49.5353 > ff02::fb.5353: 0*- [0q] 2/0/0 (Cache flush) PTR sam-VirtualBox.local., (Cache flush) AAAA fe80::7812:1cff:fee6:ae49 (146)
19:55:18.212026 IP6 fe80::38d7:19ff:fedb:ea0.5353 > ff02::fb.5353: 0*- [0q] 2/0/0 (Cache flush) PTR sam-VirtualBox.local., (Cache flush) AAAA fe80::38d7:19ff:fedb:ea0 (146)
19:55:18.245397 IP6 fe80::f433:19ff:fef9:b3bd.5353 > ff02::fb.5353: 0 [2q] PTR (QM)? _ipps._tcp.local. PTR (QM)? _ipp._tcp.local. (45)
19:55:18.339584 IP6 fe80::288c:74ff:fe5e:2f60 > ff02::2: ICMP6, router solicitation, length 16
19:55:18.359587 IP6 fe80::38d7:19ff:fedb:ea0 > ff02::2: ICMP6, router solicitation, length 16
19:55:18.374989 IP6 fe80::a472:7dff:fee5:a2de.5353 > ff02::fb.5353: 0 [2q] PTR (QM)? _ipps._tcp.local. PTR (QM)? _ipp._tcp.local. (45)
19:55:18.407043 IP6 fe80::1443:bdff:fef2:58b5 > ff02::2: ICMP6, router solicitation, length 16
19:55:18.425420 IP6 fe80::44a7:c7ff:fe43:2a0 > ff02::2: ICMP6, router solicitation, length 16
19:55:18.635415 IP6 fe80::fce1:37ff:fe16:dac3 > ff02::2: ICMP6, router solicitation, length 16
19:55:18.658518 IP6 fe80::382c:d8ff:fe01:a79.5353 > ff02::fb.5353: 0*- [0q] 2/0/0 (Cache flush) PTR sam-VirtualBox.local., (Cache flush) AAAA fe80::382c:d8ff:fe01:a79 (146)
19:55:18.674715 IP6 fe80::64b4:55ff:fea0:fdb5 > ff02::2: ICMP6, router solicitation, length 16
19:55:18.687844 IP6 fe80::c8a6:1fff:fec9:6ebd > ff02::2: ICMP6, router solicitation, length 16
19:55:18.705211 IP6 fe80::cca6:3ff:fef5:d652.5353 > ff02::fb.5353: 0*- [0q] 2/0/0 (Cache flush) PTR sam-VirtualBox.local., (Cache flush) AAAA fe80::cca6:3ff:fef5:d652 (146)
19:55:18.717929 IP6 fe80::fc5c:aff:fe2f:f238.5353 > ff02::fb.5353: 0*- [0q] 2/0/0 (Cache flush) PTR sam-VirtualBox.local., (Cache flush) AAAA fe80::fc5c:aff:fe2f:f238 (146)
19:55:18.734723 IP 10.0.0.1 > 10.0.0.7: ICMP echo request, id 23946, seq 4, length 64
19:55:18.737974 IP 10.0.0.7 > 10.0.0.1: ICMP echo reply, id 23946, seq 4, length 64
19:55:18.855465 IP6 fe80::fc5c:aff:fe2f:f238 > ff02::2: ICMP6, router solicitation, length 16
19:55:18.927965 IP6 fe80::f433:19ff:fef9:b3bd.5353 > ff02::fb.5353: 0*- [0q] 2/0/0 (Cache flush) PTR sam-VirtualBox.local., (Cache flush) AAAA fe80::f433:19ff:fef9:b3bd (146)
19:55:19.041836 IP6 fe80::a472:7dff:fee5:a2de.5353 > ff02::fb.5353: 0*- [0q] 2/0/0 (Cache flush) PTR sam-VirtualBox.local., (Cache flush) AAAA fe80::a472:7dff:fee5:a2de (146)
19:55:19.067480 IP6 fe80::2c11:3eff:fef0:3fc9 > ff02::2: ICMP6, router solicitation, length 16
19:55:19.067474 IP6 fe80::a472:7dff:fee5:a2de > ff02::2: ICMP6, router solicitation, length 16
19:55:19.095284 IP6 fe80::382c:d8ff:fe01:a79 > ff02::2: ICMP6, router solicitation, length 16
19:55:19.105298 IP6 fe80::2c55:aff:fe5e:9590 > ff02::2: ICMP6, router solicitation, length 16
19:55:19.151294 IP6 fe80::4c4e:cfff:fef4:e5e > ff02::2: ICMP6, router solicitation, length 16
19:55:19.337483 IP6 fe80::f433:19ff:fef9:b3bd > ff02::2: ICMP6, router solicitation, length 16
19:55:19.375714 IP6 fe80::cca6:3ff:fef5:d652 > ff02::2: ICMP6, router solicitation, length 16
19:55:19.384690 IP6 fe80::8406:f4ff:fe8e:740c > ff02::2: ICMP6, router solicitation, length 16
19:55:19.589593 IP6 fe80::688b:43ff:fe67:30c1 > ff02::2: ICMP6, router solicitation, length 16
19:55:19.629679 IP6 fe80::8094:19ff:fed3:3173 > ff02::2: ICMP6, router solicitation, length 16
19:55:19.645414 IP6 fe80::e4ab:d7ff:feae:e754 > ff02::2: ICMP6, router solicitation, length 16
19:55:19.717945 IP 10.0.0.1 > 10.0.0.7: ICMP echo request, id 23946, seq 5, length 64
19:55:19.719000 IP 10.0.0.7 > 10.0.0.1: ICMP echo reply, id 23946, seq 5, length 64
19:55:20.647613 IP6 fe80::58bb:92ff:fe43:52e7.5353 > ff02::fb.5353: 0 [2q] PTR (QM)? _ipps._tcp.local. PTR (QM)? _ipp._tcp.local. (45)
19:55:20.718753 IP 10.0.0.1 > 10.0.0.7: ICMP echo request, id 23946, seq 6, length 64
19:55:20.719911 IP 10.0.0.7 > 10.0.0.1: ICMP echo reply, id 23946, seq 6, length 64
19:55:20.774896 IP6 fe80::f0c2:bff:fea9:a5a4.5353 > ff02::fb.5353: 0 [2q] PTR (QM)? _ipps._tcp.local. PTR (QM)? _ipp._tcp.local. (45)
19:55:20.835164 IP6 fe80::7891:4aff:fe35:4cd7.5353 > ff02::fb.5353: 0 [2q] PTR (QM)? _ipps._tcp.local. PTR (QM)? _ipp._tcp.local. (45)
19:55:21.115137 IP6 fe80::44a7:c7ff:fe43:2a0.5353 > ff02::fb.5353: 0 [2q] PTR (QM)? _ipps._tcp.local. PTR (QM)? _ipp._tcp.local. (45)
19:55:21.353903 IP6 fe80::1443:bdff:fef2:58b5.5353 > ff02::fb.5353: 0 [2q] PTR (QM)? _ipps._tcp.local. PTR (QM)? _ipp._tcp.local. (45)
19:55:21.391091 IP6 fe80::6cad:5eff:fe88:d491.5353 > ff02::fb.5353: 0 [2q] PTR (QM)? _ipps._tcp.local. PTR (QM)? _ipp._tcp.local. (45)
19:55:21.470026 IP6 fe80::288c:74ff:fe5e:2f60.5353 > ff02::fb.5353: 0 [2q] PTR (QM)? _ipps._tcp.local. PTR (QM)? _ipp._tcp.local. (45)
19:55:21.539779 IP6 fe80::7812:1cff:fee6:ae49.5353 > ff02::fb.5353: 0 [2q] PTR (QM)? _ipps._tcp.local. PTR (QM)? _ipp._tcp.local. (45)
19:55:21.550879 IP6 fe80::38d7:19ff:fedb:ea0.5353 > ff02::fb.5353: 0 [2q] PTR (QM)? _ipps._tcp.local. PTR (QM)? _ipp._tcp.local. (45)
19:55:21.727924 IP 10.0.0.1 > 10.0.0.7: ICMP echo request, id 23946, seq 7, length 64
19:55:21.730920 IP 10.0.0.7 > 10.0.0.1: ICMP echo reply, id 23946, seq 7, length 64
19:55:21.883724 ARP, Request who-has 10.0.0.1 tell 10.0.0.7, length 28
19:55:21.960405 IP6 fe80::382c:d8ff:fe01:a79.5353 > ff02::fb.5353: 0 [2q] PTR (QM)? _ipps._tcp.local. PTR (QM)? _ipp._tcp.local. (45)
19:55:21.971105 ARP, Reply 10.0.0.1 is-at 16:5a:f0:39:c2:6c, length 28
19:55:21.992794 IP6 fe80::cca6:3ff:fef5:d652.5353 > ff02::fb.5353: 0 [2q] PTR (QM)? _ipps._tcp.local. PTR (QM)? _ipp._tcp.local. (45)
19:55:22.003000 IP6 fe80::fc5c:aff:fe2f:f238.5353 > ff02::fb.5353: 0 [2q] PTR (QM)? _ipps._tcp.local. PTR (QM)? _ipp._tcp.local. (45)
19:55:22.247896 IP6 fe80::f433:19ff:fef9:b3bd.5353 > ff02::fb.5353: 0 [2q] PTR (QM)? _ipps._tcp.local. PTR (QM)? _ipp._tcp.local. (45)
19:55:22.369900 IP6 fe80::a472:7dff:fee5:a2de.5353 > ff02::fb.5353: 0 [2q] PTR (QM)? _ipps._tcp.local. PTR (QM)? _ipp._tcp.local. (45)
19:55:22.723118 IP 10.0.0.1 > 10.0.0.7: ICMP echo request, id 23946, seq 8, length 64
19:55:22.724358 IP 10.0.0.7 > 10.0.0.1: ICMP echo reply, id 23946, seq 8, length 64
19:55:23.724835 IP 10.0.0.1 > 10.0.0.7: ICMP echo request, id 23946, seq 9, length 64
19:55:23.725891 IP 10.0.0.7 > 10.0.0.1: ICMP echo reply, id 23946, seq 9, length 64
19:55:24.490807 IP6 fe80::f0c2:bff:fea9:a5a4 > ff02::2: ICMP6, router solicitation, length 16
19:55:24.724669 IP 10.0.0.1 > 10.0.0.7: ICMP echo request, id 23946, seq 10, length 64
19:55:24.725884 IP 10.0.0.7 > 10.0.0.1: ICMP echo reply, id 23946, seq 10, length 64
19:55:25.014509 IP6 fe80::145a:f0ff:fe39:c26c > ff02::2: ICMP6, router solicitation, length 16
19:55:25.493336 IP6 fe80::6cad:5eff:fe88:d491 > ff02::2: ICMP6, router solicitation, length 16
19:55:25.727229 IP 10.0.0.1 > 10.0.0.7: ICMP echo request, id 23946, seq 11, length 64
19:55:25.728649 IP 10.0.0.7 > 10.0.0.1: ICMP echo reply, id 23946, seq 11, length 64
19:55:25.775144 IP6 fe80::38d7:19ff:fedb:ea0 > ff02::2: ICMP6, router solicitation, length 16
19:55:25.800242 IP6 fe80::7812:1cff:fee6:ae49 > ff02::2: ICMP6, router solicitation, length 16
19:55:26.524390 IP6 fe80::288c:74ff:fe5e:2f60 > ff02::2: ICMP6, router solicitation, length 16
19:55:26.548282 IP6 fe80::fc5c:aff:fe2f:f238 > ff02::2: ICMP6, router solicitation, length 16
19:55:26.727927 IP 10.0.0.1 > 10.0.0.7: ICMP echo request, id 23946, seq 12, length 64
19:55:26.729135 IP 10.0.0.7 > 10.0.0.1: ICMP echo reply, id 23946, seq 12, length 64
19:55:26.747620 IP6 fe80::a472:7dff:fee5:a2de > ff02::2: ICMP6, router solicitation, length 16
19:55:26.767709 IP6 fe80::2c55:aff:fe5e:9590 > ff02::2: ICMP6, router solicitation, length 16
19:55:26.815100 IP6 fe80::1443:bdff:fef2:58b5 > ff02::2: ICMP6, router solicitation, length 16
19:55:27.074676 IP6 fe80::44a7:c7ff:fe43:2a0 > ff02::2: ICMP6, router solicitation, length 16
19:55:27.097946 IP6 fe80::7891:4aff:fe35:4cd7 > ff02::2: ICMP6, router solicitation, length 16
19:55:27.116569 IP6 fe80::64b4:55ff:fea0:fdb5 > ff02::2: ICMP6, router solicitation, length 16
19:55:27.165240 IP6 fe80::c8a6:1fff:fec9:6ebd > ff02::2: ICMP6, router solicitation, length 16
19:55:27.259745 IP6 fe80::2c11:3eff:fef0:3fc9 > ff02::2: ICMP6, router solicitation, length 16
19:55:27.286589 IP6 fe80::f433:19ff:fef9:b3bd > ff02::2: ICMP6, router solicitation, length 16
19:55:27.351925 IP6 fe80::fce1:37ff:fe16:dac3 > ff02::2: ICMP6, router solicitation, length 16
19:55:27.552320 IP6 fe80::4c4e:cfff:fef4:e5e > ff02::2: ICMP6, router solicitation, length 16
19:55:27.620489 IP6 fe80::8406:f4ff:fe8e:740c > ff02::2: ICMP6, router solicitation, length 16
19:55:27.729553 IP 10.0.0.1 > 10.0.0.7: ICMP echo request, id 23946, seq 13, length 64
19:55:27.730833 IP 10.0.0.7 > 10.0.0.1: ICMP echo reply, id 23946, seq 13, length 64
19:55:27.779877 IP6 fe80::382c:d8ff:fe01:a79 > ff02::2: ICMP6, router solicitation, length 16
19:55:28.053176 IP6 fe80::cca6:3ff:fef5:d652 > ff02::2: ICMP6, router solicitation, length 16
19:55:28.292234 IP6 fe80::688b:43ff:fe67:30c1 > ff02::2: ICMP6, router solicitation, length 16
19:55:28.324958 IP6 fe80::8094:19ff:fed3:3173 > ff02::2: ICMP6, router solicitation, length 16
19:55:28.587662 IP6 fe80::e4ab:d7ff:feae:e754 > ff02::2: ICMP6, router solicitation, length 16
19:55:28.655243 IP6 fe80::58bb:92ff:fe43:52e7.5353 > ff02::fb.5353: 0 [2q] PTR (QM)? _ipps._tcp.local. PTR (QM)? _ipp._tcp.local. (45)
19:55:28.730848 IP 10.0.0.1 > 10.0.0.7: ICMP echo request, id 23946, seq 14, length 64
19:55:28.732009 IP 10.0.0.7 > 10.0.0.1: ICMP echo reply, id 23946, seq 14, length 64
19:55:28.779243 IP6 fe80::f0c2:bff:fea9:a5a4.5353 > ff02::fb.5353: 0 [2q] PTR (QM)? _ipps._tcp.local. PTR (QM)? _ipp._tcp.local. (45)
19:55:28.839918 IP6 fe80::7891:4aff:fe35:4cd7.5353 > ff02::fb.5353: 0 [2q] PTR (QM)? _ipps._tcp.local. PTR (QM)? _ipp._tcp.local. (45)
19:55:29.133562 IP6 fe80::44a7:c7ff:fe43:2a0.5353 > ff02::fb.5353: 0 [2q] PTR (QM)? _ipps._tcp.local. PTR (QM)? _ipp._tcp.local. (45)
19:55:29.348074 IP6 fe80::1443:bdff:fef2:58b5.5353 > ff02::fb.5353: 0 [2q] PTR (QM)? _ipps._tcp.local. PTR (QM)? _ipp._tcp.local. (45)
19:55:29.389978 IP6 fe80::6cad:5eff:fe88:d491.5353 > ff02::fb.5353: 0 [2q] PTR (QM)? _ipps._tcp.local. PTR (QM)? _ipp._tcp.local. (45)
19:55:29.469357 IP6 fe80::288c:74ff:fe5e:2f60.5353 > ff02::fb.5353: 0 [2q] PTR (QM)? _ipps._tcp.local. PTR (QM)? _ipp._tcp.local. (45)
19:55:29.511241 IP6 fe80::7812:1cff:fee6:ae49.5353 > ff02::fb.5353: 0 [2q] PTR (QM)? _ipps._tcp.local. PTR (QM)? _ipp._tcp.local. (45)
19:55:29.535547 IP6 fe80::38d7:19ff:fedb:ea0.5353 > ff02::fb.5353: 0 [2q] PTR (QM)? _ipps._tcp.local. PTR (QM)? _ipp._tcp.local. (45)
19:55:29.732960 IP 10.0.0.1 > 10.0.0.7: ICMP echo request, id 23946, seq 15, length 64
19:55:29.734205 IP 10.0.0.7 > 10.0.0.1: ICMP echo reply, id 23946, seq 15, length 64
19:55:29.961304 IP6 fe80::382c:d8ff:fe01:a79.5353 > ff02::fb.5353: 0 [2q] PTR (QM)? _ipps._tcp.local. PTR (QM)? _ipp._tcp.local. (45)
19:55:29.987170 IP6 fe80::cca6:3ff:fef5:d652.5353 > ff02::fb.5353: 0 [2q] PTR (QM)? _ipps._tcp.local. PTR (QM)? _ipp._tcp.local. (45)
19:55:29.997064 IP6 fe80::fc5c:aff:fe2f:f238.5353 > ff02::fb.5353: 0 [2q] PTR (QM)? _ipps._tcp.local. PTR (QM)? _ipp._tcp.local. (45)
19:55:30.250344 IP6 fe80::f433:19ff:fef9:b3bd.5353 > ff02::fb.5353: 0 [2q] PTR (QM)? _ipps._tcp.local. PTR (QM)? _ipp._tcp.local. (45)
19:55:30.370503 IP6 fe80::a472:7dff:fee5:a2de.5353 > ff02::fb.5353: 0 [2q] PTR (QM)? _ipps._tcp.local. PTR (QM)? _ipp._tcp.local. (45)
19:55:30.734078 IP 10.0.0.1 > 10.0.0.7: ICMP echo request, id 23946, seq 16, length 64
19:55:30.735335 IP 10.0.0.7 > 10.0.0.1: ICMP echo reply, id 23946, seq 16, length 64
19:55:31.735388 IP 10.0.0.1 > 10.0.0.7: ICMP echo request, id 23946, seq 17, length 64
19:55:31.736617 IP 10.0.0.7 > 10.0.0.1: ICMP echo reply, id 23946, seq 17, length 64
19:55:32.737281 IP 10.0.0.1 > 10.0.0.7: ICMP echo request, id 23946, seq 18, length 64
19:55:32.738385 IP 10.0.0.7 > 10.0.0.1: ICMP echo reply, id 23946, seq 18, length 64
19:55:33.737205 IP 10.0.0.1 > 10.0.0.7: ICMP echo request, id 23946, seq 19, length 64
19:55:33.738507 IP 10.0.0.7 > 10.0.0.1: ICMP echo reply, id 23946, seq 19, length 64
19:55:34.738602 IP 10.0.0.1 > 10.0.0.7: ICMP echo request, id 23946, seq 20, length 64
19:55:34.739635 IP 10.0.0.7 > 10.0.0.1: ICMP echo reply, id 23946, seq 20, length 64
19:55:35.740123 IP 10.0.0.1 > 10.0.0.7: ICMP echo request, id 23946, seq 21, length 64
19:55:35.741359 IP 10.0.0.7 > 10.0.0.1: ICMP echo reply, id 23946, seq 21, length 64
19:55:36.740965 IP 10.0.0.1 > 10.0.0.7: ICMP echo request, id 23946, seq 22, length 64
19:55:36.742024 IP 10.0.0.7 > 10.0.0.1: ICMP echo reply, id 23946, seq 22, length 64
19:55:37.742965 IP 10.0.0.1 > 10.0.0.7: ICMP echo request, id 23946, seq 23, length 64
19:55:37.744195 IP 10.0.0.7 > 10.0.0.1: ICMP echo reply, id 23946, seq 23, length 64
19:55:38.308364 IP6 fe80::f0c2:bff:fea9:a5a4 > ff02::2: ICMP6, router solicitation, length 16
19:55:38.744186 IP 10.0.0.1 > 10.0.0.7: ICMP echo request, id 23946, seq 24, length 64
19:55:38.745353 IP 10.0.0.7 > 10.0.0.1: ICMP echo reply, id 23946, seq 24, length 64
19:55:39.572845 IP6 fe80::6cad:5eff:fe88:d491 > ff02::2: ICMP6, router solicitation, length 16
19:55:39.745693 IP 10.0.0.1 > 10.0.0.7: ICMP echo request, id 23946, seq 25, length 64
19:55:39.747066 IP 10.0.0.7 > 10.0.0.1: ICMP echo reply, id 23946, seq 25, length 64
19:55:39.889028 IP6 fe80::145a:f0ff:fe39:c26c > ff02::2: ICMP6, router solicitation, length 16
19:55:39.897865 IP6 fe80::58bb:92ff:fe43:52e7 > ff02::2: ICMP6, router solicitation, length 16
19:55:40.365290 IP6 fe80::38d7:19ff:fedb:ea0 > ff02::2: ICMP6, router solicitation, length 16
19:55:40.405090 IP6 fe80::7812:1cff:fee6:ae49 > ff02::2: ICMP6, router solicitation, length 16
19:55:41.762939 IP 10.0.0.1 > 10.0.0.7: ICMP echo request, id 23946, seq 27, length 64
19:55:41.764006 IP 10.0.0.7 > 10.0.0.1: ICMP echo reply, id 23946, seq 27, length 64
19:55:41.871705 IP6 fe80::2c55:aff:fe5e:9590 > ff02::2: ICMP6, router solicitation, length 16
19:55:41.893180 IP6 fe80::288c:74ff:fe5e:2f60 > ff02::2: ICMP6, router solicitation, length 16
19:55:42.143691 IP6 fe80::fc5c:aff:fe2f:f238 > ff02::2: ICMP6, router solicitation, length 16
19:55:42.762990 IP 10.0.0.1 > 10.0.0.7: ICMP echo request, id 23946, seq 28, length 64
19:55:42.764148 IP 10.0.0.7 > 10.0.0.1: ICMP echo reply, id 23946, seq 28, length 64
19:55:42.875948 IP6 fe80::a472:7dff:fee5:a2de > ff02::2: ICMP6, router solicitation, length 16
19:55:42.967625 IP6 fe80::64b4:55ff:fea0:fdb5 > ff02::2: ICMP6, router solicitation, length 16
19:55:43.764822 IP 10.0.0.1 > 10.0.0.7: ICMP echo request, id 23946, seq 29, length 64
19:55:43.765965 IP 10.0.0.7 > 10.0.0.1: ICMP echo reply, id 23946, seq 29, length 64
19:55:44.648918 IP6 fe80::58bb:92ff:fe43:52e7.5353 > ff02::fb.5353: 0 [2q] PTR (QM)? _ipps._tcp.local. PTR (QM)? _ipp._tcp.local. (45)
19:55:44.773928 IP 10.0.0.1 > 10.0.0.7: ICMP echo request, id 23946, seq 30, length 64
19:55:44.775118 IP 10.0.0.7 > 10.0.0.1: ICMP echo reply, id 23946, seq 30, length 64
19:55:44.779991 IP6 fe80::f0c2:bff:fea9:a5a4.5353 > ff02::fb.5353: 0 [2q] PTR (QM)? _ipps._tcp.local. PTR (QM)? _ipp._tcp.local. (45)
19:55:44.836301 IP6 fe80::7891:4aff:fe35:4cd7.5353 > ff02::fb.5353: 0 [2q] PTR (QM)? _ipps._tcp.local. PTR (QM)? _ipp._tcp.local. (45)
19:55:44.923584 ARP, Request who-has 10.0.0.1 tell 10.0.0.7, length 28
19:55:44.943264 ARP, Reply 10.0.0.1 is-at 16:5a:f0:39:c2:6c, length 28
19:55:45.121077 IP6 fe80::44a7:c7ff:fe43:2a0.5353 > ff02::fb.5353: 0 [2q] PTR (QM)? _ipps._tcp.local. PTR (QM)? _ipp._tcp.local. (45)
19:55:45.346896 IP6 fe80::1443:bdff:fef2:58b5.5353 > ff02::fb.5353: 0 [2q] PTR (QM)? _ipps._tcp.local. PTR (QM)? _ipp._tcp.local. (45)
19:55:45.394766 IP6 fe80::6cad:5eff:fe88:d491.5353 > ff02::fb.5353: 0 [2q] PTR (QM)? _ipps._tcp.local. PTR (QM)? _ipp._tcp.local. (45)
19:55:45.435749 IP6 fe80::2c11:3eff:fef0:3fc9 > ff02::2: ICMP6, router solicitation, length 16
19:55:45.452575 IP6 fe80::688b:43ff:fe67:30c1 > ff02::2: ICMP6, router solicitation, length 16
19:55:45.477654 IP6 fe80::382c:d8ff:fe01:a79 > ff02::2: ICMP6, router solicitation, length 16
19:55:45.534423 IP6 fe80::f433:19ff:fef9:b3bd > ff02::2: ICMP6, router solicitation, length 16
19:55:45.570064 IP6 fe80::4c4e:cfff:fef4:e5e > ff02::2: ICMP6, router solicitation, length 16
19:55:45.624873 IP6 fe80::288c:74ff:fe5e:2f60.5353 > ff02::fb.5353: 0 [2q] PTR (QM)? _ipps._tcp.local. PTR (QM)? _ipp._tcp.local. (45)
19:55:45.675401 IP6 fe80::1443:bdff:fef2:58b5 > ff02::2: ICMP6, router solicitation, length 16
19:55:45.704372 IP6 fe80::8406:f4ff:fe8e:740c > ff02::2: ICMP6, router solicitation, length 16
19:55:45.762981 IP6 fe80::44a7:c7ff:fe43:2a0 > ff02::2: ICMP6, router solicitation, length 16
19:55:45.795301 IP6 fe80::fce1:37ff:fe16:dac3 > ff02::2: ICMP6, router solicitation, length 16
19:55:45.795378 IP 10.0.0.1 > 10.0.0.7: ICMP echo request, id 23946, seq 31, length 64
19:55:45.797781 IP 10.0.0.7 > 10.0.0.1: ICMP echo reply, id 23946, seq 31, length 64
19:55:45.812209 IP6 fe80::7891:4aff:fe35:4cd7 > ff02::2: ICMP6, router solicitation, length 16
19:55:45.864675 IP6 fe80::38d7:19ff:fedb:ea0.5353 > ff02::fb.5353: 0 [2q] PTR (QM)? _ipps._tcp.local. PTR (QM)? _ipp._tcp.local. (45)
19:55:45.924771 IP6 fe80::c8a6:1fff:fec9:6ebd > ff02::2: ICMP6, router solicitation, length 16
19:55:45.945002 IP6 fe80::7812:1cff:fee6:ae49.5353 > ff02::fb.5353: 0 [2q] PTR (QM)? _ipps._tcp.local. PTR (QM)? _ipp._tcp.local. (45)
19:55:45.965186 IP6 fe80::382c:d8ff:fe01:a79.5353 > ff02::fb.5353: 0 [2q] PTR (QM)? _ipps._tcp.local. PTR (QM)? _ipp._tcp.local. (45)
19:55:45.995491 IP6 fe80::cca6:3ff:fef5:d652.5353 > ff02::fb.5353: 0 [2q] PTR (QM)? _ipps._tcp.local. PTR (QM)? _ipp._tcp.local. (45)
19:55:46.005641 IP6 fe80::fc5c:aff:fe2f:f238.5353 > ff02::fb.5353: 0 [2q] PTR (QM)? _ipps._tcp.local. PTR (QM)? _ipp._tcp.local. (45)
19:55:46.249709 IP6 fe80::f433:19ff:fef9:b3bd.5353 > ff02::fb.5353: 0 [2q] PTR (QM)? _ipps._tcp.local. PTR (QM)? _ipp._tcp.local. (45)
19:55:46.370968 IP6 fe80::a472:7dff:fee5:a2de.5353 > ff02::fb.5353: 0 [2q] PTR (QM)? _ipps._tcp.local. PTR (QM)? _ipp._tcp.local. (45)
19:55:46.772986 IP 10.0.0.1 > 10.0.0.7: ICMP echo request, id 23946, seq 32, length 64
19:55:46.774064 IP 10.0.0.7 > 10.0.0.1: ICMP echo reply, id 23946, seq 32, length 64
19:55:47.535423 IP6 fe80::8094:19ff:fed3:3173 > ff02::2: ICMP6, router solicitation, length 16
19:55:47.547915 IP6 fe80::e4ab:d7ff:feae:e754 > ff02::2: ICMP6, router solicitation, length 16
19:55:47.774531 IP 10.0.0.1 > 10.0.0.7: ICMP echo request, id 23946, seq 33, length 64
19:55:47.775812 IP 10.0.0.7 > 10.0.0.1: ICMP echo reply, id 23946, seq 33, length 64
19:55:48.775245 IP 10.0.0.1 > 10.0.0.7: ICMP echo request, id 23946, seq 34, length 64
19:55:48.776512 IP 10.0.0.7 > 10.0.0.1: ICMP echo reply, id 23946, seq 34, length 64
19:55:49.777596 IP 10.0.0.1 > 10.0.0.7: ICMP echo request, id 23946, seq 35, length 64
19:55:49.778887 IP 10.0.0.7 > 10.0.0.1: ICMP echo reply, id 23946, seq 35, length 64
19:55:50.778518 IP 10.0.0.1 > 10.0.0.7: ICMP echo request, id 23946, seq 36, length 64
19:55:50.779554 IP 10.0.0.7 > 10.0.0.1: ICMP echo reply, id 23946, seq 36, length 64
19:55:51.778803 IP 10.0.0.1 > 10.0.0.7: ICMP echo request, id 23946, seq 37, length 64
19:55:51.779937 IP 10.0.0.7 > 10.0.0.1: ICMP echo reply, id 23946, seq 37, length 64
19:55:52.780352 IP 10.0.0.1 > 10.0.0.7: ICMP echo request, id 23946, seq 38, length 64
19:55:52.781695 IP 10.0.0.7 > 10.0.0.1: ICMP echo reply, id 23946, seq 38, length 64
19:55:52.890837 ARP, Request who-has 10.0.0.7 tell 10.0.0.1, length 28
19:55:52.892043 ARP, Reply 10.0.0.7 is-at 2e:11:3e:f0:3f:c9, length 28
19:55:53.782607 IP 10.0.0.1 > 10.0.0.7: ICMP echo request, id 23946, seq 39, length 64
19:55:53.783880 IP 10.0.0.7 > 10.0.0.1: ICMP echo reply, id 23946, seq 39, length 64
19:55:54.782821 IP 10.0.0.1 > 10.0.0.7: ICMP echo request, id 23946, seq 40, length 64
19:55:54.783913 IP 10.0.0.7 > 10.0.0.1: ICMP echo reply, id 23946, seq 40, length 64
19:55:55.784207 IP 10.0.0.1 > 10.0.0.7: ICMP echo request, id 23946, seq 41, length 64
19:55:55.785347 IP 10.0.0.7 > 10.0.0.1: ICMP echo reply, id 23946, seq 41, length 64
19:55:56.802907 IP 10.0.0.1 > 10.0.0.7: ICMP echo request, id 23946, seq 42, length 64
19:55:56.804069 IP 10.0.0.7 > 10.0.0.1: ICMP echo reply, id 23946, seq 42, length 64
19:55:57.804383 IP 10.0.0.1 > 10.0.0.7: ICMP echo request, id 23946, seq 43, length 64
19:55:57.805529 IP 10.0.0.7 > 10.0.0.1: ICMP echo reply, id 23946, seq 43, length 64
19:55:58.818941 IP 10.0.0.1 > 10.0.0.7: ICMP echo request, id 23946, seq 44, length 64
19:55:58.820172 IP 10.0.0.7 > 10.0.0.1: ICMP echo reply, id 23946, seq 44, length 64
19:55:59.818370 IP 10.0.0.1 > 10.0.0.7: ICMP echo request, id 23946, seq 45, length 64
19:55:59.819410 IP 10.0.0.7 > 10.0.0.1: ICMP echo reply, id 23946, seq 45, length 64
19:56:00.820298 IP 10.0.0.1 > 10.0.0.7: ICMP echo request, id 23946, seq 46, length 64
19:56:00.821417 IP 10.0.0.7 > 10.0.0.1: ICMP echo reply, id 23946, seq 46, length 64
19:56:01.821127 IP 10.0.0.1 > 10.0.0.7: ICMP echo request, id 23946, seq 47, length 64
19:56:01.822176 IP 10.0.0.7 > 10.0.0.1: ICMP echo reply, id 23946, seq 47, length 64
19:56:02.822223 IP 10.0.0.1 > 10.0.0.7: ICMP echo request, id 23946, seq 48, length 64
19:56:02.823444 IP 10.0.0.7 > 10.0.0.1: ICMP echo reply, id 23946, seq 48, length 64
19:56:04.867147 IP 10.0.0.1 > 10.0.0.7: ICMP echo request, id 23946, seq 50, length 64
19:56:04.868695 IP 10.0.0.7 > 10.0.0.1: ICMP echo reply, id 23946, seq 50, length 64
19:56:05.867471 IP 10.0.0.1 > 10.0.0.7: ICMP echo request, id 23946, seq 51, length 64
19:56:05.868603 IP 10.0.0.7 > 10.0.0.1: ICMP echo reply, id 23946, seq 51, length 64
19:56:06.869803 IP 10.0.0.1 > 10.0.0.7: ICMP echo request, id 23946, seq 52, length 64
19:56:06.871017 IP 10.0.0.7 > 10.0.0.1: ICMP echo reply, id 23946, seq 52, length 64
19:56:06.939795 ARP, Request who-has 10.0.0.1 tell 10.0.0.7, length 28
19:56:06.957885 ARP, Reply 10.0.0.1 is-at 16:5a:f0:39:c2:6c, length 28
19:56:07.872295 IP 10.0.0.1 > 10.0.0.7: ICMP echo request, id 23946, seq 53, length 64
19:56:07.873537 IP 10.0.0.7 > 10.0.0.1: ICMP echo reply, id 23946, seq 53, length 64
19:56:08.002770 IP6 fe80::6cad:5eff:fe88:d491 > ff02::2: ICMP6, router solicitation, length 16
19:56:08.051766 IP6 fe80::f0c2:bff:fea9:a5a4 > ff02::2: ICMP6, router solicitation, length 16
19:56:08.871831 IP 10.0.0.1 > 10.0.0.7: ICMP echo request, id 23946, seq 54, length 64
19:56:08.873178 IP 10.0.0.7 > 10.0.0.1: ICMP echo reply, id 23946, seq 54, length 64
19:56:09.873950 IP 10.0.0.1 > 10.0.0.7: ICMP echo request, id 23946, seq 55, length 64
19:56:09.875001 IP 10.0.0.7 > 10.0.0.1: ICMP echo reply, id 23946, seq 55, length 64
19:56:10.085345 IP6 fe80::38d7:19ff:fedb:ea0 > ff02::2: ICMP6, router solicitation, length 16
19:56:10.109601 IP6 fe80::58bb:92ff:fe43:52e7 > ff02::2: ICMP6, router solicitation, length 16
19:56:10.874797 IP 10.0.0.1 > 10.0.0.7: ICMP echo request, id 23946, seq 56, length 64
19:56:10.876194 IP 10.0.0.7 > 10.0.0.1: ICMP echo reply, id 23946, seq 56, length 64
19:56:11.876261 IP 10.0.0.1 > 10.0.0.7: ICMP echo request, id 23946, seq 57, length 64
19:56:11.877515 IP 10.0.0.7 > 10.0.0.1: ICMP echo reply, id 23946, seq 57, length 64
19:56:12.079553 IP6 fe80::2c55:aff:fe5e:9590 > ff02::2: ICMP6, router solicitation, length 16
19:56:12.877382 IP 10.0.0.1 > 10.0.0.7: ICMP echo request, id 23946, seq 58, length 64
19:56:12.878451 IP 10.0.0.7 > 10.0.0.1: ICMP echo reply, id 23946, seq 58, length 64
19:56:13.879520 IP 10.0.0.1 > 10.0.0.7: ICMP echo request, id 23946, seq 59, length 64
19:56:13.880797 IP 10.0.0.7 > 10.0.0.1: ICMP echo reply, id 23946, seq 59, length 64
19:56:14.148109 IP6 fe80::288c:74ff:fe5e:2f60 > ff02::2: ICMP6, router solicitation, length 16
19:56:14.158127 IP6 fe80::fc5c:aff:fe2f:f238 > ff02::2: ICMP6, router solicitation, length 16
19:56:14.880632 IP 10.0.0.1 > 10.0.0.7: ICMP echo request, id 23946, seq 60, length 64
19:56:14.881733 IP 10.0.0.7 > 10.0.0.1: ICMP echo reply, id 23946, seq 60, length 64
19:56:15.882503 IP 10.0.0.1 > 10.0.0.7: ICMP echo request, id 23946, seq 61, length 64
19:56:15.883707 IP 10.0.0.7 > 10.0.0.1: ICMP echo reply, id 23946, seq 61, length 64
19:56:16.155485 IP6 fe80::a472:7dff:fee5:a2de > ff02::2: ICMP6, router solicitation, length 16
19:56:16.188360 IP6 fe80::64b4:55ff:fea0:fdb5 > ff02::2: ICMP6, router solicitation, length 16
19:56:16.647431 IP6 fe80::58bb:92ff:fe43:52e7.5353 > ff02::fb.5353: 0 [2q] PTR (QM)? _ipps._tcp.local. PTR (QM)? _ipp._tcp.local. (45)
19:56:16.780724 IP6 fe80::f0c2:bff:fea9:a5a4.5353 > ff02::fb.5353: 0 [2q] PTR (QM)? _ipps._tcp.local. PTR (QM)? _ipp._tcp.local. (45)
19:56:16.834371 IP6 fe80::7891:4aff:fe35:4cd7.5353 > ff02::fb.5353: 0 [2q] PTR (QM)? _ipps._tcp.local. PTR (QM)? _ipp._tcp.local. (45)
19:56:16.883818 IP 10.0.0.1 > 10.0.0.7: ICMP echo request, id 23946, seq 62, length 64
19:56:16.885069 IP 10.0.0.7 > 10.0.0.1: ICMP echo reply, id 23946, seq 62, length 64
19:56:17.120021 IP6 fe80::44a7:c7ff:fe43:2a0.5353 > ff02::fb.5353: 0 [2q] PTR (QM)? _ipps._tcp.local. PTR (QM)? _ipp._tcp.local. (45)
19:56:17.343490 IP6 fe80::1443:bdff:fef2:58b5.5353 > ff02::fb.5353: 0 [2q] PTR (QM)? _ipps._tcp.local. PTR (QM)? _ipp._tcp.local. (45)
19:56:17.465076 IP6 fe80::288c:74ff:fe5e:2f60.5353 > ff02::fb.5353: 0 [2q] PTR (QM)? _ipps._tcp.local. PTR (QM)? _ipp._tcp.local. (45)
19:56:17.510195 IP6 fe80::7812:1cff:fee6:ae49.5353 > ff02::fb.5353: 0 [2q] PTR (QM)? _ipps._tcp.local. PTR (QM)? _ipp._tcp.local. (45)
19:56:17.535405 IP6 fe80::38d7:19ff:fedb:ea0.5353 > ff02::fb.5353: 0 [2q] PTR (QM)? _ipps._tcp.local. PTR (QM)? _ipp._tcp.local. (45)
19:56:17.884087 IP 10.0.0.1 > 10.0.0.7: ICMP echo request, id 23946, seq 63, length 64
19:56:17.885224 IP 10.0.0.7 > 10.0.0.1: ICMP echo reply, id 23946, seq 63, length 64
19:56:17.967848 IP6 fe80::382c:d8ff:fe01:a79.5353 > ff02::fb.5353: 0 [2q] PTR (QM)? _ipps._tcp.local. PTR (QM)? _ipp._tcp.local. (45)
19:56:17.995121 IP6 fe80::cca6:3ff:fef5:d652.5353 > ff02::fb.5353: 0 [2q] PTR (QM)? _ipps._tcp.local. PTR (QM)? _ipp._tcp.local. (45)
19:56:18.005239 IP6 fe80::fc5c:aff:fe2f:f238.5353 > ff02::fb.5353: 0 [2q] PTR (QM)? _ipps._tcp.local. PTR (QM)? _ipp._tcp.local. (45)
19:56:18.203752 IP6 fe80::2c11:3eff:fef0:3fc9 > ff02::2: ICMP6, router solicitation, length 16
19:56:18.222617 IP6 fe80::f433:19ff:fef9:b3bd > ff02::2: ICMP6, router solicitation, length 16
19:56:18.245528 IP6 fe80::8406:f4ff:fe8e:740c > ff02::2: ICMP6, router solicitation, length 16
19:56:18.273971 IP6 fe80::f433:19ff:fef9:b3bd.5353 > ff02::fb.5353: 0 [2q] PTR (QM)? _ipps._tcp.local. PTR (QM)? _ipp._tcp.local. (45)
19:56:18.376387 IP6 fe80::a472:7dff:fee5:a2de.5353 > ff02::fb.5353: 0 [2q] PTR (QM)? _ipps._tcp.local. PTR (QM)? _ipp._tcp.local. (45)
19:56:18.885123 IP 10.0.0.1 > 10.0.0.7: ICMP echo request, id 23946, seq 64, length 64
19:56:18.886351 IP 10.0.0.7 > 10.0.0.1: ICMP echo reply, id 23946, seq 64, length 64
19:56:19.886557 IP 10.0.0.1 > 10.0.0.7: ICMP echo request, id 23946, seq 65, length 64
19:56:19.887616 IP 10.0.0.7 > 10.0.0.1: ICMP echo reply, id 23946, seq 65, length 64
19:56:20.275824 IP6 fe80::382c:d8ff:fe01:a79 > ff02::2: ICMP6, router solicitation, length 16
19:56:20.294040 IP6 fe80::688b:43ff:fe67:30c1 > ff02::2: ICMP6, router solicitation, length 16
19:56:20.355741 IP6 fe80::4c4e:cfff:fef4:e5e > ff02::2: ICMP6, router solicitation, length 16
19:56:20.373761 IP6 fe80::cca6:3ff:fef5:d652 > ff02::2: ICMP6, router solicitation, length 16
19:56:20.402663 IP6 fe80::44a7:c7ff:fe43:2a0 > ff02::2: ICMP6, router solicitation, length 16
19:56:20.430564 IP6 fe80::fce1:37ff:fe16:dac3 > ff02::2: ICMP6, router solicitation, length 16
19:56:20.482668 IP6 fe80::c8a6:1fff:fec9:6ebd > ff02::2: ICMP6, router solicitation, length 16
19:56:20.888742 IP 10.0.0.1 > 10.0.0.7: ICMP echo request, id 23946, seq 66, length 64
19:56:20.889787 IP 10.0.0.7 > 10.0.0.1: ICMP echo reply, id 23946, seq 66, length 64
19:56:21.890459 IP 10.0.0.1 > 10.0.0.7: ICMP echo request, id 23946, seq 67, length 64
19:56:21.891689 IP 10.0.0.7 > 10.0.0.1: ICMP echo reply, id 23946, seq 67, length 64
19:56:22.370979 IP6 fe80::8094:19ff:fed3:3173 > ff02::2: ICMP6, router solicitation, length 16
19:56:22.394859 IP6 fe80::1443:bdff:fef2:58b5 > ff02::2: ICMP6, router solicitation, length 16
19:56:22.418067 IP6 fe80::e4ab:d7ff:feae:e754 > ff02::2: ICMP6, router solicitation, length 16
19:56:22.435303 IP6 fe80::7891:4aff:fe35:4cd7 > ff02::2: ICMP6, router solicitation, length 16
19:56:22.890681 IP 10.0.0.1 > 10.0.0.7: ICMP echo request, id 23946, seq 68, length 64
19:56:22.891938 IP 10.0.0.7 > 10.0.0.1: ICMP echo reply, id 23946, seq 68, length 64
19:56:23.892264 IP 10.0.0.1 > 10.0.0.7: ICMP echo request, id 23946, seq 69, length 64
19:56:23.893312 IP 10.0.0.7 > 10.0.0.1: ICMP echo reply, id 23946, seq 69, length 64
19:56:24.893997 IP 10.0.0.1 > 10.0.0.7: ICMP echo request, id 23946, seq 70, length 64
19:56:24.895241 IP 10.0.0.7 > 10.0.0.1: ICMP echo reply, id 23946, seq 70, length 64
19:56:26.915025 IP 10.0.0.1 > 10.0.0.7: ICMP echo request, id 23946, seq 72, length 64
19:56:26.916268 IP 10.0.0.7 > 10.0.0.1: ICMP echo reply, id 23946, seq 72, length 64
19:56:27.915570 IP 10.0.0.1 > 10.0.0.7: ICMP echo request, id 23946, seq 73, length 64
19:56:27.916901 IP 10.0.0.7 > 10.0.0.1: ICMP echo reply, id 23946, seq 73, length 64
19:56:28.916927 IP 10.0.0.1 > 10.0.0.7: ICMP echo request, id 23946, seq 74, length 64
19:56:28.918086 IP 10.0.0.7 > 10.0.0.1: ICMP echo reply, id 23946, seq 74, length 64
19:56:29.918755 IP 10.0.0.1 > 10.0.0.7: ICMP echo request, id 23946, seq 75, length 64
19:56:29.919900 IP 10.0.0.7 > 10.0.0.1: ICMP echo reply, id 23946, seq 75, length 64
19:56:29.979782 ARP, Request who-has 10.0.0.1 tell 10.0.0.7, length 28
19:56:29.988670 ARP, Request who-has 10.0.0.7 tell 10.0.0.1, length 28
19:56:29.989877 ARP, Reply 10.0.0.7 is-at 2e:11:3e:f0:3f:c9, length 28
19:56:29.997537 ARP, Reply 10.0.0.1 is-at 16:5a:f0:39:c2:6c, length 28
19:56:30.920570 IP 10.0.0.1 > 10.0.0.7: ICMP echo request, id 23946, seq 76, length 64
19:56:30.921825 IP 10.0.0.7 > 10.0.0.1: ICMP echo reply, id 23946, seq 76, length 64
19:56:31.921481 IP 10.0.0.1 > 10.0.0.7: ICMP echo request, id 23946, seq 77, length 64
19:56:31.922773 IP 10.0.0.7 > 10.0.0.1: ICMP echo reply, id 23946, seq 77, length 64
19:56:32.923155 IP 10.0.0.1 > 10.0.0.7: ICMP echo request, id 23946, seq 78, length 64
19:56:32.924741 IP 10.0.0.7 > 10.0.0.1: ICMP echo reply, id 23946, seq 78, length 64
19:56:34.946390 IP 10.0.0.1 > 10.0.0.7: ICMP echo request, id 23946, seq 80, length 64
19:56:34.948011 IP 10.0.0.7 > 10.0.0.1: ICMP echo reply, id 23946, seq 80, length 64
19:56:35.947695 IP 10.0.0.1 > 10.0.0.7: ICMP echo request, id 23946, seq 81, length 64
19:56:35.949578 IP 10.0.0.7 > 10.0.0.1: ICMP echo reply, id 23946, seq 81, length 64
19:56:36.949071 IP 10.0.0.1 > 10.0.0.7: ICMP echo request, id 23946, seq 82, length 64
19:56:36.950687 IP 10.0.0.7 > 10.0.0.1: ICMP echo reply, id 23946, seq 82, length 64
19:56:37.951391 IP 10.0.0.1 > 10.0.0.7: ICMP echo request, id 23946, seq 83, length 64
19:56:37.953456 IP 10.0.0.7 > 10.0.0.1: ICMP echo reply, id 23946, seq 83, length 64
19:56:38.951120 IP 10.0.0.1 > 10.0.0.7: ICMP echo request, id 23946, seq 84, length 64
19:56:38.952212 IP 10.0.0.7 > 10.0.0.1: ICMP echo reply, id 23946, seq 84, length 64
19:56:39.952701 IP 10.0.0.1 > 10.0.0.7: ICMP echo request, id 23946, seq 85, length 64
19:56:39.954080 IP 10.0.0.7 > 10.0.0.1: ICMP echo reply, id 23946, seq 85, length 64
19:56:40.954380 IP 10.0.0.1 > 10.0.0.7: ICMP echo request, id 23946, seq 86, length 64
19:56:40.955514 IP 10.0.0.7 > 10.0.0.1: ICMP echo reply, id 23946, seq 86, length 64
19:56:41.954880 IP 10.0.0.1 > 10.0.0.7: ICMP echo request, id 23946, seq 87, length 64
19:56:41.955985 IP 10.0.0.7 > 10.0.0.1: ICMP echo reply, id 23946, seq 87, length 64
19:56:42.978538 IP 10.0.0.1 > 10.0.0.7: ICMP echo request, id 23946, seq 88, length 64
19:56:42.979966 IP 10.0.0.7 > 10.0.0.1: ICMP echo reply, id 23946, seq 88, length 64
19:56:43.979878 IP 10.0.0.1 > 10.0.0.7: ICMP echo request, id 23946, seq 89, length 64
19:56:43.981413 IP 10.0.0.7 > 10.0.0.1: ICMP echo reply, id 23946, seq 89, length 64
19:56:44.982241 IP 10.0.0.1 > 10.0.0.7: ICMP echo request, id 23946, seq 90, length 64
19:56:44.983416 IP 10.0.0.7 > 10.0.0.1: ICMP echo reply, id 23946, seq 90, length 64
