04:58:04.108825 IP6 fe80::8e8:5aff:fe6e:cb4a.5353 > ff02::fb.5353: 0*- [0q] 2/0/0 (Cache flush) PTR sam-VirtualBox.local., (Cache flush) AAAA fe80::8e8:5aff:fe6e:cb4a (146)
04:58:04.148566 IP6 fe80::8e8:5aff:fe6e:cb4a > ff02::16: HBH ICMP6, multicast listener report v2, 2 group record(s), length 48
04:58:04.361369 IP6 fe80::8e8:5aff:fe6e:cb4a.5353 > ff02::fb.5353: 0 [2q] PTR (QM)? _ipps._tcp.local. PTR (QM)? _ipp._tcp.local. (45)
04:58:05.208154 IP6 fe80::8e8:5aff:fe6e:cb4a.5353 > ff02::fb.5353: 0*- [0q] 2/0/0 (Cache flush) PTR sam-VirtualBox.local., (Cache flush) AAAA fe80::8e8:5aff:fe6e:cb4a (146)
04:58:05.540187 IP6 fe80::fcad:56ff:fe6d:f8bc > ff02::2: ICMP6, router solicitation, length 16
04:58:05.587563 IP6 fe80::44d9:dcff:fe54:38e3 > ff02::2: ICMP6, router solicitation, length 16
04:58:05.679020 IP6 fe80::20dd:6fff:fe8c:78af.5353 > ff02::fb.5353: 0*- [0q] 2/0/0 (Cache flush) PTR sam-VirtualBox.local., (Cache flush) AAAA fe80::20dd:6fff:fe8c:78af (146)
04:58:05.733091 IP6 fe80::fcad:56ff:fe6d:f8bc.5353 > ff02::fb.5353: 0*- [0q] 2/0/0 (Cache flush) PTR sam-VirtualBox.local., (Cache flush) AAAA fe80::fcad:56ff:fe6d:f8bc (146)
04:58:05.783897 IP6 fe80::40d3:fbff:fe21:28e7.5353 > ff02::fb.5353: 0*- [0q] 2/0/0 (Cache flush) PTR sam-VirtualBox.local., (Cache flush) AAAA fe80::40d3:fbff:fe21:28e7 (146)
04:58:05.891895 IP6 fe80::40d3:fbff:fe21:28e7 > ff02::2: ICMP6, router solicitation, length 16
04:58:05.937764 IP6 fe80::1452:57ff:fe39:65ed.5353 > ff02::fb.5353: 0 [2q] PTR (QM)? _ipps._tcp.local. PTR (QM)? _ipp._tcp.local. (45)
04:58:05.966993 IP6 fe80::44b2:83ff:fe82:6852.5353 > ff02::fb.5353: 0*- [0q] 2/0/0 (Cache flush) PTR sam-VirtualBox.local., (Cache flush) AAAA fe80::44b2:83ff:fe82:6852 (146)
04:58:06.123827 ARP, Request who-has 10.0.0.7 tell 10.0.0.1, length 28
04:58:06.128295 ARP, Reply 10.0.0.7 is-at f2:ce:ec:df:f4:86, length 28
04:58:06.298596 IP 10.0.0.1.47946 > 10.0.0.7.5566: UDP, length 1470
04:58:06.301483 IP 10.0.0.1.47946 > 10.0.0.7.5566: UDP, length 1470
04:58:06.301545 IP 10.0.0.1.47946 > 10.0.0.7.5566: UDP, length 1470
04:58:06.302626 IP 10.0.0.1.47946 > 10.0.0.7.5566: UDP, length 1470
04:58:06.303145 IP 10.0.0.1.47946 > 10.0.0.7.5566: UDP, length 1470
04:58:06.304056 IP 10.0.0.1.47946 > 10.0.0.7.5566: UDP, length 1470
04:58:06.304700 IP 10.0.0.1.47946 > 10.0.0.7.5566: UDP, length 1470
04:58:06.306088 IP 10.0.0.1.47946 > 10.0.0.7.5566: UDP, length 1470
04:58:06.306958 IP 10.0.0.1.47946 > 10.0.0.7.5566: UDP, length 1470
04:58:06.307314 IP 10.0.0.1.47946 > 10.0.0.7.5566: UDP, length 1470
04:58:06.308915 IP 10.0.0.1.47946 > 10.0.0.7.5566: UDP, length 1470
04:58:06.308927 IP 10.0.0.1.47946 > 10.0.0.7.5566: UDP, length 1470
04:58:06.310409 IP 10.0.0.1.47946 > 10.0.0.7.5566: UDP, length 1470
04:58:06.313376 IP 10.0.0.1.47946 > 10.0.0.7.5566: UDP, length 1470
04:58:06.313428 IP 10.0.0.1.47946 > 10.0.0.7.5566: UDP, length 1470
04:58:06.316588 IP 10.0.0.1.47946 > 10.0.0.7.5566: UDP, length 1470
04:58:06.316651 IP 10.0.0.1.47946 > 10.0.0.7.5566: UDP, length 1470
04:58:06.317429 IP 10.0.0.1.47946 > 10.0.0.7.5566: UDP, length 1470
04:58:06.318333 IP 10.0.0.1.47946 > 10.0.0.7.5566: UDP, length 1470
04:58:06.319269 IP 10.0.0.1.47946 > 10.0.0.7.5566: UDP, length 1470
04:58:06.320660 IP 10.0.0.1.47946 > 10.0.0.7.5566: UDP, length 1470
04:58:06.320685 IP 10.0.0.1.47946 > 10.0.0.7.5566: UDP, length 1470
04:58:06.323349 IP 10.0.0.1.47946 > 10.0.0.7.5566: UDP, length 1470
04:58:06.323407 IP 10.0.0.1.47946 > 10.0.0.7.5566: UDP, length 1470
04:58:06.326866 IP 10.0.0.1.47946 > 10.0.0.7.5566: UDP, length 1470
04:58:06.326867 IP 10.0.0.1.47946 > 10.0.0.7.5566: UDP, length 1470
04:58:06.328270 IP 10.0.0.1.47946 > 10.0.0.7.5566: UDP, length 1470
04:58:06.332802 IP 10.0.0.1.47946 > 10.0.0.7.5566: UDP, length 1470
04:58:06.333455 IP 10.0.0.1.47946 > 10.0.0.7.5566: UDP, length 1470
04:58:06.333998 IP 10.0.0.1.47946 > 10.0.0.7.5566: UDP, length 1470
04:58:06.335361 IP 10.0.0.1.47946 > 10.0.0.7.5566: UDP, length 1470
04:58:06.335562 IP 10.0.0.1.47946 > 10.0.0.7.5566: UDP, length 1470
04:58:06.336828 IP 10.0.0.1.47946 > 10.0.0.7.5566: UDP, length 1470
04:58:06.337475 IP 10.0.0.1.47946 > 10.0.0.7.5566: UDP, length 1470
04:58:06.337863 IP 10.0.0.1.47946 > 10.0.0.7.5566: UDP, length 1470
04:58:06.339804 IP 10.0.0.1.47946 > 10.0.0.7.5566: UDP, length 1470
04:58:06.340411 IP 10.0.0.1.47946 > 10.0.0.7.5566: UDP, length 1470
04:58:06.340788 IP 10.0.0.1.47946 > 10.0.0.7.5566: UDP, length 1470
04:58:06.341923 IP 10.0.0.1.47946 > 10.0.0.7.5566: UDP, length 1470
04:58:06.342241 IP 10.0.0.1.47946 > 10.0.0.7.5566: UDP, length 1470
04:58:06.344729 IP 10.0.0.1.47946 > 10.0.0.7.5566: UDP, length 1470
04:58:06.344793 IP 10.0.0.1.47946 > 10.0.0.7.5566: UDP, length 1470
04:58:06.347923 IP 10.0.0.1.47946 > 10.0.0.7.5566: UDP, length 1470
04:58:06.348063 IP 10.0.0.1.47946 > 10.0.0.7.5566: UDP, length 1470
04:58:06.350819 IP 10.0.0.1.47946 > 10.0.0.7.5566: UDP, length 1470
04:58:06.351443 IP 10.0.0.1.47946 > 10.0.0.7.5566: UDP, length 1470
04:58:06.351977 IP 10.0.0.1.47946 > 10.0.0.7.5566: UDP, length 1470
04:58:06.353589 IP 10.0.0.1.47946 > 10.0.0.7.5566: UDP, length 1470
04:58:06.353645 IP 10.0.0.1.47946 > 10.0.0.7.5566: UDP, length 1470
04:58:06.355918 IP 10.0.0.1.47946 > 10.0.0.7.5566: UDP, length 1470
04:58:06.356000 IP 10.0.0.1.47946 > 10.0.0.7.5566: UDP, length 1470
04:58:06.357941 IP 10.0.0.1.47946 > 10.0.0.7.5566: UDP, length 1470
04:58:06.358496 IP6 fe80::8e8:5aff:fe6e:cb4a.5353 > ff02::fb.5353: 0 [2q] PTR (QM)? _ipps._tcp.local. PTR (QM)? _ipp._tcp.local. (45)
04:58:06.358497 IP 10.0.0.1.47946 > 10.0.0.7.5566: UDP, length 1470
04:58:06.358838 IP 10.0.0.1.47946 > 10.0.0.7.5566: UDP, length 1470
04:58:06.360179 IP 10.0.0.1.47946 > 10.0.0.7.5566: UDP, length 1470
04:58:06.360462 IP 10.0.0.1.47946 > 10.0.0.7.5566: UDP, length 1470
04:58:06.362080 IP 10.0.0.1.47946 > 10.0.0.7.5566: UDP, length 1470
04:58:06.362191 IP 10.0.0.1.47946 > 10.0.0.7.5566: UDP, length 1470
04:58:06.367226 IP 10.0.0.1.47946 > 10.0.0.7.5566: UDP, length 1470
04:58:06.367763 IP 10.0.0.1.47946 > 10.0.0.7.5566: UDP, length 1470
04:58:06.368092 IP 10.0.0.1.47946 > 10.0.0.7.5566: UDP, length 1470
04:58:06.368926 IP 10.0.0.1.47946 > 10.0.0.7.5566: UDP, length 1470
04:58:06.372056 IP 10.0.0.1.47946 > 10.0.0.7.5566: UDP, length 1470
04:58:06.372056 IP 10.0.0.1.47946 > 10.0.0.7.5566: UDP, length 1470
04:58:06.373291 IP 10.0.0.1.47946 > 10.0.0.7.5566: UDP, length 1470
04:58:06.373918 IP 10.0.0.1.47946 > 10.0.0.7.5566: UDP, length 1470
04:58:06.374565 IP 10.0.0.1.47946 > 10.0.0.7.5566: UDP, length 1470
04:58:06.376884 IP 10.0.0.1.47946 > 10.0.0.7.5566: UDP, length 1470
04:58:06.376923 IP 10.0.0.1.47946 > 10.0.0.7.5566: UDP, length 1470
04:58:06.378565 IP 10.0.0.1.47946 > 10.0.0.7.5566: UDP, length 1470
04:58:06.379063 IP 10.0.0.1.47946 > 10.0.0.7.5566: UDP, length 1470
04:58:06.379494 IP 10.0.0.1.47946 > 10.0.0.7.5566: UDP, length 1470
04:58:06.382645 IP 10.0.0.1.47946 > 10.0.0.7.5566: UDP, length 1470
04:58:06.382752 IP 10.0.0.1.47946 > 10.0.0.7.5566: UDP, length 1470
04:58:06.383795 IP 10.0.0.1.47946 > 10.0.0.7.5566: UDP, length 1470
04:58:06.384521 IP 10.0.0.1.47946 > 10.0.0.7.5566: UDP, length 1470
04:58:06.385034 IP 10.0.0.1.47946 > 10.0.0.7.5566: UDP, length 1470
04:58:06.386703 IP 10.0.0.1.47946 > 10.0.0.7.5566: UDP, length 1470
04:58:06.386751 IP 10.0.0.1.47946 > 10.0.0.7.5566: UDP, length 1470
04:58:06.387492 IP 10.0.0.1.47946 > 10.0.0.7.5566: UDP, length 1470
04:58:06.388565 IP 10.0.0.1.47946 > 10.0.0.7.5566: UDP, length 1470
04:58:06.389124 IP 10.0.0.1.47946 > 10.0.0.7.5566: UDP, length 1470
04:58:06.391696 IP 10.0.0.1.47946 > 10.0.0.7.5566: UDP, length 1470
04:58:06.391746 IP 10.0.0.1.47946 > 10.0.0.7.5566: UDP, length 1470
04:58:06.393959 IP 10.0.0.1.47946 > 10.0.0.7.5566: UDP, length 1470
04:58:06.393959 IP 10.0.0.1.47946 > 10.0.0.7.5566: UDP, length 1470
04:58:06.398615 IP 10.0.0.1.47946 > 10.0.0.7.5566: UDP, length 1470
04:58:06.398681 IP 10.0.0.1.47946 > 10.0.0.7.5566: UDP, length 1470
04:58:06.399503 IP 10.0.0.1.47946 > 10.0.0.7.5566: UDP, length 1470
04:58:06.403317 IP 10.0.0.1.47946 > 10.0.0.7.5566: UDP, length 1470
04:58:06.403390 IP 10.0.0.1.47946 > 10.0.0.7.5566: UDP, length 1470
04:58:06.405594 IP 10.0.0.1.47946 > 10.0.0.7.5566: UDP, length 1470
04:58:06.406057 IP 10.0.0.1.47946 > 10.0.0.7.5566: UDP, length 1470
04:58:06.406796 IP 10.0.0.1.47946 > 10.0.0.7.5566: UDP, length 1470
04:58:06.407343 IP 10.0.0.1.47946 > 10.0.0.7.5566: UDP, length 1470
04:58:06.408864 IP 10.0.0.1.47946 > 10.0.0.7.5566: UDP, length 1470
04:58:06.408904 IP 10.0.0.1.47946 > 10.0.0.7.5566: UDP, length 1470
04:58:06.411824 IP 10.0.0.1.47946 > 10.0.0.7.5566: UDP, length 1470
04:58:06.411880 IP 10.0.0.1.47946 > 10.0.0.7.5566: UDP, length 1470
04:58:06.413331 IP 10.0.0.1.47946 > 10.0.0.7.5566: UDP, length 1470
04:58:06.413983 IP 10.0.0.1.47946 > 10.0.0.7.5566: UDP, length 1470
04:58:06.415307 IP 10.0.0.1.47946 > 10.0.0.7.5566: UDP, length 1470
04:58:06.415330 IP 10.0.0.1.47946 > 10.0.0.7.5566: UDP, length 1470
04:58:06.417138 IP 10.0.0.1.47946 > 10.0.0.7.5566: UDP, length 1470
04:58:06.417148 IP 10.0.0.1.47946 > 10.0.0.7.5566: UDP, length 1470
04:58:06.418532 IP 10.0.0.1.47946 > 10.0.0.7.5566: UDP, length 1470
04:58:06.422376 IP 10.0.0.1.47946 > 10.0.0.7.5566: UDP, length 1470
04:58:06.422440 IP 10.0.0.1.47946 > 10.0.0.7.5566: UDP, length 1470
04:58:06.423550 IP 10.0.0.1.47946 > 10.0.0.7.5566: UDP, length 1470
04:58:06.424059 IP 10.0.0.1.47946 > 10.0.0.7.5566: UDP, length 1470
04:58:06.426550 IP 10.0.0.1.47946 > 10.0.0.7.5566: UDP, length 1470
04:58:06.426551 IP 10.0.0.1.47946 > 10.0.0.7.5566: UDP, length 1470
04:58:06.428697 IP 10.0.0.1.47946 > 10.0.0.7.5566: UDP, length 1470
04:58:06.428698 IP 10.0.0.1.47946 > 10.0.0.7.5566: UDP, length 1470
04:58:06.430910 IP 10.0.0.1.47946 > 10.0.0.7.5566: UDP, length 1470
04:58:06.430958 IP 10.0.0.1.47946 > 10.0.0.7.5566: UDP, length 1470
04:58:06.432208 IP 10.0.0.1.47946 > 10.0.0.7.5566: UDP, length 1470
04:58:06.434827 IP 10.0.0.1.47946 > 10.0.0.7.5566: UDP, length 1470
04:58:06.434890 IP 10.0.0.1.47946 > 10.0.0.7.5566: UDP, length 1470
04:58:06.436376 IP 10.0.0.1.47946 > 10.0.0.7.5566: UDP, length 1470
04:58:06.436410 IP 10.0.0.1.47946 > 10.0.0.7.5566: UDP, length 1470
04:58:06.437784 IP 10.0.0.1.47946 > 10.0.0.7.5566: UDP, length 1470
04:58:06.438667 IP 10.0.0.1.47946 > 10.0.0.7.5566: UDP, length 1470
04:58:06.439075 IP 10.0.0.1.47946 > 10.0.0.7.5566: UDP, length 1470
04:58:06.439633 IP 10.0.0.1.47946 > 10.0.0.7.5566: UDP, length 1470
04:58:06.441217 IP 10.0.0.1.47946 > 10.0.0.7.5566: UDP, length 1470
04:58:06.441232 IP 10.0.0.1.47946 > 10.0.0.7.5566: UDP, length 1470
04:58:06.443683 IP 10.0.0.1.47946 > 10.0.0.7.5566: UDP, length 1470
04:58:06.443706 IP 10.0.0.1.47946 > 10.0.0.7.5566: UDP, length 1470
04:58:06.444467 IP 10.0.0.1.47946 > 10.0.0.7.5566: UDP, length 1470
04:58:06.445501 IP 10.0.0.1.47946 > 10.0.0.7.5566: UDP, length 1470
04:58:06.446431 IP 10.0.0.1.47946 > 10.0.0.7.5566: UDP, length 1470
04:58:06.447084 IP 10.0.0.1.47946 > 10.0.0.7.5566: UDP, length 1470
04:58:06.447789 IP 10.0.0.1.47946 > 10.0.0.7.5566: UDP, length 1470
04:58:06.448933 IP 10.0.0.1.47946 > 10.0.0.7.5566: UDP, length 1470
04:58:06.450973 IP 10.0.0.1.47946 > 10.0.0.7.5566: UDP, length 1470
04:58:06.451020 IP 10.0.0.1.47946 > 10.0.0.7.5566: UDP, length 1470
04:58:06.452059 IP 10.0.0.1.47946 > 10.0.0.7.5566: UDP, length 1470
04:58:06.452830 IP 10.0.0.1.47946 > 10.0.0.7.5566: UDP, length 1470
04:58:06.453457 IP 10.0.0.1.47946 > 10.0.0.7.5566: UDP, length 1470
04:58:06.457968 IP 10.0.0.1.47946 > 10.0.0.7.5566: UDP, length 1470
04:58:06.458046 IP 10.0.0.1.47946 > 10.0.0.7.5566: UDP, length 1470
04:58:06.459026 IP 10.0.0.1.47946 > 10.0.0.7.5566: UDP, length 1470
04:58:06.459568 IP 10.0.0.1.47946 > 10.0.0.7.5566: UDP, length 1470
04:58:06.460724 IP 10.0.0.1.47946 > 10.0.0.7.5566: UDP, length 1470
04:58:06.461481 IP 10.0.0.1.47946 > 10.0.0.7.5566: UDP, length 1470
04:58:06.462037 IP 10.0.0.1.47946 > 10.0.0.7.5566: UDP, length 1470
04:58:06.463150 IP 10.0.0.1.47946 > 10.0.0.7.5566: UDP, length 1470
04:58:06.464794 IP 10.0.0.1.47946 > 10.0.0.7.5566: UDP, length 1470
04:58:06.464836 IP 10.0.0.1.47946 > 10.0.0.7.5566: UDP, length 1470
04:58:06.466148 IP 10.0.0.1.47946 > 10.0.0.7.5566: UDP, length 1470
04:58:06.466401 IP 10.0.0.1.47946 > 10.0.0.7.5566: UDP, length 1470
04:58:06.467393 IP 10.0.0.1.47946 > 10.0.0.7.5566: UDP, length 1470
04:58:06.470465 IP 10.0.0.1.47946 > 10.0.0.7.5566: UDP, length 1470
04:58:06.470787 IP 10.0.0.1.47946 > 10.0.0.7.5566: UDP, length 1470
04:58:06.471305 IP 10.0.0.1.47946 > 10.0.0.7.5566: UDP, length 1470
04:58:06.472236 IP 10.0.0.1.47946 > 10.0.0.7.5566: UDP, length 1470
04:58:06.473852 IP 10.0.0.1.47946 > 10.0.0.7.5566: UDP, length 1470
04:58:06.473899 IP 10.0.0.1.47946 > 10.0.0.7.5566: UDP, length 1470
04:58:06.474736 IP 10.0.0.1.47946 > 10.0.0.7.5566: UDP, length 1470
04:58:06.475927 IP 10.0.0.1.47946 > 10.0.0.7.5566: UDP, length 1470
04:58:06.476620 IP 10.0.0.1.47946 > 10.0.0.7.5566: UDP, length 1470
04:58:06.477227 IP 10.0.0.1.47946 > 10.0.0.7.5566: UDP, length 1470
04:58:06.478077 IP 10.0.0.1.47946 > 10.0.0.7.5566: UDP, length 1470
04:58:06.480346 IP 10.0.0.1.47946 > 10.0.0.7.5566: UDP, length 1470
04:58:06.480383 IP 10.0.0.1.47946 > 10.0.0.7.5566: UDP, length 1470
04:58:06.483939 IP 10.0.0.1.47946 > 10.0.0.7.5566: UDP, length 1470
04:58:06.484160 IP 10.0.0.1.47946 > 10.0.0.7.5566: UDP, length 1470
04:58:06.484744 IP 10.0.0.1.47946 > 10.0.0.7.5566: UDP, length 1470
04:58:06.486029 IP 10.0.0.1.47946 > 10.0.0.7.5566: UDP, length 1470
04:58:06.488101 IP 10.0.0.1.47946 > 10.0.0.7.5566: UDP, length 1470
04:58:06.488160 IP 10.0.0.1.47946 > 10.0.0.7.5566: UDP, length 1470
04:58:06.489293 IP 10.0.0.1.47946 > 10.0.0.7.5566: UDP, length 1470
04:58:06.489685 IP 10.0.0.1.47946 > 10.0.0.7.5566: UDP, length 1470
04:58:06.492295 IP 10.0.0.1.47946 > 10.0.0.7.5566: UDP, length 1470
04:58:06.492483 IP 10.0.0.1.47946 > 10.0.0.7.5566: UDP, length 1470
04:58:06.493270 IP 10.0.0.1.47946 > 10.0.0.7.5566: UDP, length 1470
04:58:06.493915 IP 10.0.0.1.47946 > 10.0.0.7.5566: UDP, length 1470
04:58:06.495159 IP 10.0.0.1.47946 > 10.0.0.7.5566: UDP, length 1470
04:58:06.496137 IP 10.0.0.1.47946 > 10.0.0.7.5566: UDP, length 1470
04:58:06.497463 IP 10.0.0.1.47946 > 10.0.0.7.5566: UDP, length 1470
04:58:06.497463 IP 10.0.0.1.47946 > 10.0.0.7.5566: UDP, length 1470
04:58:06.498375 IP 10.0.0.1.47946 > 10.0.0.7.5566: UDP, length 1470
04:58:06.501376 IP 10.0.0.1.47946 > 10.0.0.7.5566: UDP, length 1470
04:58:06.501428 IP 10.0.0.1.47946 > 10.0.0.7.5566: UDP, length 1470
04:58:06.506944 IP 10.0.0.1.47946 > 10.0.0.7.5566: UDP, length 1470
04:58:06.507164 IP 10.0.0.1.47946 > 10.0.0.7.5566: UDP, length 1470
04:58:06.507895 IP 10.0.0.1.47946 > 10.0.0.7.5566: UDP, length 1470
04:58:06.508599 IP 10.0.0.1.47946 > 10.0.0.7.5566: UDP, length 1470
04:58:06.509360 IP 10.0.0.1.47946 > 10.0.0.7.5566: UDP, length 1470
04:58:06.511048 IP 10.0.0.1.47946 > 10.0.0.7.5566: UDP, length 1470
04:58:06.511048 IP 10.0.0.1.47946 > 10.0.0.7.5566: UDP, length 1470
04:58:06.513865 IP 10.0.0.1.47946 > 10.0.0.7.5566: UDP, length 1470
04:58:06.513901 IP 10.0.0.1.47946 > 10.0.0.7.5566: UDP, length 1470
04:58:06.515348 IP 10.0.0.1.47946 > 10.0.0.7.5566: UDP, length 1470
04:58:06.517753 IP 10.0.0.1.47946 > 10.0.0.7.5566: UDP, length 1470
04:58:06.517794 IP 10.0.0.1.47946 > 10.0.0.7.5566: UDP, length 1470
04:58:06.518681 IP 10.0.0.1.47946 > 10.0.0.7.5566: UDP, length 1470
04:58:06.519489 IP 10.0.0.1.47946 > 10.0.0.7.5566: UDP, length 1470
04:58:06.522864 IP 10.0.0.1.47946 > 10.0.0.7.5566: UDP, length 1470
04:58:06.522931 IP 10.0.0.1.47946 > 10.0.0.7.5566: UDP, length 1470
04:58:06.523759 IP 10.0.0.1.47946 > 10.0.0.7.5566: UDP, length 1470
04:58:06.524452 IP 10.0.0.1.47946 > 10.0.0.7.5566: UDP, length 1470
04:58:06.526839 IP 10.0.0.1.47946 > 10.0.0.7.5566: UDP, length 1470
04:58:06.526840 IP 10.0.0.1.47946 > 10.0.0.7.5566: UDP, length 1470
04:58:06.528563 IP 10.0.0.1.47946 > 10.0.0.7.5566: UDP, length 1470
04:58:06.528622 IP 10.0.0.1.47946 > 10.0.0.7.5566: UDP, length 1470
04:58:06.529542 IP 10.0.0.1.47946 > 10.0.0.7.5566: UDP, length 1470
04:58:06.531370 IP 10.0.0.1.47946 > 10.0.0.7.5566: UDP, length 1470
04:58:06.531488 IP 10.0.0.1.47946 > 10.0.0.7.5566: UDP, length 1470
04:58:06.533149 IP 10.0.0.1.47946 > 10.0.0.7.5566: UDP, length 1470
04:58:06.533150 IP 10.0.0.1.47946 > 10.0.0.7.5566: UDP, length 1470
04:58:06.534167 IP 10.0.0.1.47946 > 10.0.0.7.5566: UDP, length 1470
04:58:06.534759 IP 10.0.0.1.47946 > 10.0.0.7.5566: UDP, length 1470
04:58:06.538600 IP 10.0.0.1.47946 > 10.0.0.7.5566: UDP, length 1470
04:58:06.538644 IP 10.0.0.1.47946 > 10.0.0.7.5566: UDP, length 1470
04:58:06.539522 IP 10.0.0.1.47946 > 10.0.0.7.5566: UDP, length 1470
04:58:06.540372 IP 10.0.0.1.47946 > 10.0.0.7.5566: UDP, length 1470
04:58:06.541056 IP 10.0.0.1.47946 > 10.0.0.7.5566: UDP, length 1470
04:58:06.541930 IP 10.0.0.1.47946 > 10.0.0.7.5566: UDP, length 1470
04:58:06.542609 IP 10.0.0.1.47946 > 10.0.0.7.5566: UDP, length 1470
04:58:06.544672 IP 10.0.0.1.47946 > 10.0.0.7.5566: UDP, length 1470
04:58:06.545324 IP 10.0.0.1.47946 > 10.0.0.7.5566: UDP, length 1470
04:58:06.545794 IP 10.0.0.1.47946 > 10.0.0.7.5566: UDP, length 1470
04:58:06.546304 IP 10.0.0.1.47946 > 10.0.0.7.5566: UDP, length 1470
04:58:06.548370 IP 10.0.0.1.47946 > 10.0.0.7.5566: UDP, length 1470
04:58:06.548432 IP 10.0.0.1.47946 > 10.0.0.7.5566: UDP, length 1470
04:58:06.549844 IP 10.0.0.1.47946 > 10.0.0.7.5566: UDP, length 1470
04:58:06.550243 IP 10.0.0.1.47946 > 10.0.0.7.5566: UDP, length 1470
04:58:06.550776 IP 10.0.0.1.47946 > 10.0.0.7.5566: UDP, length 1470
04:58:06.551818 IP 10.0.0.1.47946 > 10.0.0.7.5566: UDP, length 1470
04:58:06.553126 IP 10.0.0.1.47946 > 10.0.0.7.5566: UDP, length 1470
04:58:06.553181 IP 10.0.0.1.47946 > 10.0.0.7.5566: UDP, length 1470
04:58:06.553999 IP 10.0.0.1.47946 > 10.0.0.7.5566: UDP, length 1470
04:58:06.558160 IP 10.0.0.1.47946 > 10.0.0.7.5566: UDP, length 1470
04:58:06.558252 IP 10.0.0.1.47946 > 10.0.0.7.5566: UDP, length 1470
04:58:06.559834 IP 10.0.0.1.47946 > 10.0.0.7.5566: UDP, length 1470
04:58:06.561677 IP 10.0.0.1.47946 > 10.0.0.7.5566: UDP, length 1470
04:58:06.561678 IP 10.0.0.1.47946 > 10.0.0.7.5566: UDP, length 1470
04:58:06.562780 IP 10.0.0.1.47946 > 10.0.0.7.5566: UDP, length 1470
04:58:06.569843 IP 10.0.0.1.47946 > 10.0.0.7.5566: UDP, length 1470
04:58:06.574031 IP 10.0.0.1.47946 > 10.0.0.7.5566: UDP, length 1470
04:58:06.574032 IP 10.0.0.1.47946 > 10.0.0.7.5566: UDP, length 1470
04:58:06.575257 IP 10.0.0.1.47946 > 10.0.0.7.5566: UDP, length 1470
04:58:06.578977 IP 10.0.0.1.47946 > 10.0.0.7.5566: UDP, length 1470
04:58:06.579029 IP 10.0.0.1.47946 > 10.0.0.7.5566: UDP, length 1470
04:58:06.580089 IP 10.0.0.1.47946 > 10.0.0.7.5566: UDP, length 1470
04:58:06.581951 IP 10.0.0.1.47946 > 10.0.0.7.5566: UDP, length 1470
04:58:06.581993 IP 10.0.0.1.47946 > 10.0.0.7.5566: UDP, length 1470
04:58:06.586822 IP 10.0.0.1.47946 > 10.0.0.7.5566: UDP, length 1470
04:58:06.588407 IP 10.0.0.1.47946 > 10.0.0.7.5566: UDP, length 1470
04:58:06.588408 IP 10.0.0.1.47946 > 10.0.0.7.5566: UDP, length 1470
04:58:06.589973 IP 10.0.0.1.47946 > 10.0.0.7.5566: UDP, length 1470
04:58:06.590004 IP 10.0.0.1.47946 > 10.0.0.7.5566: UDP, length 1470
04:58:06.592981 IP 10.0.0.1.47946 > 10.0.0.7.5566: UDP, length 1470
04:58:06.596078 IP 10.0.0.1.47946 > 10.0.0.7.5566: UDP, length 1470
04:58:06.596121 IP 10.0.0.1.47946 > 10.0.0.7.5566: UDP, length 1470
04:58:06.599565 IP 10.0.0.1.47946 > 10.0.0.7.5566: UDP, length 1470
04:58:06.600008 IP 10.0.0.1.47946 > 10.0.0.7.5566: UDP, length 1470
04:58:06.602881 IP 10.0.0.1.47946 > 10.0.0.7.5566: UDP, length 1470
04:58:06.602882 IP 10.0.0.1.47946 > 10.0.0.7.5566: UDP, length 1470
04:58:06.604463 IP 10.0.0.1.47946 > 10.0.0.7.5566: UDP, length 1470
04:58:06.604505 IP 10.0.0.1.47946 > 10.0.0.7.5566: UDP, length 1470
04:58:06.607941 IP 10.0.0.1.47946 > 10.0.0.7.5566: UDP, length 1470
04:58:06.607967 IP 10.0.0.1.47946 > 10.0.0.7.5566: UDP, length 1470
04:58:06.609167 IP 10.0.0.1.47946 > 10.0.0.7.5566: UDP, length 1470
04:58:06.609905 IP 10.0.0.1.47946 > 10.0.0.7.5566: UDP, length 1470
04:58:06.610325 IP 10.0.0.1.47946 > 10.0.0.7.5566: UDP, length 1470
04:58:06.611792 IP 10.0.0.1.47946 > 10.0.0.7.5566: UDP, length 1470
04:58:06.612593 IP 10.0.0.1.47946 > 10.0.0.7.5566: UDP, length 1470
04:58:06.612984 IP 10.0.0.1.47946 > 10.0.0.7.5566: UDP, length 1470
04:58:06.613687 IP 10.0.0.1.47946 > 10.0.0.7.5566: UDP, length 1470
04:58:06.616214 IP 10.0.0.1.47946 > 10.0.0.7.5566: UDP, length 1470
04:58:06.616258 IP 10.0.0.1.47946 > 10.0.0.7.5566: UDP, length 1470
04:58:06.617354 IP 10.0.0.1.47946 > 10.0.0.7.5566: UDP, length 1470
04:58:06.620065 IP 10.0.0.1.47946 > 10.0.0.7.5566: UDP, length 1470
04:58:06.620096 IP 10.0.0.1.47946 > 10.0.0.7.5566: UDP, length 1470
04:58:06.623069 IP 10.0.0.1.47946 > 10.0.0.7.5566: UDP, length 1470
04:58:06.623070 IP 10.0.0.1.47946 > 10.0.0.7.5566: UDP, length 1470
04:58:06.624288 IP 10.0.0.1.47946 > 10.0.0.7.5566: UDP, length 1470
04:58:06.628240 IP 10.0.0.1.47946 > 10.0.0.7.5566: UDP, length 1470
04:58:06.631041 IP 10.0.0.1.47946 > 10.0.0.7.5566: UDP, length 1470
04:58:06.631107 IP 10.0.0.1.47946 > 10.0.0.7.5566: UDP, length 1470
04:58:06.637018 IP 10.0.0.1.47946 > 10.0.0.7.5566: UDP, length 1470
04:58:06.638332 IP 10.0.0.1.47946 > 10.0.0.7.5566: UDP, length 1470
04:58:06.638399 IP 10.0.0.1.47946 > 10.0.0.7.5566: UDP, length 1470
04:58:06.639974 IP 10.0.0.1.47946 > 10.0.0.7.5566: UDP, length 1470
04:58:06.640007 IP 10.0.0.1.47946 > 10.0.0.7.5566: UDP, length 1470
04:58:06.644011 IP 10.0.0.1.47946 > 10.0.0.7.5566: UDP, length 1470
04:58:06.645175 IP 10.0.0.1.47946 > 10.0.0.7.5566: UDP, length 1470
04:58:06.647218 IP 10.0.0.1.47946 > 10.0.0.7.5566: UDP, length 1470
04:58:06.647219 IP 10.0.0.1.47946 > 10.0.0.7.5566: UDP, length 1470
04:58:06.648533 IP 10.0.0.1.47946 > 10.0.0.7.5566: UDP, length 1470
04:58:06.651045 IP 10.0.0.1.47946 > 10.0.0.7.5566: UDP, length 1470
04:58:06.651081 IP 10.0.0.1.47946 > 10.0.0.7.5566: UDP, length 1470
04:58:06.653156 IP 10.0.0.1.47946 > 10.0.0.7.5566: UDP, length 1470
04:58:06.658580 IP 10.0.0.1.47946 > 10.0.0.7.5566: UDP, length 1470
04:58:06.658581 IP 10.0.0.1.47946 > 10.0.0.7.5566: UDP, length 1470
04:58:06.660131 IP 10.0.0.1.47946 > 10.0.0.7.5566: UDP, length 1470
04:58:06.660205 IP 10.0.0.1.47946 > 10.0.0.7.5566: UDP, length 1470
04:58:06.661049 IP 10.0.0.1.47946 > 10.0.0.7.5566: UDP, length 1470
04:58:06.663070 IP 10.0.0.1.47946 > 10.0.0.7.5566: UDP, length 1470
04:58:06.663100 IP 10.0.0.1.47946 > 10.0.0.7.5566: UDP, length 1470
04:58:06.665977 IP 10.0.0.1.47946 > 10.0.0.7.5566: UDP, length 1470
04:58:06.667372 IP 10.0.0.1.47946 > 10.0.0.7.5566: UDP, length 1470
04:58:06.668476 IP 10.0.0.1.47946 > 10.0.0.7.5566: UDP, length 1470
04:58:06.668477 IP 10.0.0.1.47946 > 10.0.0.7.5566: UDP, length 1470
04:58:06.671300 IP 10.0.0.1.47946 > 10.0.0.7.5566: UDP, length 1470
04:58:06.671345 IP 10.0.0.1.47946 > 10.0.0.7.5566: UDP, length 1470
04:58:06.674706 IP 10.0.0.1.47946 > 10.0.0.7.5566: UDP, length 1470
04:58:06.674779 IP 10.0.0.1.47946 > 10.0.0.7.5566: UDP, length 1470
04:58:06.677526 IP 10.0.0.1.47946 > 10.0.0.7.5566: UDP, length 1470
04:58:06.679401 IP 10.0.0.1.47946 > 10.0.0.7.5566: UDP, length 1470
04:58:06.679443 IP 10.0.0.1.47946 > 10.0.0.7.5566: UDP, length 1470
04:58:06.680709 IP 10.0.0.1.47946 > 10.0.0.7.5566: UDP, length 1470
04:58:06.681322 IP 10.0.0.1.47946 > 10.0.0.7.5566: UDP, length 1470
04:58:06.681870 IP 10.0.0.1.47946 > 10.0.0.7.5566: UDP, length 1470
04:58:06.683605 IP 10.0.0.1.47946 > 10.0.0.7.5566: UDP, length 1470
04:58:06.684715 IP 10.0.0.1.47946 > 10.0.0.7.5566: UDP, length 1470
04:58:06.684716 IP 10.0.0.1.47946 > 10.0.0.7.5566: UDP, length 1470
04:58:06.688366 IP 10.0.0.1.47946 > 10.0.0.7.5566: UDP, length 1470
04:58:06.690155 IP 10.0.0.1.47946 > 10.0.0.7.5566: UDP, length 1470
04:58:06.691224 IP 10.0.0.1.47946 > 10.0.0.7.5566: UDP, length 1470
04:58:06.694797 IP 10.0.0.1.47946 > 10.0.0.7.5566: UDP, length 1470
04:58:06.695936 IP 10.0.0.1.47946 > 10.0.0.7.5566: UDP, length 1470
04:58:06.697049 IP 10.0.0.1.47946 > 10.0.0.7.5566: UDP, length 1470
04:58:06.699911 IP 10.0.0.1.47946 > 10.0.0.7.5566: UDP, length 1470
04:58:06.699934 IP 10.0.0.1.47946 > 10.0.0.7.5566: UDP, length 1470
04:58:06.701116 IP 10.0.0.1.47946 > 10.0.0.7.5566: UDP, length 1470
04:58:06.703070 IP 10.0.0.1.47946 > 10.0.0.7.5566: UDP, length 1470
04:58:06.704626 IP 10.0.0.1.47946 > 10.0.0.7.5566: UDP, length 1470
04:58:06.704626 IP 10.0.0.1.47946 > 10.0.0.7.5566: UDP, length 1470
04:58:06.706211 IP 10.0.0.1.47946 > 10.0.0.7.5566: UDP, length 1470
04:58:06.708091 IP 10.0.0.1.47946 > 10.0.0.7.5566: UDP, length 1470
04:58:06.708634 IP 10.0.0.1.47946 > 10.0.0.7.5566: UDP, length 1470
04:58:06.711105 IP 10.0.0.1.47946 > 10.0.0.7.5566: UDP, length 1470
04:58:06.714227 IP 10.0.0.1.47946 > 10.0.0.7.5566: UDP, length 1470
04:58:06.717212 IP 10.0.0.1.47946 > 10.0.0.7.5566: UDP, length 1470
04:58:06.718418 IP 10.0.0.1.47946 > 10.0.0.7.5566: UDP, length 1470
04:58:06.722560 IP 10.0.0.1.47946 > 10.0.0.7.5566: UDP, length 1470
04:58:06.722637 IP 10.0.0.1.47946 > 10.0.0.7.5566: UDP, length 1470
04:58:06.723690 IP 10.0.0.1.47946 > 10.0.0.7.5566: UDP, length 1470
04:58:06.724906 IP 10.0.0.1.47946 > 10.0.0.7.5566: UDP, length 1470
04:58:06.728635 IP 10.0.0.1.47946 > 10.0.0.7.5566: UDP, length 1470
04:58:06.731319 IP 10.0.0.1.47946 > 10.0.0.7.5566: UDP, length 1470
04:58:06.734450 IP 10.0.0.1.47946 > 10.0.0.7.5566: UDP, length 1470
04:58:06.738188 IP 10.0.0.1.47946 > 10.0.0.7.5566: UDP, length 1470
04:58:06.739861 IP 10.0.0.1.47946 > 10.0.0.7.5566: UDP, length 1470
04:58:06.742710 IP 10.0.0.1.47946 > 10.0.0.7.5566: UDP, length 1470
04:58:06.742760 IP 10.0.0.1.47946 > 10.0.0.7.5566: UDP, length 1470
04:58:06.747843 IP 10.0.0.1.47946 > 10.0.0.7.5566: UDP, length 1470
04:58:06.748977 IP 10.0.0.1.47946 > 10.0.0.7.5566: UDP, length 1470
04:58:06.750061 IP 10.0.0.1.47946 > 10.0.0.7.5566: UDP, length 1470
04:58:06.751179 IP 10.0.0.1.47946 > 10.0.0.7.5566: UDP, length 1470
04:58:06.753805 IP 10.0.0.1.47946 > 10.0.0.7.5566: UDP, length 1470
04:58:06.756674 IP 10.0.0.1.47946 > 10.0.0.7.5566: UDP, length 1470
04:58:06.756734 IP 10.0.0.1.47946 > 10.0.0.7.5566: UDP, length 1470
04:58:06.758251 IP 10.0.0.1.47946 > 10.0.0.7.5566: UDP, length 1470
04:58:06.758303 IP 10.0.0.1.47946 > 10.0.0.7.5566: UDP, length 1470
04:58:06.761306 IP 10.0.0.1.47946 > 10.0.0.7.5566: UDP, length 1470
04:58:06.762870 IP 10.0.0.1.47946 > 10.0.0.7.5566: UDP, length 1470
04:58:06.765380 IP 10.0.0.1.47946 > 10.0.0.7.5566: UDP, length 1470
04:58:06.768627 IP 10.0.0.1.47946 > 10.0.0.7.5566: UDP, length 1470
04:58:06.770358 IP 10.0.0.1.47946 > 10.0.0.7.5566: UDP, length 1470
04:58:06.770359 IP 10.0.0.1.47946 > 10.0.0.7.5566: UDP, length 1470
04:58:06.772374 IP 10.0.0.1.47946 > 10.0.0.7.5566: UDP, length 1470
04:58:06.773838 IP 10.0.0.1.47946 > 10.0.0.7.5566: UDP, length 1470
04:58:06.773845 IP 10.0.0.1.47946 > 10.0.0.7.5566: UDP, length 1470
04:58:06.781490 IP 10.0.0.1.47946 > 10.0.0.7.5566: UDP, length 1470
04:58:06.783191 IP 10.0.0.1.47946 > 10.0.0.7.5566: UDP, length 1470
04:58:06.788611 IP 10.0.0.1.47946 > 10.0.0.7.5566: UDP, length 1470
04:58:06.788706 IP 10.0.0.1.47946 > 10.0.0.7.5566: UDP, length 1470
04:58:06.791496 IP 10.0.0.1.47946 > 10.0.0.7.5566: UDP, length 1470
04:58:06.793896 IP 10.0.0.1.47946 > 10.0.0.7.5566: UDP, length 1470
04:58:06.797444 IP 10.0.0.1.47946 > 10.0.0.7.5566: UDP, length 1470
04:58:06.798732 IP 10.0.0.1.47946 > 10.0.0.7.5566: UDP, length 1470
04:58:06.798954 IP 10.0.0.1.47946 > 10.0.0.7.5566: UDP, length 1470
04:58:06.802396 IP 10.0.0.1.47946 > 10.0.0.7.5566: UDP, length 1470
04:58:06.802559 IP 10.0.0.1.47946 > 10.0.0.7.5566: UDP, length 1470
04:58:06.805696 IP 10.0.0.1.47946 > 10.0.0.7.5566: UDP, length 1470
04:58:06.807437 IP 10.0.0.1.47946 > 10.0.0.7.5566: UDP, length 1470
04:58:06.807438 IP 10.0.0.1.47946 > 10.0.0.7.5566: UDP, length 1470
04:58:06.808786 IP 10.0.0.1.47946 > 10.0.0.7.5566: UDP, length 1470
04:58:06.809419 IP 10.0.0.1.47946 > 10.0.0.7.5566: UDP, length 1470
04:58:06.810767 IP 10.0.0.1.47946 > 10.0.0.7.5566: UDP, length 1470
04:58:06.812582 IP 10.0.0.1.47946 > 10.0.0.7.5566: UDP, length 1470
04:58:06.812624 IP 10.0.0.1.47946 > 10.0.0.7.5566: UDP, length 1470
04:58:06.813682 IP 10.0.0.1.47946 > 10.0.0.7.5566: UDP, length 1470
04:58:06.815053 IP 10.0.0.1.47946 > 10.0.0.7.5566: UDP, length 1470
04:58:06.818064 IP 10.0.0.1.47946 > 10.0.0.7.5566: UDP, length 1470
04:58:06.818115 IP 10.0.0.1.47946 > 10.0.0.7.5566: UDP, length 1470
04:58:06.825110 IP 10.0.0.1.47946 > 10.0.0.7.5566: UDP, length 1470
04:58:06.826438 IP 10.0.0.1.47946 > 10.0.0.7.5566: UDP, length 1470
04:58:06.826489 IP 10.0.0.1.47946 > 10.0.0.7.5566: UDP, length 1470
04:58:06.827886 IP 10.0.0.1.47946 > 10.0.0.7.5566: UDP, length 1470
04:58:06.829106 IP 10.0.0.1.47946 > 10.0.0.7.5566: UDP, length 1470
04:58:06.838513 IP 10.0.0.1.47946 > 10.0.0.7.5566: UDP, length 1470
04:58:06.842933 IP 10.0.0.1.47946 > 10.0.0.7.5566: UDP, length 1470
04:58:06.843001 IP 10.0.0.1.47946 > 10.0.0.7.5566: UDP, length 1470
04:58:06.846057 IP 10.0.0.1.47946 > 10.0.0.7.5566: UDP, length 1470
04:58:06.848949 IP 10.0.0.1.47946 > 10.0.0.7.5566: UDP, length 1470
04:58:06.848997 IP 10.0.0.1.47946 > 10.0.0.7.5566: UDP, length 1470
04:58:06.851013 IP 10.0.0.1.47946 > 10.0.0.7.5566: UDP, length 1470
04:58:06.851166 IP 10.0.0.1.47946 > 10.0.0.7.5566: UDP, length 1470
04:58:06.852454 IP 10.0.0.1.47946 > 10.0.0.7.5566: UDP, length 1470
04:58:06.853576 IP 10.0.0.1.47946 > 10.0.0.7.5566: UDP, length 1470
04:58:06.853611 IP 10.0.0.1.47946 > 10.0.0.7.5566: UDP, length 1470
04:58:06.856999 IP 10.0.0.1.47946 > 10.0.0.7.5566: UDP, length 1470
04:58:06.858047 IP 10.0.0.1.47946 > 10.0.0.7.5566: UDP, length 1470
04:58:06.858063 IP 10.0.0.1.47946 > 10.0.0.7.5566: UDP, length 1470
04:58:06.859174 IP 10.0.0.1.47946 > 10.0.0.7.5566: UDP, length 1470
04:58:06.859767 IP 10.0.0.1.47946 > 10.0.0.7.5566: UDP, length 1470
04:58:06.861167 IP 10.0.0.1.47946 > 10.0.0.7.5566: UDP, length 1470
04:58:06.861301 IP 10.0.0.1.47946 > 10.0.0.7.5566: UDP, length 1470
04:58:06.862354 IP 10.0.0.1.47946 > 10.0.0.7.5566: UDP, length 1470
04:58:06.863757 IP 10.0.0.1.47946 > 10.0.0.7.5566: UDP, length 1470
04:58:06.865005 IP 10.0.0.1.47946 > 10.0.0.7.5566: UDP, length 1470
04:58:06.867750 IP 10.0.0.1.47946 > 10.0.0.7.5566: UDP, length 1470
04:58:06.868857 IP 10.0.0.1.47946 > 10.0.0.7.5566: UDP, length 1470
04:58:06.868857 IP 10.0.0.1.47946 > 10.0.0.7.5566: UDP, length 1470
04:58:06.873243 IP 10.0.0.1.47946 > 10.0.0.7.5566: UDP, length 1470
04:58:06.878690 IP 10.0.0.1.47946 > 10.0.0.7.5566: UDP, length 1470
04:58:06.878798 IP 10.0.0.1.47946 > 10.0.0.7.5566: UDP, length 1470
04:58:06.883152 IP 10.0.0.1.47946 > 10.0.0.7.5566: UDP, length 1470
04:58:06.883241 IP 10.0.0.1.47946 > 10.0.0.7.5566: UDP, length 1470
04:58:06.888755 IP 10.0.0.1.47946 > 10.0.0.7.5566: UDP, length 1470
04:58:06.889225 IP 10.0.0.1.47946 > 10.0.0.7.5566: UDP, length 1470
04:58:06.891335 IP 10.0.0.1.47946 > 10.0.0.7.5566: UDP, length 1470
04:58:06.893152 IP 10.0.0.1.47946 > 10.0.0.7.5566: UDP, length 1470
04:58:06.893211 IP 10.0.0.1.47946 > 10.0.0.7.5566: UDP, length 1470
04:58:06.895302 IP 10.0.0.1.47946 > 10.0.0.7.5566: UDP, length 1470
04:58:06.895401 IP 10.0.0.1.47946 > 10.0.0.7.5566: UDP, length 1470
04:58:06.896929 IP 10.0.0.1.47946 > 10.0.0.7.5566: UDP, length 1470
04:58:06.898585 IP 10.0.0.1.47946 > 10.0.0.7.5566: UDP, length 1470
04:58:06.903338 IP 10.0.0.1.47946 > 10.0.0.7.5566: UDP, length 1470
04:58:06.906049 IP 10.0.0.1.47946 > 10.0.0.7.5566: UDP, length 1470
04:58:06.906049 IP 10.0.0.1.47946 > 10.0.0.7.5566: UDP, length 1470
04:58:06.908612 IP 10.0.0.1.47946 > 10.0.0.7.5566: UDP, length 1470
04:58:06.908675 IP 10.0.0.1.47946 > 10.0.0.7.5566: UDP, length 1470
04:58:06.909731 IP 10.0.0.1.47946 > 10.0.0.7.5566: UDP, length 1470
04:58:06.910375 IP 10.0.0.1.47946 > 10.0.0.7.5566: UDP, length 1470
04:58:06.913213 IP 10.0.0.1.47946 > 10.0.0.7.5566: UDP, length 1470
04:58:06.913244 IP 10.0.0.1.47946 > 10.0.0.7.5566: UDP, length 1470
04:58:06.915015 IP 10.0.0.1.47946 > 10.0.0.7.5566: UDP, length 1470
04:58:06.915016 IP 10.0.0.1.47946 > 10.0.0.7.5566: UDP, length 1470
04:58:06.918663 IP 10.0.0.1.47946 > 10.0.0.7.5566: UDP, length 1470
04:58:06.923364 IP 10.0.0.1.47946 > 10.0.0.7.5566: UDP, length 1470
04:58:06.923411 IP 10.0.0.1.47946 > 10.0.0.7.5566: UDP, length 1470
04:58:06.926035 IP 10.0.0.1.47946 > 10.0.0.7.5566: UDP, length 1470
04:58:06.926509 IP 10.0.0.1.47946 > 10.0.0.7.5566: UDP, length 1470
04:58:06.927545 IP 10.0.0.1.47946 > 10.0.0.7.5566: UDP, length 1470
04:58:06.928651 IP 10.0.0.1.47946 > 10.0.0.7.5566: UDP, length 1470
04:58:06.928674 IP 10.0.0.1.47946 > 10.0.0.7.5566: UDP, length 1470
04:58:06.933347 IP 10.0.0.1.47946 > 10.0.0.7.5566: UDP, length 1470
04:58:06.933994 IP 10.0.0.1.47946 > 10.0.0.7.5566: UDP, length 1470
04:58:06.936419 IP 10.0.0.1.47946 > 10.0.0.7.5566: UDP, length 1470
04:58:06.936420 IP 10.0.0.1.47946 > 10.0.0.7.5566: UDP, length 1470
04:58:06.938772 IP6 fe80::d409:eff:fe7e:8df2.5353 > ff02::fb.5353: 0 [2q] PTR (QM)? _ipps._tcp.local. PTR (QM)? _ipp._tcp.local. (45)
04:58:06.943301 IP 10.0.0.1.47946 > 10.0.0.7.5566: UDP, length 1470
04:58:06.945618 IP 10.0.0.1.47946 > 10.0.0.7.5566: UDP, length 1470
04:58:06.945619 IP 10.0.0.1.47946 > 10.0.0.7.5566: UDP, length 1470
04:58:06.947149 IP6 fe80::f4fa:aeff:fece:1e12 > ff02::2: ICMP6, router solicitation, length 16
04:58:06.947207 IP6 fe80::1452:57ff:fe39:65ed.5353 > ff02::fb.5353: 0*- [0q] 2/0/0 (Cache flush) PTR sam-VirtualBox.local., (Cache flush) AAAA fe80::1452:57ff:fe39:65ed (146)
04:58:06.948805 IP 10.0.0.1.47946 > 10.0.0.7.5566: UDP, length 1470
04:58:06.948828 IP 10.0.0.1.47946 > 10.0.0.7.5566: UDP, length 1470
04:58:06.957194 IP 10.0.0.1.47946 > 10.0.0.7.5566: UDP, length 1470
04:58:06.957296 IP 10.0.0.1.47946 > 10.0.0.7.5566: UDP, length 1470
04:58:06.958879 IP 10.0.0.1.47946 > 10.0.0.7.5566: UDP, length 1470
04:58:06.958908 IP 10.0.0.1.47946 > 10.0.0.7.5566: UDP, length 1470
04:58:06.962296 IP 10.0.0.1.47946 > 10.0.0.7.5566: UDP, length 1470
04:58:06.962325 IP 10.0.0.1.47946 > 10.0.0.7.5566: UDP, length 1470
04:58:06.964828 IP 10.0.0.1.47946 > 10.0.0.7.5566: UDP, length 1470
04:58:06.964829 IP 10.0.0.1.47946 > 10.0.0.7.5566: UDP, length 1470
04:58:06.967064 IP 10.0.0.1.47946 > 10.0.0.7.5566: UDP, length 1470
04:58:06.967126 IP 10.0.0.1.47946 > 10.0.0.7.5566: UDP, length 1470
04:58:06.970714 IP 10.0.0.1.47946 > 10.0.0.7.5566: UDP, length 1470
04:58:06.970806 IP 10.0.0.1.47946 > 10.0.0.7.5566: UDP, length 1470
04:58:06.972973 IP 10.0.0.1.47946 > 10.0.0.7.5566: UDP, length 1470
04:58:06.973004 IP 10.0.0.1.47946 > 10.0.0.7.5566: UDP, length 1470
04:58:06.978036 IP 10.0.0.1.47946 > 10.0.0.7.5566: UDP, length 1470
04:58:06.978081 IP 10.0.0.1.47946 > 10.0.0.7.5566: UDP, length 1470
04:58:06.980009 IP 10.0.0.1.47946 > 10.0.0.7.5566: UDP, length 1470
04:58:06.980050 IP 10.0.0.1.47946 > 10.0.0.7.5566: UDP, length 1470
04:58:06.988110 IP 10.0.0.1.47946 > 10.0.0.7.5566: UDP, length 1470
04:58:06.988205 IP 10.0.0.1.47946 > 10.0.0.7.5566: UDP, length 1470
04:58:06.998124 IP 10.0.0.1.47946 > 10.0.0.7.5566: UDP, length 1470
04:58:06.998243 IP 10.0.0.1.47946 > 10.0.0.7.5566: UDP, length 1470
04:58:07.008150 IP 10.0.0.1.47946 > 10.0.0.7.5566: UDP, length 1470
04:58:07.008211 IP 10.0.0.1.47946 > 10.0.0.7.5566: UDP, length 1470
04:58:07.018220 IP 10.0.0.1.47946 > 10.0.0.7.5566: UDP, length 1470
04:58:07.018308 IP 10.0.0.1.47946 > 10.0.0.7.5566: UDP, length 1470
04:58:07.023315 IP 10.0.0.1.47946 > 10.0.0.7.5566: UDP, length 1470
04:58:07.023316 IP 10.0.0.1.47946 > 10.0.0.7.5566: UDP, length 1470
04:58:07.026210 IP 10.0.0.1.47946 > 10.0.0.7.5566: UDP, length 1470
04:58:07.026270 IP 10.0.0.1.47946 > 10.0.0.7.5566: UDP, length 1470
04:58:07.028184 IP 10.0.0.1.47946 > 10.0.0.7.5566: UDP, length 1470
04:58:07.028185 IP 10.0.0.1.47946 > 10.0.0.7.5566: UDP, length 1470
04:58:07.033351 IP 10.0.0.1.47946 > 10.0.0.7.5566: UDP, length 1470
04:58:07.033492 IP 10.0.0.1.47946 > 10.0.0.7.5566: UDP, length 1470
04:58:07.035985 IP 10.0.0.1.47946 > 10.0.0.7.5566: UDP, length 1470
04:58:07.035985 IP 10.0.0.1.47946 > 10.0.0.7.5566: UDP, length 1470
04:58:07.037909 IP 10.0.0.1.47946 > 10.0.0.7.5566: UDP, length 1470
04:58:07.037939 IP 10.0.0.1.47946 > 10.0.0.7.5566: UDP, length 1470
04:58:07.043160 IP 10.0.0.1.47946 > 10.0.0.7.5566: UDP, length 1470
04:58:07.043234 IP 10.0.0.1.47946 > 10.0.0.7.5566: UDP, length 1470
04:58:07.048294 IP 10.0.0.1.47946 > 10.0.0.7.5566: UDP, length 1470
04:58:07.048386 IP 10.0.0.1.47946 > 10.0.0.7.5566: UDP, length 1470
04:58:07.053105 IP 10.0.0.1.47946 > 10.0.0.7.5566: UDP, length 1470
04:58:07.057214 IP 10.0.0.1.47946 > 10.0.0.7.5566: UDP, length 1470
04:58:07.057254 IP 10.0.0.1.47946 > 10.0.0.7.5566: UDP, length 1470
04:58:07.058376 IP 10.0.0.1.47946 > 10.0.0.7.5566: UDP, length 1470
04:58:07.059832 IP 10.0.0.1.47946 > 10.0.0.7.5566: UDP, length 1470
04:58:07.059833 IP 10.0.0.1.47946 > 10.0.0.7.5566: UDP, length 1470
04:58:07.061193 IP 10.0.0.1.47946 > 10.0.0.7.5566: UDP, length 1470
04:58:07.061975 IP 10.0.0.1.47946 > 10.0.0.7.5566: UDP, length 1470
04:58:07.063175 IP 10.0.0.1.47946 > 10.0.0.7.5566: UDP, length 1470
04:58:07.063213 IP 10.0.0.1.47946 > 10.0.0.7.5566: UDP, length 1470
04:58:07.068610 IP 10.0.0.1.47946 > 10.0.0.7.5566: UDP, length 1470
04:58:07.068693 IP 10.0.0.1.47946 > 10.0.0.7.5566: UDP, length 1470
04:58:07.069887 IP 10.0.0.1.47946 > 10.0.0.7.5566: UDP, length 1470
04:58:07.070370 IP 10.0.0.1.47946 > 10.0.0.7.5566: UDP, length 1470
04:58:07.071444 IP 10.0.0.1.47946 > 10.0.0.7.5566: UDP, length 1470
04:58:07.072242 IP 10.0.0.1.47946 > 10.0.0.7.5566: UDP, length 1470
04:58:07.073180 IP 10.0.0.1.47946 > 10.0.0.7.5566: UDP, length 1470
04:58:07.078667 IP6 fe80::3057:d6ff:fe41:b75a.5353 > ff02::fb.5353: 0 [2q] PTR (QM)? _ipps._tcp.local. PTR (QM)? _ipp._tcp.local. (45)
04:58:07.078868 IP 10.0.0.1.47946 > 10.0.0.7.5566: UDP, length 1470
04:58:07.078868 IP 10.0.0.1.47946 > 10.0.0.7.5566: UDP, length 1470
04:58:07.084181 IP 10.0.0.1.47946 > 10.0.0.7.5566: UDP, length 1470
04:58:07.084253 IP 10.0.0.1.47946 > 10.0.0.7.5566: UDP, length 1470
04:58:07.087360 IP 10.0.0.1.47946 > 10.0.0.7.5566: UDP, length 1470
04:58:07.088668 IP 10.0.0.1.47946 > 10.0.0.7.5566: UDP, length 1470
04:58:07.088716 IP 10.0.0.1.47946 > 10.0.0.7.5566: UDP, length 1470
04:58:07.091670 IP 10.0.0.1.47946 > 10.0.0.7.5566: UDP, length 1470
04:58:07.091738 IP 10.0.0.1.47946 > 10.0.0.7.5566: UDP, length 1470
04:58:07.095328 IP 10.0.0.1.47946 > 10.0.0.7.5566: UDP, length 1470
04:58:07.095416 IP 10.0.0.1.47946 > 10.0.0.7.5566: UDP, length 1470
04:58:07.098712 IP 10.0.0.1.47946 > 10.0.0.7.5566: UDP, length 1470
04:58:07.098767 IP 10.0.0.1.47946 > 10.0.0.7.5566: UDP, length 1470
04:58:07.100986 IP 10.0.0.1.47946 > 10.0.0.7.5566: UDP, length 1470
04:58:07.101011 IP 10.0.0.1.47946 > 10.0.0.7.5566: UDP, length 1470
04:58:07.102855 IP 10.0.0.1.47946 > 10.0.0.7.5566: UDP, length 1470
04:58:07.103004 IP 10.0.0.1.47946 > 10.0.0.7.5566: UDP, length 1470
04:58:07.108862 IP 10.0.0.1.47946 > 10.0.0.7.5566: UDP, length 1470
04:58:07.108963 IP 10.0.0.1.47946 > 10.0.0.7.5566: UDP, length 1470
04:58:07.112268 IP 10.0.0.1.47946 > 10.0.0.7.5566: UDP, length 1470
04:58:07.112335 IP 10.0.0.1.47946 > 10.0.0.7.5566: UDP, length 1470
04:58:07.113484 IP 10.0.0.1.47946 > 10.0.0.7.5566: UDP, length 1470
04:58:07.118884 IP 10.0.0.1.47946 > 10.0.0.7.5566: UDP, length 1470
04:58:07.118928 IP 10.0.0.1.47946 > 10.0.0.7.5566: UDP, length 1470
04:58:07.121777 IP 10.0.0.1.47946 > 10.0.0.7.5566: UDP, length 1470
04:58:07.121817 IP 10.0.0.1.47946 > 10.0.0.7.5566: UDP, length 1470
04:58:07.123430 IP 10.0.0.1.47946 > 10.0.0.7.5566: UDP, length 1470
04:58:07.123439 IP 10.0.0.1.47946 > 10.0.0.7.5566: UDP, length 1470
04:58:07.126281 IP 10.0.0.1.47946 > 10.0.0.7.5566: UDP, length 1470
