13:10:14.835946 IP6 fe80::ccbf:b6ff:feec:6308.5353 > ff02::fb.5353: 0 [2q] [2n] ANY (QM)? 8.0.3.6.c.e.e.f.f.f.6.b.f.b.c.c.0.0.0.0.0.0.0.0.0.0.0.0.0.8.e.f.ip6.arpa. ANY (QM)? sam-VirtualBox.local. (158)
13:10:14.894706 IP6 fe80::e8c8:deff:feaa:7784 > ff02::16: HBH ICMP6, multicast listener report v2, 1 group record(s), length 28
13:10:15.025401 IP6 fe80::ccbf:b6ff:feec:6308 > ff02::16: HBH ICMP6, multicast listener report v2, 1 group record(s), length 28
13:10:15.035481 IP6 fe80::ccbf:b6ff:feec:6308.5353 > ff02::fb.5353: 0*- [0q] 2/0/0 (Cache flush) PTR sam-VirtualBox.local., (Cache flush) AAAA fe80::ccbf:b6ff:feec:6308 (146)
13:10:15.296066 IP6 fe80::ccbf:b6ff:feec:6308.5353 > ff02::fb.5353: 0 [2q] PTR (QM)? _ipps._tcp.local. PTR (QM)? _ipp._tcp.local. (45)
13:10:15.785697 IP6 fe80::1055:81ff:fe17:3f76.5353 > ff02::fb.5353: 0*- [0q] 2/0/0 (Cache flush) PTR sam-VirtualBox.local., (Cache flush) AAAA fe80::1055:81ff:fe17:3f76 (146)
13:10:15.848804 IP6 fe80::9c9a:aaff:fed2:da01.5353 > ff02::fb.5353: 0*- [0q] 2/0/0 (Cache flush) PTR sam-VirtualBox.local., (Cache flush) AAAA fe80::9c9a:aaff:fed2:da01 (146)
13:10:15.886976 ARP, Request who-has 10.0.0.7 tell 10.0.0.1, length 28
13:10:15.890504 ARP, Reply 10.0.0.7 is-at ea:c8:de:aa:77:84, length 28
13:10:15.964713 IP 10.0.0.1.37826 > 10.0.0.7.5566: UDP, length 1470
13:10:15.973762 IP 10.0.0.1.37826 > 10.0.0.7.5566: UDP, length 1470
13:10:15.973762 IP 10.0.0.1.37826 > 10.0.0.7.5566: UDP, length 1470
13:10:15.975831 IP 10.0.0.1.37826 > 10.0.0.7.5566: UDP, length 1470
13:10:15.976397 IP 10.0.0.1.37826 > 10.0.0.7.5566: UDP, length 1470
13:10:15.976922 IP 10.0.0.1.37826 > 10.0.0.7.5566: UDP, length 1470
13:10:15.979399 IP 10.0.0.1.37826 > 10.0.0.7.5566: UDP, length 1470
13:10:15.979400 IP 10.0.0.1.37826 > 10.0.0.7.5566: UDP, length 1470
13:10:15.980181 IP 10.0.0.1.37826 > 10.0.0.7.5566: UDP, length 1470
13:10:15.982425 IP 10.0.0.1.37826 > 10.0.0.7.5566: UDP, length 1470
13:10:15.982426 IP 10.0.0.1.37826 > 10.0.0.7.5566: UDP, length 1470
13:10:15.985971 IP 10.0.0.1.37826 > 10.0.0.7.5566: UDP, length 1470
13:10:15.986434 IP 10.0.0.1.37826 > 10.0.0.7.5566: UDP, length 1470
13:10:15.987883 IP 10.0.0.1.37826 > 10.0.0.7.5566: UDP, length 1470
13:10:15.987884 IP 10.0.0.1.37826 > 10.0.0.7.5566: UDP, length 1470
13:10:15.990212 IP 10.0.0.1.37826 > 10.0.0.7.5566: UDP, length 1470
13:10:15.990213 IP 10.0.0.1.37826 > 10.0.0.7.5566: UDP, length 1470
13:10:15.993438 IP 10.0.0.1.37826 > 10.0.0.7.5566: UDP, length 1470
13:10:15.994760 IP 10.0.0.1.37826 > 10.0.0.7.5566: UDP, length 1470
13:10:15.994760 IP 10.0.0.1.37826 > 10.0.0.7.5566: UDP, length 1470
13:10:15.999078 IP 10.0.0.1.37826 > 10.0.0.7.5566: UDP, length 1470
13:10:16.000242 IP 10.0.0.1.37826 > 10.0.0.7.5566: UDP, length 1470
13:10:16.000345 IP 10.0.0.1.37826 > 10.0.0.7.5566: UDP, length 1470
13:10:16.002155 IP 10.0.0.1.37826 > 10.0.0.7.5566: UDP, length 1470
13:10:16.004434 IP 10.0.0.1.37826 > 10.0.0.7.5566: UDP, length 1470
13:10:16.005239 IP 10.0.0.1.37826 > 10.0.0.7.5566: UDP, length 1470
13:10:16.008765 IP 10.0.0.1.37826 > 10.0.0.7.5566: UDP, length 1470
13:10:16.008888 IP 10.0.0.1.37826 > 10.0.0.7.5566: UDP, length 1470
13:10:16.010001 IP 10.0.0.1.37826 > 10.0.0.7.5566: UDP, length 1470
13:10:16.013502 IP 10.0.0.1.37826 > 10.0.0.7.5566: UDP, length 1470
13:10:16.013503 IP 10.0.0.1.37826 > 10.0.0.7.5566: UDP, length 1470
13:10:16.014895 IP 10.0.0.1.37826 > 10.0.0.7.5566: UDP, length 1470
13:10:16.021219 IP 10.0.0.1.37826 > 10.0.0.7.5566: UDP, length 1470
13:10:16.021220 IP 10.0.0.1.37826 > 10.0.0.7.5566: UDP, length 1470
13:10:16.023525 IP 10.0.0.1.37826 > 10.0.0.7.5566: UDP, length 1470
13:10:16.023662 IP 10.0.0.1.37826 > 10.0.0.7.5566: UDP, length 1470
13:10:16.024853 IP 10.0.0.1.37826 > 10.0.0.7.5566: UDP, length 1470
13:10:16.028862 IP 10.0.0.1.37826 > 10.0.0.7.5566: UDP, length 1470
13:10:16.028862 IP 10.0.0.1.37826 > 10.0.0.7.5566: UDP, length 1470
13:10:16.030067 IP 10.0.0.1.37826 > 10.0.0.7.5566: UDP, length 1470
13:10:16.030610 IP 10.0.0.1.37826 > 10.0.0.7.5566: UDP, length 1470
13:10:16.034330 IP 10.0.0.1.37826 > 10.0.0.7.5566: UDP, length 1470
13:10:16.034472 IP 10.0.0.1.37826 > 10.0.0.7.5566: UDP, length 1470
13:10:16.036330 IP 10.0.0.1.37826 > 10.0.0.7.5566: UDP, length 1470
13:10:16.044340 IP6 fe80::34f4:e0ff:feb5:f83e.5353 > ff02::fb.5353: 0*- [0q] 2/0/0 (Cache flush) PTR sam-VirtualBox.local., (Cache flush) AAAA fe80::34f4:e0ff:feb5:f83e (146)
13:10:16.045935 IP 10.0.0.1.37826 > 10.0.0.7.5566: UDP, length 1470
13:10:16.046005 IP 10.0.0.1.37826 > 10.0.0.7.5566: UDP, length 1470
13:10:16.050064 IP 10.0.0.1.37826 > 10.0.0.7.5566: UDP, length 1470
13:10:16.050227 IP 10.0.0.1.37826 > 10.0.0.7.5566: UDP, length 1470
13:10:16.053738 IP 10.0.0.1.37826 > 10.0.0.7.5566: UDP, length 1470
13:10:16.053926 IP 10.0.0.1.37826 > 10.0.0.7.5566: UDP, length 1470
13:10:16.055483 IP 10.0.0.1.37826 > 10.0.0.7.5566: UDP, length 1470
13:10:16.055680 IP 10.0.0.1.37826 > 10.0.0.7.5566: UDP, length 1470
13:10:16.057725 IP 10.0.0.1.37826 > 10.0.0.7.5566: UDP, length 1470
13:10:16.057827 IP 10.0.0.1.37826 > 10.0.0.7.5566: UDP, length 1470
13:10:16.059016 IP 10.0.0.1.37826 > 10.0.0.7.5566: UDP, length 1470
13:10:16.059533 IP 10.0.0.1.37826 > 10.0.0.7.5566: UDP, length 1470
13:10:16.062006 IP 10.0.0.1.37826 > 10.0.0.7.5566: UDP, length 1470
13:10:16.062100 IP 10.0.0.1.37826 > 10.0.0.7.5566: UDP, length 1470
13:10:16.063123 IP 10.0.0.1.37826 > 10.0.0.7.5566: UDP, length 1470
13:10:16.063602 IP 10.0.0.1.37826 > 10.0.0.7.5566: UDP, length 1470
13:10:16.064690 IP 10.0.0.1.37826 > 10.0.0.7.5566: UDP, length 1470
13:10:16.065256 IP 10.0.0.1.37826 > 10.0.0.7.5566: UDP, length 1470
13:10:16.066014 IP 10.0.0.1.37826 > 10.0.0.7.5566: UDP, length 1470
13:10:16.067063 IP 10.0.0.1.37826 > 10.0.0.7.5566: UDP, length 1470
13:10:16.067630 IP 10.0.0.1.37826 > 10.0.0.7.5566: UDP, length 1470
13:10:16.068495 IP 10.0.0.1.37826 > 10.0.0.7.5566: UDP, length 1470
13:10:16.069379 IP 10.0.0.1.37826 > 10.0.0.7.5566: UDP, length 1470
13:10:16.070143 IP 10.0.0.1.37826 > 10.0.0.7.5566: UDP, length 1470
13:10:16.070917 IP 10.0.0.1.37826 > 10.0.0.7.5566: UDP, length 1470
13:10:16.071984 IP 10.0.0.1.37826 > 10.0.0.7.5566: UDP, length 1470
13:10:16.072483 IP 10.0.0.1.37826 > 10.0.0.7.5566: UDP, length 1470
13:10:16.073603 IP 10.0.0.1.37826 > 10.0.0.7.5566: UDP, length 1470
13:10:16.074093 IP 10.0.0.1.37826 > 10.0.0.7.5566: UDP, length 1470
13:10:16.075195 IP 10.0.0.1.37826 > 10.0.0.7.5566: UDP, length 1470
13:10:16.075702 IP 10.0.0.1.37826 > 10.0.0.7.5566: UDP, length 1470
13:10:16.076744 IP 10.0.0.1.37826 > 10.0.0.7.5566: UDP, length 1470
13:10:16.077304 IP 10.0.0.1.37826 > 10.0.0.7.5566: UDP, length 1470
13:10:16.078405 IP 10.0.0.1.37826 > 10.0.0.7.5566: UDP, length 1470
13:10:16.081857 IP 10.0.0.1.37826 > 10.0.0.7.5566: UDP, length 1470
13:10:16.081858 IP 10.0.0.1.37826 > 10.0.0.7.5566: UDP, length 1470
13:10:16.084581 IP 10.0.0.1.37826 > 10.0.0.7.5566: UDP, length 1470
13:10:16.084667 IP 10.0.0.1.37826 > 10.0.0.7.5566: UDP, length 1470
13:10:16.085731 IP 10.0.0.1.37826 > 10.0.0.7.5566: UDP, length 1470
13:10:16.088104 IP 10.0.0.1.37826 > 10.0.0.7.5566: UDP, length 1470
13:10:16.088105 IP 10.0.0.1.37826 > 10.0.0.7.5566: UDP, length 1470
13:10:16.090609 IP 10.0.0.1.37826 > 10.0.0.7.5566: UDP, length 1470
13:10:16.090720 IP 10.0.0.1.37826 > 10.0.0.7.5566: UDP, length 1470
13:10:16.093447 IP 10.0.0.1.37826 > 10.0.0.7.5566: UDP, length 1470
13:10:16.093449 IP 10.0.0.1.37826 > 10.0.0.7.5566: UDP, length 1470
13:10:16.094766 IP 10.0.0.1.37826 > 10.0.0.7.5566: UDP, length 1470
13:10:16.095231 IP 10.0.0.1.37826 > 10.0.0.7.5566: UDP, length 1470
13:10:16.097074 IP 10.0.0.1.37826 > 10.0.0.7.5566: UDP, length 1470
13:10:16.097075 IP 10.0.0.1.37826 > 10.0.0.7.5566: UDP, length 1470
13:10:16.099349 IP 10.0.0.1.37826 > 10.0.0.7.5566: UDP, length 1470
13:10:16.100693 IP 10.0.0.1.37826 > 10.0.0.7.5566: UDP, length 1470
13:10:16.100706 IP 10.0.0.1.37826 > 10.0.0.7.5566: UDP, length 1470
13:10:16.105944 IP 10.0.0.1.37826 > 10.0.0.7.5566: UDP, length 1470
13:10:16.109012 IP 10.0.0.1.37826 > 10.0.0.7.5566: UDP, length 1470
13:10:16.109013 IP 10.0.0.1.37826 > 10.0.0.7.5566: UDP, length 1470
13:10:16.115055 IP 10.0.0.1.37826 > 10.0.0.7.5566: UDP, length 1470
13:10:16.118877 IP 10.0.0.1.37826 > 10.0.0.7.5566: UDP, length 1470
13:10:16.119057 IP 10.0.0.1.37826 > 10.0.0.7.5566: UDP, length 1470
13:10:16.121147 IP6 fe80::ccbf:b6ff:feec:6308.5353 > ff02::fb.5353: 0*- [0q] 2/0/0 (Cache flush) PTR sam-VirtualBox.local., (Cache flush) AAAA fe80::ccbf:b6ff:feec:6308 (146)
13:10:16.121256 IP 10.0.0.1.37826 > 10.0.0.7.5566: UDP, length 1470
13:10:16.121256 IP 10.0.0.1.37826 > 10.0.0.7.5566: UDP, length 1470
13:10:16.122835 IP 10.0.0.1.37826 > 10.0.0.7.5566: UDP, length 1470
13:10:16.122835 IP 10.0.0.1.37826 > 10.0.0.7.5566: UDP, length 1470
13:10:16.124940 IP6 fe80::10ec:77ff:fe9c:f848.5353 > ff02::fb.5353: 0 [2q] PTR (QM)? _ipps._tcp.local. PTR (QM)? _ipp._tcp.local. (45)
13:10:16.128477 IP 10.0.0.1.37826 > 10.0.0.7.5566: UDP, length 1470
13:10:16.128478 IP 10.0.0.1.37826 > 10.0.0.7.5566: UDP, length 1470
13:10:16.129666 IP 10.0.0.1.37826 > 10.0.0.7.5566: UDP, length 1470
13:10:16.130934 IP 10.0.0.1.37826 > 10.0.0.7.5566: UDP, length 1470
13:10:16.131144 IP 10.0.0.1.37826 > 10.0.0.7.5566: UDP, length 1470
13:10:16.133030 IP 10.0.0.1.37826 > 10.0.0.7.5566: UDP, length 1470
13:10:16.133031 IP 10.0.0.1.37826 > 10.0.0.7.5566: UDP, length 1470
13:10:16.138656 IP 10.0.0.1.37826 > 10.0.0.7.5566: UDP, length 1470
13:10:16.138749 IP 10.0.0.1.37826 > 10.0.0.7.5566: UDP, length 1470
13:10:16.144247 IP 10.0.0.1.37826 > 10.0.0.7.5566: UDP, length 1470
13:10:16.144376 IP 10.0.0.1.37826 > 10.0.0.7.5566: UDP, length 1470
13:10:16.145972 IP 10.0.0.1.37826 > 10.0.0.7.5566: UDP, length 1470
13:10:16.146036 IP 10.0.0.1.37826 > 10.0.0.7.5566: UDP, length 1470
13:10:16.149141 IP 10.0.0.1.37826 > 10.0.0.7.5566: UDP, length 1470
13:10:16.149234 IP 10.0.0.1.37826 > 10.0.0.7.5566: UDP, length 1470
13:10:16.154843 IP 10.0.0.1.37826 > 10.0.0.7.5566: UDP, length 1470
13:10:16.155155 IP 10.0.0.1.37826 > 10.0.0.7.5566: UDP, length 1470
13:10:16.159162 IP 10.0.0.1.37826 > 10.0.0.7.5566: UDP, length 1470
13:10:16.159288 IP 10.0.0.1.37826 > 10.0.0.7.5566: UDP, length 1470
13:10:16.161462 IP 10.0.0.1.37826 > 10.0.0.7.5566: UDP, length 1470
13:10:16.161563 IP 10.0.0.1.37826 > 10.0.0.7.5566: UDP, length 1470
13:10:16.164556 IP 10.0.0.1.37826 > 10.0.0.7.5566: UDP, length 1470
13:10:16.164643 IP 10.0.0.1.37826 > 10.0.0.7.5566: UDP, length 1470
13:10:16.165906 IP 10.0.0.1.37826 > 10.0.0.7.5566: UDP, length 1470
13:10:16.168019 IP 10.0.0.1.37826 > 10.0.0.7.5566: UDP, length 1470
13:10:16.168114 IP 10.0.0.1.37826 > 10.0.0.7.5566: UDP, length 1470
13:10:16.169771 IP 10.0.0.1.37826 > 10.0.0.7.5566: UDP, length 1470
13:10:16.169847 IP 10.0.0.1.37826 > 10.0.0.7.5566: UDP, length 1470
13:10:16.171958 IP 10.0.0.1.37826 > 10.0.0.7.5566: UDP, length 1470
13:10:16.172067 IP 10.0.0.1.37826 > 10.0.0.7.5566: UDP, length 1470
13:10:16.173127 IP 10.0.0.1.37826 > 10.0.0.7.5566: UDP, length 1470
13:10:16.174211 IP 10.0.0.1.37826 > 10.0.0.7.5566: UDP, length 1470
13:10:16.175235 IP 10.0.0.1.37826 > 10.0.0.7.5566: UDP, length 1470
13:10:16.176031 IP 10.0.0.1.37826 > 10.0.0.7.5566: UDP, length 1470
13:10:16.176808 IP 10.0.0.1.37826 > 10.0.0.7.5566: UDP, length 1470
13:10:16.177520 IP 10.0.0.1.37826 > 10.0.0.7.5566: UDP, length 1470
13:10:16.178551 IP 10.0.0.1.37826 > 10.0.0.7.5566: UDP, length 1470
13:10:16.179331 IP 10.0.0.1.37826 > 10.0.0.7.5566: UDP, length 1470
13:10:16.180744 IP 10.0.0.1.37826 > 10.0.0.7.5566: UDP, length 1470
13:10:16.180751 IP 10.0.0.1.37826 > 10.0.0.7.5566: UDP, length 1470
13:10:16.182048 IP 10.0.0.1.37826 > 10.0.0.7.5566: UDP, length 1470
13:10:16.182559 IP 10.0.0.1.37826 > 10.0.0.7.5566: UDP, length 1470
13:10:16.183217 IP 10.0.0.1.37826 > 10.0.0.7.5566: UDP, length 1470
13:10:16.184155 IP 10.0.0.1.37826 > 10.0.0.7.5566: UDP, length 1470
13:10:16.184853 IP 10.0.0.1.37826 > 10.0.0.7.5566: UDP, length 1470
13:10:16.185548 IP 10.0.0.1.37826 > 10.0.0.7.5566: UDP, length 1470
13:10:16.186382 IP 10.0.0.1.37826 > 10.0.0.7.5566: UDP, length 1470
13:10:16.188133 IP 10.0.0.1.37826 > 10.0.0.7.5566: UDP, length 1470
13:10:16.190315 IP 10.0.0.1.37826 > 10.0.0.7.5566: UDP, length 1470
13:10:16.190386 IP 10.0.0.1.37826 > 10.0.0.7.5566: UDP, length 1470
13:10:16.191469 IP 10.0.0.1.37826 > 10.0.0.7.5566: UDP, length 1470
13:10:16.191901 IP 10.0.0.1.37826 > 10.0.0.7.5566: UDP, length 1470
13:10:16.193057 IP 10.0.0.1.37826 > 10.0.0.7.5566: UDP, length 1470
13:10:16.193674 IP 10.0.0.1.37826 > 10.0.0.7.5566: UDP, length 1470
13:10:16.195047 IP 10.0.0.1.37826 > 10.0.0.7.5566: UDP, length 1470
13:10:16.195616 IP 10.0.0.1.37826 > 10.0.0.7.5566: UDP, length 1470
13:10:16.196189 IP 10.0.0.1.37826 > 10.0.0.7.5566: UDP, length 1470
13:10:16.197505 IP 10.0.0.1.37826 > 10.0.0.7.5566: UDP, length 1470
13:10:16.198011 IP 10.0.0.1.37826 > 10.0.0.7.5566: UDP, length 1470
13:10:16.198613 IP 10.0.0.1.37826 > 10.0.0.7.5566: UDP, length 1470
13:10:16.199515 IP 10.0.0.1.37826 > 10.0.0.7.5566: UDP, length 1470
13:10:16.200534 IP 10.0.0.1.37826 > 10.0.0.7.5566: UDP, length 1470
13:10:16.200996 IP 10.0.0.1.37826 > 10.0.0.7.5566: UDP, length 1470
13:10:16.202240 IP 10.0.0.1.37826 > 10.0.0.7.5566: UDP, length 1470
13:10:16.202807 IP 10.0.0.1.37826 > 10.0.0.7.5566: UDP, length 1470
13:10:16.203436 IP 10.0.0.1.37826 > 10.0.0.7.5566: UDP, length 1470
13:10:16.204491 IP 10.0.0.1.37826 > 10.0.0.7.5566: UDP, length 1470
13:10:16.205043 IP 10.0.0.1.37826 > 10.0.0.7.5566: UDP, length 1470
13:10:16.206012 IP 10.0.0.1.37826 > 10.0.0.7.5566: UDP, length 1470
13:10:16.207365 IP 10.0.0.1.37826 > 10.0.0.7.5566: UDP, length 1470
13:10:16.207613 IP 10.0.0.1.37826 > 10.0.0.7.5566: UDP, length 1470
13:10:16.208753 IP 10.0.0.1.37826 > 10.0.0.7.5566: UDP, length 1470
13:10:16.209458 IP 10.0.0.1.37826 > 10.0.0.7.5566: UDP, length 1470
13:10:16.209920 IP 10.0.0.1.37826 > 10.0.0.7.5566: UDP, length 1470
13:10:16.210839 IP 10.0.0.1.37826 > 10.0.0.7.5566: UDP, length 1470
13:10:16.212180 IP 10.0.0.1.37826 > 10.0.0.7.5566: UDP, length 1470
13:10:16.212773 IP 10.0.0.1.37826 > 10.0.0.7.5566: UDP, length 1470
13:10:16.213263 IP 10.0.0.1.37826 > 10.0.0.7.5566: UDP, length 1470
13:10:16.214401 IP 10.0.0.1.37826 > 10.0.0.7.5566: UDP, length 1470
13:10:16.215273 IP 10.0.0.1.37826 > 10.0.0.7.5566: UDP, length 1470
13:10:16.215780 IP 10.0.0.1.37826 > 10.0.0.7.5566: UDP, length 1470
13:10:16.216999 IP 10.0.0.1.37826 > 10.0.0.7.5566: UDP, length 1470
13:10:16.217499 IP 10.0.0.1.37826 > 10.0.0.7.5566: UDP, length 1470
13:10:16.218056 IP 10.0.0.1.37826 > 10.0.0.7.5566: UDP, length 1470
13:10:16.219232 IP 10.0.0.1.37826 > 10.0.0.7.5566: UDP, length 1470
13:10:16.220130 IP 10.0.0.1.37826 > 10.0.0.7.5566: UDP, length 1470
13:10:16.221219 IP 10.0.0.1.37826 > 10.0.0.7.5566: UDP, length 1470
13:10:16.221309 IP 10.0.0.1.37826 > 10.0.0.7.5566: UDP, length 1470
13:10:16.222320 IP 10.0.0.1.37826 > 10.0.0.7.5566: UDP, length 1470
13:10:16.222951 IP 10.0.0.1.37826 > 10.0.0.7.5566: UDP, length 1470
13:10:16.224058 IP 10.0.0.1.37826 > 10.0.0.7.5566: UDP, length 1470
13:10:16.224536 IP 10.0.0.1.37826 > 10.0.0.7.5566: UDP, length 1470
13:10:16.225720 IP 10.0.0.1.37826 > 10.0.0.7.5566: UDP, length 1470
13:10:16.226455 IP 10.0.0.1.37826 > 10.0.0.7.5566: UDP, length 1470
13:10:16.227620 IP 10.0.0.1.37826 > 10.0.0.7.5566: UDP, length 1470
13:10:16.228255 IP 10.0.0.1.37826 > 10.0.0.7.5566: UDP, length 1470
13:10:16.228730 IP 10.0.0.1.37826 > 10.0.0.7.5566: UDP, length 1470
13:10:16.229319 IP 10.0.0.1.37826 > 10.0.0.7.5566: UDP, length 1470
13:10:16.230417 IP 10.0.0.1.37826 > 10.0.0.7.5566: UDP, length 1470
13:10:16.231022 IP 10.0.0.1.37826 > 10.0.0.7.5566: UDP, length 1470
13:10:16.232122 IP 10.0.0.1.37826 > 10.0.0.7.5566: UDP, length 1470
13:10:16.232642 IP 10.0.0.1.37826 > 10.0.0.7.5566: UDP, length 1470
13:10:16.233795 IP 10.0.0.1.37826 > 10.0.0.7.5566: UDP, length 1470
13:10:16.234618 IP 10.0.0.1.37826 > 10.0.0.7.5566: UDP, length 1470
13:10:16.235676 IP 10.0.0.1.37826 > 10.0.0.7.5566: UDP, length 1470
13:10:16.236377 IP 10.0.0.1.37826 > 10.0.0.7.5566: UDP, length 1470
13:10:16.237489 IP 10.0.0.1.37826 > 10.0.0.7.5566: UDP, length 1470
13:10:16.237980 IP 10.0.0.1.37826 > 10.0.0.7.5566: UDP, length 1470
13:10:16.238722 IP 10.0.0.1.37826 > 10.0.0.7.5566: UDP, length 1470
13:10:16.240667 IP 10.0.0.1.37826 > 10.0.0.7.5566: UDP, length 1470
13:10:16.240724 IP 10.0.0.1.37826 > 10.0.0.7.5566: UDP, length 1470
13:10:16.244339 IP 10.0.0.1.37826 > 10.0.0.7.5566: UDP, length 1470
13:10:16.250254 IP 10.0.0.1.37826 > 10.0.0.7.5566: UDP, length 1470
13:10:16.250319 IP 10.0.0.1.37826 > 10.0.0.7.5566: UDP, length 1470
13:10:16.253570 IP 10.0.0.1.37826 > 10.0.0.7.5566: UDP, length 1470
13:10:16.254731 IP 10.0.0.1.37826 > 10.0.0.7.5566: UDP, length 1470
13:10:16.254732 IP 10.0.0.1.37826 > 10.0.0.7.5566: UDP, length 1470
13:10:16.255807 IP 10.0.0.1.37826 > 10.0.0.7.5566: UDP, length 1470
13:10:16.259760 IP 10.0.0.1.37826 > 10.0.0.7.5566: UDP, length 1470
13:10:16.259859 IP 10.0.0.1.37826 > 10.0.0.7.5566: UDP, length 1470
13:10:16.265338 IP 10.0.0.1.37826 > 10.0.0.7.5566: UDP, length 1470
13:10:16.265451 IP 10.0.0.1.37826 > 10.0.0.7.5566: UDP, length 1470
13:10:16.268609 IP 10.0.0.1.37826 > 10.0.0.7.5566: UDP, length 1470
13:10:16.270350 IP 10.0.0.1.37826 > 10.0.0.7.5566: UDP, length 1470
13:10:16.270432 IP 10.0.0.1.37826 > 10.0.0.7.5566: UDP, length 1470
13:10:16.272157 IP 10.0.0.1.37826 > 10.0.0.7.5566: UDP, length 1470
13:10:16.272293 IP 10.0.0.1.37826 > 10.0.0.7.5566: UDP, length 1470
13:10:16.275203 IP 10.0.0.1.37826 > 10.0.0.7.5566: UDP, length 1470
13:10:16.275312 IP 10.0.0.1.37826 > 10.0.0.7.5566: UDP, length 1470
13:10:16.279636 IP 10.0.0.1.37826 > 10.0.0.7.5566: UDP, length 1470
13:10:16.279637 IP 10.0.0.1.37826 > 10.0.0.7.5566: UDP, length 1470
13:10:16.283198 IP 10.0.0.1.37826 > 10.0.0.7.5566: UDP, length 1470
13:10:16.283198 IP 10.0.0.1.37826 > 10.0.0.7.5566: UDP, length 1470
13:10:16.284788 IP 10.0.0.1.37826 > 10.0.0.7.5566: UDP, length 1470
13:10:16.284843 IP 10.0.0.1.37826 > 10.0.0.7.5566: UDP, length 1470
13:10:16.286426 IP 10.0.0.1.37826 > 10.0.0.7.5566: UDP, length 1470
13:10:16.286427 IP 10.0.0.1.37826 > 10.0.0.7.5566: UDP, length 1470
13:10:16.287460 IP 10.0.0.1.37826 > 10.0.0.7.5566: UDP, length 1470
13:10:16.290432 IP 10.0.0.1.37826 > 10.0.0.7.5566: UDP, length 1470
13:10:16.290541 IP 10.0.0.1.37826 > 10.0.0.7.5566: UDP, length 1470
13:10:16.292165 IP 10.0.0.1.37826 > 10.0.0.7.5566: UDP, length 1470
13:10:16.292270 IP 10.0.0.1.37826 > 10.0.0.7.5566: UDP, length 1470
13:10:16.294423 IP 10.0.0.1.37826 > 10.0.0.7.5566: UDP, length 1470
13:10:16.295865 IP 10.0.0.1.37826 > 10.0.0.7.5566: UDP, length 1470
13:10:16.295967 IP 10.0.0.1.37826 > 10.0.0.7.5566: UDP, length 1470
13:10:16.298795 IP 10.0.0.1.37826 > 10.0.0.7.5566: UDP, length 1470
13:10:16.299995 IP 10.0.0.1.37826 > 10.0.0.7.5566: UDP, length 1470
13:10:16.301857 IP 10.0.0.1.37826 > 10.0.0.7.5566: UDP, length 1470
13:10:16.301858 IP 10.0.0.1.37826 > 10.0.0.7.5566: UDP, length 1470
13:10:16.306049 IP 10.0.0.1.37826 > 10.0.0.7.5566: UDP, length 1470
13:10:16.306110 IP 10.0.0.1.37826 > 10.0.0.7.5566: UDP, length 1470
13:10:16.308016 IP 10.0.0.1.37826 > 10.0.0.7.5566: UDP, length 1470
13:10:16.308114 IP 10.0.0.1.37826 > 10.0.0.7.5566: UDP, length 1470
13:10:16.309262 IP 10.0.0.1.37826 > 10.0.0.7.5566: UDP, length 1470
13:10:16.310283 IP 10.0.0.1.37826 > 10.0.0.7.5566: UDP, length 1470
13:10:16.310426 IP 10.0.0.1.37826 > 10.0.0.7.5566: UDP, length 1470
13:10:16.311710 IP 10.0.0.1.37826 > 10.0.0.7.5566: UDP, length 1470
13:10:16.312186 IP 10.0.0.1.37826 > 10.0.0.7.5566: UDP, length 1470
13:10:16.313075 IP 10.0.0.1.37826 > 10.0.0.7.5566: UDP, length 1470
13:10:16.314291 IP 10.0.0.1.37826 > 10.0.0.7.5566: UDP, length 1470
13:10:16.314915 IP 10.0.0.1.37826 > 10.0.0.7.5566: UDP, length 1470
13:10:16.315514 IP 10.0.0.1.37826 > 10.0.0.7.5566: UDP, length 1470
13:10:16.316061 IP 10.0.0.1.37826 > 10.0.0.7.5566: UDP, length 1470
13:10:16.316893 IP 10.0.0.1.37826 > 10.0.0.7.5566: UDP, length 1470
13:10:16.318053 IP 10.0.0.1.37826 > 10.0.0.7.5566: UDP, length 1470
13:10:16.318642 IP 10.0.0.1.37826 > 10.0.0.7.5566: UDP, length 1470
13:10:16.319419 IP 10.0.0.1.37826 > 10.0.0.7.5566: UDP, length 1470
13:10:16.320946 IP 10.0.0.1.37826 > 10.0.0.7.5566: UDP, length 1470
13:10:16.321583 IP 10.0.0.1.37826 > 10.0.0.7.5566: UDP, length 1470
13:10:16.322316 IP 10.0.0.1.37826 > 10.0.0.7.5566: UDP, length 1470
13:10:16.323638 IP 10.0.0.1.37826 > 10.0.0.7.5566: UDP, length 1470
13:10:16.324099 IP 10.0.0.1.37826 > 10.0.0.7.5566: UDP, length 1470
13:10:16.324850 IP 10.0.0.1.37826 > 10.0.0.7.5566: UDP, length 1470
13:10:16.326063 IP 10.0.0.1.37826 > 10.0.0.7.5566: UDP, length 1470
13:10:16.326841 IP 10.0.0.1.37826 > 10.0.0.7.5566: UDP, length 1470
13:10:16.327179 IP 10.0.0.1.37826 > 10.0.0.7.5566: UDP, length 1470
13:10:16.328116 IP 10.0.0.1.37826 > 10.0.0.7.5566: UDP, length 1470
13:10:16.329323 IP 10.0.0.1.37826 > 10.0.0.7.5566: UDP, length 1470
13:10:16.329801 IP 10.0.0.1.37826 > 10.0.0.7.5566: UDP, length 1470
13:10:16.330372 IP 10.0.0.1.37826 > 10.0.0.7.5566: UDP, length 1470
13:10:16.331610 IP 10.0.0.1.37826 > 10.0.0.7.5566: UDP, length 1470
13:10:16.332947 IP 10.0.0.1.37826 > 10.0.0.7.5566: UDP, length 1470
13:10:16.335521 IP 10.0.0.1.37826 > 10.0.0.7.5566: UDP, length 1470
13:10:16.337299 IP 10.0.0.1.37826 > 10.0.0.7.5566: UDP, length 1470
13:10:16.339066 IP 10.0.0.1.37826 > 10.0.0.7.5566: UDP, length 1470
13:10:16.341446 IP 10.0.0.1.37826 > 10.0.0.7.5566: UDP, length 1470
13:10:16.342810 IP 10.0.0.1.37826 > 10.0.0.7.5566: UDP, length 1470
13:10:16.345168 IP 10.0.0.1.37826 > 10.0.0.7.5566: UDP, length 1470
13:10:16.346383 IP 10.0.0.1.37826 > 10.0.0.7.5566: UDP, length 1470
13:10:16.348417 IP 10.0.0.1.37826 > 10.0.0.7.5566: UDP, length 1470
13:10:16.350200 IP 10.0.0.1.37826 > 10.0.0.7.5566: UDP, length 1470
13:10:16.352256 IP 10.0.0.1.37826 > 10.0.0.7.5566: UDP, length 1470
13:10:16.355899 IP 10.0.0.1.37826 > 10.0.0.7.5566: UDP, length 1470
13:10:16.357483 IP 10.0.0.1.37826 > 10.0.0.7.5566: UDP, length 1470
13:10:16.359118 IP 10.0.0.1.37826 > 10.0.0.7.5566: UDP, length 1470
13:10:16.362851 IP 10.0.0.1.37826 > 10.0.0.7.5566: UDP, length 1470
13:10:16.364712 IP 10.0.0.1.37826 > 10.0.0.7.5566: UDP, length 1470
13:10:16.369088 IP 10.0.0.1.37826 > 10.0.0.7.5566: UDP, length 1470
13:10:16.370336 IP 10.0.0.1.37826 > 10.0.0.7.5566: UDP, length 1470
13:10:16.372946 IP 10.0.0.1.37826 > 10.0.0.7.5566: UDP, length 1470
13:10:16.374266 IP 10.0.0.1.37826 > 10.0.0.7.5566: UDP, length 1470
13:10:16.377889 IP 10.0.0.1.37826 > 10.0.0.7.5566: UDP, length 1470
13:10:16.380437 IP 10.0.0.1.37826 > 10.0.0.7.5566: UDP, length 1470
13:10:16.385783 IP 10.0.0.1.37826 > 10.0.0.7.5566: UDP, length 1470
13:10:16.388259 IP 10.0.0.1.37826 > 10.0.0.7.5566: UDP, length 1470
13:10:16.389574 IP 10.0.0.1.37826 > 10.0.0.7.5566: UDP, length 1470
13:10:16.390634 IP 10.0.0.1.37826 > 10.0.0.7.5566: UDP, length 1470
13:10:16.391911 IP 10.0.0.1.37826 > 10.0.0.7.5566: UDP, length 1470
13:10:16.393231 IP 10.0.0.1.37826 > 10.0.0.7.5566: UDP, length 1470
13:10:16.394595 IP 10.0.0.1.37826 > 10.0.0.7.5566: UDP, length 1470
13:10:16.394595 IP 10.0.0.1.37826 > 10.0.0.7.5566: UDP, length 1470
13:10:16.395971 IP 10.0.0.1.37826 > 10.0.0.7.5566: UDP, length 1470
13:10:16.397286 IP 10.0.0.1.37826 > 10.0.0.7.5566: UDP, length 1470
13:10:16.398936 IP 10.0.0.1.37826 > 10.0.0.7.5566: UDP, length 1470
13:10:16.401059 IP 10.0.0.1.37826 > 10.0.0.7.5566: UDP, length 1470
13:10:16.405898 IP 10.0.0.1.37826 > 10.0.0.7.5566: UDP, length 1470
13:10:16.409731 IP 10.0.0.1.37826 > 10.0.0.7.5566: UDP, length 1470
13:10:16.414062 IP 10.0.0.1.37826 > 10.0.0.7.5566: UDP, length 1470
13:10:16.417097 IP 10.0.0.1.37826 > 10.0.0.7.5566: UDP, length 1470
13:10:16.419746 IP 10.0.0.1.37826 > 10.0.0.7.5566: UDP, length 1470
13:10:16.427465 IP 10.0.0.1.37826 > 10.0.0.7.5566: UDP, length 1470
13:10:16.427466 IP 10.0.0.1.37826 > 10.0.0.7.5566: UDP, length 1470
13:10:16.433556 IP 10.0.0.1.37826 > 10.0.0.7.5566: UDP, length 1470
13:10:16.439156 IP 10.0.0.1.37826 > 10.0.0.7.5566: UDP, length 1470
13:10:16.439156 IP 10.0.0.1.37826 > 10.0.0.7.5566: UDP, length 1470
13:10:16.445306 IP 10.0.0.1.37826 > 10.0.0.7.5566: UDP, length 1470
13:10:16.449339 IP 10.0.0.1.37826 > 10.0.0.7.5566: UDP, length 1470
13:10:16.452848 IP6 fe80::a4cc:8fff:fee6:3b6c.5353 > ff02::fb.5353: 0 [2q] PTR (QM)? _ipps._tcp.local. PTR (QM)? _ipp._tcp.local. (45)
13:10:16.452938 IP 10.0.0.1.37826 > 10.0.0.7.5566: UDP, length 1470
13:10:16.452939 IP 10.0.0.1.37826 > 10.0.0.7.5566: UDP, length 1470
13:10:16.454278 IP 10.0.0.1.37826 > 10.0.0.7.5566: UDP, length 1470
13:10:16.454751 IP 10.0.0.1.37826 > 10.0.0.7.5566: UDP, length 1470
13:10:16.455359 IP 10.0.0.1.37826 > 10.0.0.7.5566: UDP, length 1470
13:10:16.456444 IP 10.0.0.1.37826 > 10.0.0.7.5566: UDP, length 1470
13:10:16.456940 IP 10.0.0.1.37826 > 10.0.0.7.5566: UDP, length 1470
13:10:16.457947 IP 10.0.0.1.37826 > 10.0.0.7.5566: UDP, length 1470
13:10:16.458571 IP 10.0.0.1.37826 > 10.0.0.7.5566: UDP, length 1470
13:10:16.459656 IP 10.0.0.1.37826 > 10.0.0.7.5566: UDP, length 1470
13:10:16.462741 IP 10.0.0.1.37826 > 10.0.0.7.5566: UDP, length 1470
13:10:16.462884 IP 10.0.0.1.37826 > 10.0.0.7.5566: UDP, length 1470
13:10:16.465454 IP 10.0.0.1.37826 > 10.0.0.7.5566: UDP, length 1470
13:10:16.466764 IP 10.0.0.1.37826 > 10.0.0.7.5566: UDP, length 1470
13:10:16.466787 IP 10.0.0.1.37826 > 10.0.0.7.5566: UDP, length 1470
13:10:16.470940 IP 10.0.0.1.37826 > 10.0.0.7.5566: UDP, length 1470
13:10:16.471055 IP 10.0.0.1.37826 > 10.0.0.7.5566: UDP, length 1470
13:10:16.475542 IP 10.0.0.1.37826 > 10.0.0.7.5566: UDP, length 1470
13:10:16.475712 IP 10.0.0.1.37826 > 10.0.0.7.5566: UDP, length 1470
13:10:16.477750 IP 10.0.0.1.37826 > 10.0.0.7.5566: UDP, length 1470
13:10:16.480170 IP 10.0.0.1.37826 > 10.0.0.7.5566: UDP, length 1470
13:10:16.480263 IP 10.0.0.1.37826 > 10.0.0.7.5566: UDP, length 1470
13:10:16.486202 IP 10.0.0.1.37826 > 10.0.0.7.5566: UDP, length 1470
13:10:16.491465 IP 10.0.0.1.37826 > 10.0.0.7.5566: UDP, length 1470
13:10:16.496234 IP 10.0.0.1.37826 > 10.0.0.7.5566: UDP, length 1470
13:10:16.496294 IP 10.0.0.1.37826 > 10.0.0.7.5566: UDP, length 1470
13:10:16.498030 IP 10.0.0.1.37826 > 10.0.0.7.5566: UDP, length 1470
13:10:16.498030 IP 10.0.0.1.37826 > 10.0.0.7.5566: UDP, length 1470
13:10:16.499773 IP6 fe80::8800:8cff:fe81:81b9.5353 > ff02::fb.5353: 0 [2q] PTR (QM)? _ipps._tcp.local. PTR (QM)? _ipp._tcp.local. (45)
13:10:16.501147 IP 10.0.0.1.37826 > 10.0.0.7.5566: UDP, length 1470
13:10:16.501170 IP 10.0.0.1.37826 > 10.0.0.7.5566: UDP, length 1470
13:10:16.502355 IP 10.0.0.1.37826 > 10.0.0.7.5566: UDP, length 1470
13:10:16.503633 IP 10.0.0.1.37826 > 10.0.0.7.5566: UDP, length 1470
13:10:16.503633 IP 10.0.0.1.37826 > 10.0.0.7.5566: UDP, length 1470
13:10:16.504650 IP 10.0.0.1.37826 > 10.0.0.7.5566: UDP, length 1470
13:10:16.505403 IP 10.0.0.1.37826 > 10.0.0.7.5566: UDP, length 1470
13:10:16.506029 IP 10.0.0.1.37826 > 10.0.0.7.5566: UDP, length 1470
13:10:16.507056 IP 10.0.0.1.37826 > 10.0.0.7.5566: UDP, length 1470
13:10:16.507642 IP 10.0.0.1.37826 > 10.0.0.7.5566: UDP, length 1470
13:10:16.508658 IP 10.0.0.1.37826 > 10.0.0.7.5566: UDP, length 1470
13:10:16.509234 IP 10.0.0.1.37826 > 10.0.0.7.5566: UDP, length 1470
13:10:16.510857 IP 10.0.0.1.37826 > 10.0.0.7.5566: UDP, length 1470
13:10:16.512168 IP 10.0.0.1.37826 > 10.0.0.7.5566: UDP, length 1470
13:10:16.513465 IP 10.0.0.1.37826 > 10.0.0.7.5566: UDP, length 1470
13:10:16.514779 IP 10.0.0.1.37826 > 10.0.0.7.5566: UDP, length 1470
13:10:16.517215 IP 10.0.0.1.37826 > 10.0.0.7.5566: UDP, length 1470
13:10:16.518319 IP 10.0.0.1.37826 > 10.0.0.7.5566: UDP, length 1470
13:10:16.520614 IP 10.0.0.1.37826 > 10.0.0.7.5566: UDP, length 1470
13:10:16.521694 IP 10.0.0.1.37826 > 10.0.0.7.5566: UDP, length 1470
13:10:16.524246 IP 10.0.0.1.37826 > 10.0.0.7.5566: UDP, length 1470
13:10:16.525565 IP 10.0.0.1.37826 > 10.0.0.7.5566: UDP, length 1470
13:10:16.528159 IP 10.0.0.1.37826 > 10.0.0.7.5566: UDP, length 1470
13:10:16.529396 IP 10.0.0.1.37826 > 10.0.0.7.5566: UDP, length 1470
13:10:16.531612 IP 10.0.0.1.37826 > 10.0.0.7.5566: UDP, length 1470
13:10:16.533557 IP 10.0.0.1.37826 > 10.0.0.7.5566: UDP, length 1470
13:10:16.534628 IP 10.0.0.1.37826 > 10.0.0.7.5566: UDP, length 1470
13:10:16.536668 IP 10.0.0.1.37826 > 10.0.0.7.5566: UDP, length 1470
13:10:16.538981 IP 10.0.0.1.37826 > 10.0.0.7.5566: UDP, length 1470
13:10:16.540707 IP 10.0.0.1.37826 > 10.0.0.7.5566: UDP, length 1470
13:10:16.542966 IP 10.0.0.1.37826 > 10.0.0.7.5566: UDP, length 1470
13:10:16.544054 IP 10.0.0.1.37826 > 10.0.0.7.5566: UDP, length 1470
13:10:16.546634 IP 10.0.0.1.37826 > 10.0.0.7.5566: UDP, length 1470
13:10:16.548598 IP 10.0.0.1.37826 > 10.0.0.7.5566: UDP, length 1470
13:10:16.550707 IP 10.0.0.1.37826 > 10.0.0.7.5566: UDP, length 1470
13:10:16.552049 IP 10.0.0.1.37826 > 10.0.0.7.5566: UDP, length 1470
13:10:16.554658 IP 10.0.0.1.37826 > 10.0.0.7.5566: UDP, length 1470
13:10:16.555831 IP 10.0.0.1.37826 > 10.0.0.7.5566: UDP, length 1470
13:10:16.557552 IP 10.0.0.1.37826 > 10.0.0.7.5566: UDP, length 1470
13:10:16.559159 IP 10.0.0.1.37826 > 10.0.0.7.5566: UDP, length 1470
13:10:16.560983 IP 10.0.0.1.37826 > 10.0.0.7.5566: UDP, length 1470
13:10:16.562649 IP 10.0.0.1.37826 > 10.0.0.7.5566: UDP, length 1470
13:10:16.564754 IP 10.0.0.1.37826 > 10.0.0.7.5566: UDP, length 1470
13:10:16.567294 IP 10.0.0.1.37826 > 10.0.0.7.5566: UDP, length 1470
13:10:16.569193 IP 10.0.0.1.37826 > 10.0.0.7.5566: UDP, length 1470
13:10:16.570964 IP 10.0.0.1.37826 > 10.0.0.7.5566: UDP, length 1470
13:10:16.572807 IP 10.0.0.1.37826 > 10.0.0.7.5566: UDP, length 1470
13:10:16.574928 IP 10.0.0.1.37826 > 10.0.0.7.5566: UDP, length 1470
13:10:16.576703 IP 10.0.0.1.37826 > 10.0.0.7.5566: UDP, length 1470
13:10:16.578295 IP 10.0.0.1.37826 > 10.0.0.7.5566: UDP, length 1470
13:10:16.581307 IP 10.0.0.1.37826 > 10.0.0.7.5566: UDP, length 1470
13:10:16.582454 IP 10.0.0.1.37826 > 10.0.0.7.5566: UDP, length 1470
13:10:16.584728 IP 10.0.0.1.37826 > 10.0.0.7.5566: UDP, length 1470
13:10:16.586069 IP 10.0.0.1.37826 > 10.0.0.7.5566: UDP, length 1470
13:10:16.588720 IP 10.0.0.1.37826 > 10.0.0.7.5566: UDP, length 1470
13:10:16.589816 IP 10.0.0.1.37826 > 10.0.0.7.5566: UDP, length 1470
13:10:16.591074 IP 10.0.0.1.37826 > 10.0.0.7.5566: UDP, length 1470
13:10:16.593510 IP 10.0.0.1.37826 > 10.0.0.7.5566: UDP, length 1470
13:10:16.595100 IP 10.0.0.1.37826 > 10.0.0.7.5566: UDP, length 1470
13:10:16.600932 IP 10.0.0.1.37826 > 10.0.0.7.5566: UDP, length 1470
13:10:16.604548 IP 10.0.0.1.37826 > 10.0.0.7.5566: UDP, length 1470
13:10:16.606851 IP 10.0.0.1.37826 > 10.0.0.7.5566: UDP, length 1470
13:10:16.607897 IP 10.0.0.1.37826 > 10.0.0.7.5566: UDP, length 1470
13:10:16.610455 IP 10.0.0.1.37826 > 10.0.0.7.5566: UDP, length 1470
13:10:16.610456 IP 10.0.0.1.37826 > 10.0.0.7.5566: UDP, length 1470
13:10:16.611857 IP 10.0.0.1.37826 > 10.0.0.7.5566: UDP, length 1470
13:10:16.612040 IP 10.0.0.1.37826 > 10.0.0.7.5566: UDP, length 1470
13:10:16.613209 IP 10.0.0.1.37826 > 10.0.0.7.5566: UDP, length 1470
13:10:16.614423 IP 10.0.0.1.37826 > 10.0.0.7.5566: UDP, length 1470
13:10:16.615734 IP 10.0.0.1.37826 > 10.0.0.7.5566: UDP, length 1470
13:10:16.618353 IP 10.0.0.1.37826 > 10.0.0.7.5566: UDP, length 1470
13:10:16.619636 IP 10.0.0.1.37826 > 10.0.0.7.5566: UDP, length 1470
13:10:16.624751 IP 10.0.0.1.37826 > 10.0.0.7.5566: UDP, length 1470
13:10:16.627198 IP 10.0.0.1.37826 > 10.0.0.7.5566: UDP, length 1470
13:10:16.629555 IP 10.0.0.1.37826 > 10.0.0.7.5566: UDP, length 1470
13:10:16.634596 IP 10.0.0.1.37826 > 10.0.0.7.5566: UDP, length 1470
13:10:16.635835 IP 10.0.0.1.37826 > 10.0.0.7.5566: UDP, length 1470
13:10:16.640578 IP6 fe80::cd3:7bff:fec1:d44f.5353 > ff02::fb.5353: 0 [2q] PTR (QM)? _ipps._tcp.local. PTR (QM)? _ipp._tcp.local. (45)
13:10:16.640702 IP 10.0.0.1.37826 > 10.0.0.7.5566: UDP, length 1470
13:10:16.643790 IP 10.0.0.1.37826 > 10.0.0.7.5566: UDP, length 1470
13:10:16.643898 IP 10.0.0.1.37826 > 10.0.0.7.5566: UDP, length 1470
13:10:16.650616 IP 10.0.0.1.37826 > 10.0.0.7.5566: UDP, length 1470
13:10:16.654153 IP 10.0.0.1.37826 > 10.0.0.7.5566: UDP, length 1470
13:10:16.656006 IP 10.0.0.1.37826 > 10.0.0.7.5566: UDP, length 1470
13:10:16.657406 IP 10.0.0.1.37826 > 10.0.0.7.5566: UDP, length 1470
13:10:16.660627 IP 10.0.0.1.37826 > 10.0.0.7.5566: UDP, length 1470
13:10:16.660710 IP 10.0.0.1.37826 > 10.0.0.7.5566: UDP, length 1470
13:10:16.663730 IP 10.0.0.1.37826 > 10.0.0.7.5566: UDP, length 1470
13:10:16.663836 IP 10.0.0.1.37826 > 10.0.0.7.5566: UDP, length 1470
13:10:16.667017 IP 10.0.0.1.37826 > 10.0.0.7.5566: UDP, length 1470
13:10:16.667102 IP 10.0.0.1.37826 > 10.0.0.7.5566: UDP, length 1470
13:10:16.668421 IP 10.0.0.1.37826 > 10.0.0.7.5566: UDP, length 1470
13:10:16.669483 IP 10.0.0.1.37826 > 10.0.0.7.5566: UDP, length 1470
13:10:16.669484 IP 10.0.0.1.37826 > 10.0.0.7.5566: UDP, length 1470
13:10:16.670518 IP 10.0.0.1.37826 > 10.0.0.7.5566: UDP, length 1470
13:10:16.671280 IP 10.0.0.1.37826 > 10.0.0.7.5566: UDP, length 1470
13:10:16.673043 IP 10.0.0.1.37826 > 10.0.0.7.5566: UDP, length 1470
13:10:16.673051 IP 10.0.0.1.37826 > 10.0.0.7.5566: UDP, length 1470
13:10:16.674096 IP 10.0.0.1.37826 > 10.0.0.7.5566: UDP, length 1470
13:10:16.675355 IP 10.0.0.1.37826 > 10.0.0.7.5566: UDP, length 1470
13:10:16.677144 IP 10.0.0.1.37826 > 10.0.0.7.5566: UDP, length 1470
13:10:16.679260 IP 10.0.0.1.37826 > 10.0.0.7.5566: UDP, length 1470
13:10:16.682193 IP 10.0.0.1.37826 > 10.0.0.7.5566: UDP, length 1470
13:10:16.684868 IP 10.0.0.1.37826 > 10.0.0.7.5566: UDP, length 1470
13:10:16.690314 IP 10.0.0.1.37826 > 10.0.0.7.5566: UDP, length 1470
13:10:16.693505 IP 10.0.0.1.37826 > 10.0.0.7.5566: UDP, length 1470
13:10:16.700782 IP 10.0.0.1.37826 > 10.0.0.7.5566: UDP, length 1470
13:10:16.704825 IP 10.0.0.1.37826 > 10.0.0.7.5566: UDP, length 1470
13:10:16.710805 IP 10.0.0.1.37826 > 10.0.0.7.5566: UDP, length 1470
13:10:16.710940 IP 10.0.0.1.37826 > 10.0.0.7.5566: UDP, length 1470
13:10:16.712774 IP 10.0.0.1.37826 > 10.0.0.7.5566: UDP, length 1470
13:10:16.715626 IP 10.0.0.1.37826 > 10.0.0.7.5566: UDP, length 1470
13:10:16.720495 IP 10.0.0.1.37826 > 10.0.0.7.5566: UDP, length 1470
13:10:16.720612 IP 10.0.0.1.37826 > 10.0.0.7.5566: UDP, length 1470
13:10:16.722599 IP 10.0.0.1.37826 > 10.0.0.7.5566: UDP, length 1470
13:10:16.722717 IP6 fe80::e820:e6ff:fe10:99bd.5353 > ff02::fb.5353: 0 [2q] PTR (QM)? _ipps._tcp.local. PTR (QM)? _ipp._tcp.local. (45)
13:10:16.725698 IP 10.0.0.1.37826 > 10.0.0.7.5566: UDP, length 1470
13:10:16.727019 IP 10.0.0.1.37826 > 10.0.0.7.5566: UDP, length 1470
13:10:16.727020 IP 10.0.0.1.37826 > 10.0.0.7.5566: UDP, length 1470
13:10:16.728040 IP 10.0.0.1.37826 > 10.0.0.7.5566: UDP, length 1470
13:10:16.731254 IP 10.0.0.1.37826 > 10.0.0.7.5566: UDP, length 1470
13:10:16.734327 IP 10.0.0.1.37826 > 10.0.0.7.5566: UDP, length 1470
13:10:16.734328 IP 10.0.0.1.37826 > 10.0.0.7.5566: UDP, length 1470
13:10:16.737084 IP 10.0.0.1.37826 > 10.0.0.7.5566: UDP, length 1470
13:10:16.737166 IP 10.0.0.1.37826 > 10.0.0.7.5566: UDP, length 1470
13:10:16.738502 IP 10.0.0.1.37826 > 10.0.0.7.5566: UDP, length 1470
13:10:16.743035 IP 10.0.0.1.37826 > 10.0.0.7.5566: UDP, length 1470
13:10:16.743036 IP 10.0.0.1.37826 > 10.0.0.7.5566: UDP, length 1470
13:10:16.745477 IP 10.0.0.1.37826 > 10.0.0.7.5566: UDP, length 1470
13:10:16.745575 IP 10.0.0.1.37826 > 10.0.0.7.5566: UDP, length 1470
13:10:16.748034 IP 10.0.0.1.37826 > 10.0.0.7.5566: UDP, length 1470
13:10:16.750126 IP 10.0.0.1.37826 > 10.0.0.7.5566: UDP, length 1470
13:10:16.753586 IP 10.0.0.1.37826 > 10.0.0.7.5566: UDP, length 1470
13:10:16.755602 IP 10.0.0.1.37826 > 10.0.0.7.5566: UDP, length 1470
13:10:16.755700 IP 10.0.0.1.37826 > 10.0.0.7.5566: UDP, length 1470
13:10:16.757553 IP 10.0.0.1.37826 > 10.0.0.7.5566: UDP, length 1470
13:10:16.760638 IP6 fe80::4f2:d1ff:fe90:ce4d.5353 > ff02::fb.5353: 0 [2q] PTR (QM)? _ipps._tcp.local. PTR (QM)? _ipp._tcp.local. (45)
13:10:16.760777 IP 10.0.0.1.37826 > 10.0.0.7.5566: UDP, length 1470
13:10:16.761948 IP 10.0.0.1.37826 > 10.0.0.7.5566: UDP, length 1470
13:10:16.762004 IP 10.0.0.1.37826 > 10.0.0.7.5566: UDP, length 1470
13:10:16.763190 IP 10.0.0.1.37826 > 10.0.0.7.5566: UDP, length 1470
13:10:16.764256 IP 10.0.0.1.37826 > 10.0.0.7.5566: UDP, length 1470
13:10:16.765469 IP 10.0.0.1.37826 > 10.0.0.7.5566: UDP, length 1470
13:10:16.765470 IP 10.0.0.1.37826 > 10.0.0.7.5566: UDP, length 1470
13:10:16.766798 IP 10.0.0.1.37826 > 10.0.0.7.5566: UDP, length 1470
13:10:16.767600 IP 10.0.0.1.37826 > 10.0.0.7.5566: UDP, length 1470
13:10:16.769519 IP 10.0.0.1.37826 > 10.0.0.7.5566: UDP, length 1470
13:10:16.771084 IP 10.0.0.1.37826 > 10.0.0.7.5566: UDP, length 1470
13:10:16.773217 IP 10.0.0.1.37826 > 10.0.0.7.5566: UDP, length 1470
13:10:16.774617 IP 10.0.0.1.37826 > 10.0.0.7.5566: UDP, length 1470
13:10:16.777219 IP 10.0.0.1.37826 > 10.0.0.7.5566: UDP, length 1470
13:10:16.778549 IP 10.0.0.1.37826 > 10.0.0.7.5566: UDP, length 1470
13:10:16.780448 IP 10.0.0.1.37826 > 10.0.0.7.5566: UDP, length 1470
13:10:16.782190 IP 10.0.0.1.37826 > 10.0.0.7.5566: UDP, length 1470
13:10:16.783824 IP 10.0.0.1.37826 > 10.0.0.7.5566: UDP, length 1470
13:10:16.785575 IP 10.0.0.1.37826 > 10.0.0.7.5566: UDP, length 1470
13:10:16.787825 IP 10.0.0.1.37826 > 10.0.0.7.5566: UDP, length 1470
13:10:16.788884 IP 10.0.0.1.37826 > 10.0.0.7.5566: UDP, length 1470
13:10:16.790970 IP 10.0.0.1.37826 > 10.0.0.7.5566: UDP, length 1470
13:10:16.793606 IP 10.0.0.1.37826 > 10.0.0.7.5566: UDP, length 1470
13:10:16.794848 IP 10.0.0.1.37826 > 10.0.0.7.5566: UDP, length 1470
13:10:16.797128 IP 10.0.0.1.37826 > 10.0.0.7.5566: UDP, length 1470
13:10:16.798863 IP 10.0.0.1.37826 > 10.0.0.7.5566: UDP, length 1470
13:10:16.801007 IP 10.0.0.1.37826 > 10.0.0.7.5566: UDP, length 1470
13:10:16.802889 IP 10.0.0.1.37826 > 10.0.0.7.5566: UDP, length 1470
13:10:16.804585 IP 10.0.0.1.37826 > 10.0.0.7.5566: UDP, length 1470
13:10:16.806229 IP 10.0.0.1.37826 > 10.0.0.7.5566: UDP, length 1470
13:10:16.808287 IP 10.0.0.1.37826 > 10.0.0.7.5566: UDP, length 1470
13:10:16.810119 IP 10.0.0.1.37826 > 10.0.0.7.5566: UDP, length 1470
13:10:16.815378 IP 10.0.0.1.37826 > 10.0.0.7.5566: UDP, length 1470
13:10:16.825102 IP 10.0.0.1.37826 > 10.0.0.7.5566: UDP, length 1470
13:10:16.830831 IP 10.0.0.1.37826 > 10.0.0.7.5566: UDP, length 1470
13:10:16.835202 IP 10.0.0.1.37826 > 10.0.0.7.5566: UDP, length 1470
13:10:16.838282 IP 10.0.0.1.37826 > 10.0.0.7.5566: UDP, length 1470
13:10:16.838283 IP 10.0.0.1.37826 > 10.0.0.7.5566: UDP, length 1470
13:10:16.840513 IP 10.0.0.1.37826 > 10.0.0.7.5566: UDP, length 1470
13:10:16.844392 IP 10.0.0.1.37826 > 10.0.0.7.5566: UDP, length 1470
13:10:16.844499 IP 10.0.0.1.37826 > 10.0.0.7.5566: UDP, length 1470
13:10:16.846323 IP 10.0.0.1.37826 > 10.0.0.7.5566: UDP, length 1470
13:10:16.849347 IP 10.0.0.1.37826 > 10.0.0.7.5566: UDP, length 1470
13:10:16.849469 IP 10.0.0.1.37826 > 10.0.0.7.5566: UDP, length 1470
13:10:16.852956 IP 10.0.0.1.37826 > 10.0.0.7.5566: UDP, length 1470
13:10:16.855446 IP 10.0.0.1.37826 > 10.0.0.7.5566: UDP, length 1470
13:10:16.855597 IP 10.0.0.1.37826 > 10.0.0.7.5566: UDP, length 1470
13:10:16.857308 IP 10.0.0.1.37826 > 10.0.0.7.5566: UDP, length 1470
13:10:16.859195 IP 10.0.0.1.37826 > 10.0.0.7.5566: UDP, length 1470
13:10:16.859196 IP 10.0.0.1.37826 > 10.0.0.7.5566: UDP, length 1470
13:10:16.860213 IP6 fe80::b866:69ff:fee2:7753 > ff02::2: ICMP6, router solicitation, length 16
13:10:16.862866 IP 10.0.0.1.37826 > 10.0.0.7.5566: UDP, length 1470
13:10:16.862985 IP 10.0.0.1.37826 > 10.0.0.7.5566: UDP, length 1470
13:10:16.864244 IP 10.0.0.1.37826 > 10.0.0.7.5566: UDP, length 1470
13:10:16.865321 IP 10.0.0.1.37826 > 10.0.0.7.5566: UDP, length 1470
13:10:16.866368 IP 10.0.0.1.37826 > 10.0.0.7.5566: UDP, length 1470
13:10:16.866369 IP 10.0.0.1.37826 > 10.0.0.7.5566: UDP, length 1470
