18:23:13.566804 IP6 fe80::2cf4:ffff:feae:f6c5.5353 > ff02::fb.5353: 0 [2q] [2n] ANY (QM)? 5.c.6.f.e.a.e.f.f.f.f.f.4.f.c.2.0.0.0.0.0.0.0.0.0.0.0.0.0.8.e.f.ip6.arpa. ANY (QM)? sam-VirtualBox.local. (158)
18:23:13.817022 IP6 fe80::2cf4:ffff:feae:f6c5.5353 > ff02::fb.5353: 0 [2q] [2n] ANY (QM)? 5.c.6.f.e.a.e.f.f.f.f.f.4.f.c.2.0.0.0.0.0.0.0.0.0.0.0.0.0.8.e.f.ip6.arpa. ANY (QM)? sam-VirtualBox.local. (158)
18:23:13.947677 IP6 fe80::2cf4:ffff:feae:f6c5 > ff02::16: HBH ICMP6, multicast listener report v2, 2 group record(s), length 48
18:23:14.021412 IP6 fe80::2cf4:ffff:feae:f6c5.5353 > ff02::fb.5353: 0*- [0q] 2/0/0 (Cache flush) PTR sam-VirtualBox.local., (Cache flush) AAAA fe80::2cf4:ffff:feae:f6c5 (146)
18:23:14.155124 IP6 fe80::2cf4:ffff:feae:f6c5.5353 > ff02::fb.5353: 0 [2q] PTR (QM)? _ipps._tcp.local. PTR (QM)? _ipp._tcp.local. (45)
18:23:15.232350 IP6 fe80::2cf4:ffff:feae:f6c5.5353 > ff02::fb.5353: 0*- [0q] 2/0/0 (Cache flush) PTR sam-VirtualBox.local., (Cache flush) AAAA fe80::2cf4:ffff:feae:f6c5 (146)
18:23:15.308538 IP6 fe80::9808:49ff:fe96:74fb.5353 > ff02::fb.5353: 0 [2q] PTR (QM)? _ipps._tcp.local. PTR (QM)? _ipp._tcp.local. (45)
18:23:15.459659 IP6 fe80::e4ab:acff:fed0:d9c5.5353 > ff02::fb.5353: 0 [2q] PTR (QM)? _ipps._tcp.local. PTR (QM)? _ipp._tcp.local. (45)
18:23:15.472252 IP6 fe80::6076:91ff:fe8e:c879.5353 > ff02::fb.5353: 0 [2q] PTR (QM)? _ipps._tcp.local. PTR (QM)? _ipp._tcp.local. (45)
18:23:15.479571 IP6 fe80::f0df:4ff:fe77:c9c8.5353 > ff02::fb.5353: 0 [2q] PTR (QM)? _ipps._tcp.local. PTR (QM)? _ipp._tcp.local. (45)
18:23:15.592564 IP6 fe80::5c87:b2ff:fe73:661f.5353 > ff02::fb.5353: 0 [2q] PTR (QM)? _ipps._tcp.local. PTR (QM)? _ipp._tcp.local. (45)
18:23:15.672381 IP6 fe80::ac6c:5bff:fe41:8cdb > ff02::2: ICMP6, router solicitation, length 16
18:23:15.722820 IP6 fe80::4819:5dff:fe94:552d.5353 > ff02::fb.5353: 0 [2q] PTR (QM)? _ipps._tcp.local. PTR (QM)? _ipp._tcp.local. (45)
18:23:15.742173 IP6 fe80::783f:83ff:feeb:5f7c > ff02::2: ICMP6, router solicitation, length 16
18:23:15.764798 IP6 fe80::6457:a2ff:fef1:bd25.5353 > ff02::fb.5353: 0 [2q] PTR (QM)? _ipps._tcp.local. PTR (QM)? _ipp._tcp.local. (45)
18:23:15.782545 IP6 fe80::a47a:68ff:fe80:b4d1 > ff02::2: ICMP6, router solicitation, length 16
18:23:15.802786 IP6 fe80::4c6b:3fff:fe43:2d97 > ff02::2: ICMP6, router solicitation, length 16
18:23:15.822790 IP6 fe80::7c7a:feff:fefe:16c4 > ff02::2: ICMP6, router solicitation, length 16
18:23:15.840766 IP6 fe80::c46d:dbff:fe72:c67c.5353 > ff02::fb.5353: 0 [2q] PTR (QM)? _ipps._tcp.local. PTR (QM)? _ipp._tcp.local. (45)
18:23:15.905195 IP6 fe80::8c63:62ff:fecc:1993 > ff02::2: ICMP6, router solicitation, length 16
18:23:15.946538 IP6 fe80::783f:83ff:feeb:5f7c.5353 > ff02::fb.5353: 0*- [0q] 2/0/0 (Cache flush) PTR sam-VirtualBox.local., (Cache flush) AAAA fe80::783f:83ff:feeb:5f7c (146)
18:23:16.045478 IP6 fe80::4c6b:3fff:fe43:2d97.5353 > ff02::fb.5353: 0*- [0q] 2/0/0 (Cache flush) PTR sam-VirtualBox.local., (Cache flush) AAAA fe80::4c6b:3fff:fe43:2d97 (146)
18:23:16.164371 IP6 fe80::2cf4:ffff:feae:f6c5.5353 > ff02::fb.5353: 0 [2q] PTR (QM)? _ipps._tcp.local. PTR (QM)? _ipp._tcp.local. (45)
18:23:16.172097 IP6 fe80::f0df:4ff:fe77:c9c8 > ff02::2: ICMP6, router solicitation, length 16
18:23:16.192344 IP6 fe80::e4f7:eff:feb9:3d6c > ff02::2: ICMP6, router solicitation, length 16
18:23:16.252966 IP6 fe80::8c63:62ff:fecc:1993.5353 > ff02::fb.5353: 0*- [0q] 2/0/0 (Cache flush) PTR sam-VirtualBox.local., (Cache flush) AAAA fe80::8c63:62ff:fecc:1993 (146)
18:23:16.272446 IP6 fe80::ac6c:5bff:fe41:8cdb.5353 > ff02::fb.5353: 0*- [0q] 2/0/0 (Cache flush) PTR sam-VirtualBox.local., (Cache flush) AAAA fe80::ac6c:5bff:fe41:8cdb (146)
18:23:16.297505 IP6 fe80::e4f7:eff:feb9:3d6c.5353 > ff02::fb.5353: 0*- [0q] 2/0/0 (Cache flush) PTR sam-VirtualBox.local., (Cache flush) AAAA fe80::e4f7:eff:feb9:3d6c (146)
18:23:16.393083 IP6 fe80::6076:91ff:fe8e:c879 > ff02::2: ICMP6, router solicitation, length 16
18:23:16.422639 IP6 fe80::5c87:b2ff:fe73:661f > ff02::2: ICMP6, router solicitation, length 16
18:23:16.466420 IP6 fe80::9808:49ff:fe96:74fb > ff02::2: ICMP6, router solicitation, length 16
18:23:16.599809 ARP, Request who-has 10.0.0.7 tell 10.0.0.1, length 28
18:23:16.601111 ARP, Reply 10.0.0.7 is-at ba:19:8a:ce:2c:67, length 28
18:23:16.605565 IP6 fe80::9808:49ff:fe96:74fb.5353 > ff02::fb.5353: 0*- [0q] 2/0/0 (Cache flush) PTR sam-VirtualBox.local., (Cache flush) AAAA fe80::9808:49ff:fe96:74fb (146)
18:23:16.712398 IP6 fe80::6457:a2ff:fef1:bd25 > ff02::2: ICMP6, router solicitation, length 16
18:23:16.739115 IP6 fe80::6c66:b4ff:fe68:92ab > ff02::2: ICMP6, router solicitation, length 16
18:23:16.762900 IP6 fe80::6076:91ff:fe8e:c879.5353 > ff02::fb.5353: 0*- [0q] 2/0/0 (Cache flush) PTR sam-VirtualBox.local., (Cache flush) AAAA fe80::6076:91ff:fe8e:c879 (146)
18:23:16.780513 IP6 fe80::c486:4bff:fea7:c725 > ff02::2: ICMP6, router solicitation, length 16
18:23:16.802152 IP6 fe80::f0df:4ff:fe77:c9c8.5353 > ff02::fb.5353: 0*- [0q] 2/0/0 (Cache flush) PTR sam-VirtualBox.local., (Cache flush) AAAA fe80::f0df:4ff:fe77:c9c8 (146)
18:23:16.821748 IP 10.0.0.1.50720 > 10.0.0.7.5566: UDP, length 1470
18:23:16.824001 IP 10.0.0.1.50720 > 10.0.0.7.5566: UDP, length 1470
18:23:16.824633 IP 10.0.0.1.50720 > 10.0.0.7.5566: UDP, length 1470
18:23:16.825677 IP 10.0.0.1.50720 > 10.0.0.7.5566: UDP, length 1470
18:23:16.827168 IP 10.0.0.1.50720 > 10.0.0.7.5566: UDP, length 1470
18:23:16.827323 IP 10.0.0.1.50720 > 10.0.0.7.5566: UDP, length 1470
18:23:16.828383 IP 10.0.0.1.50720 > 10.0.0.7.5566: UDP, length 1470
18:23:16.829271 IP 10.0.0.1.50720 > 10.0.0.7.5566: UDP, length 1470
18:23:16.830622 IP 10.0.0.1.50720 > 10.0.0.7.5566: UDP, length 1470
18:23:16.830623 IP 10.0.0.1.50720 > 10.0.0.7.5566: UDP, length 1470
18:23:16.832292 IP 10.0.0.1.50720 > 10.0.0.7.5566: UDP, length 1470
18:23:16.832496 IP 10.0.0.1.50720 > 10.0.0.7.5566: UDP, length 1470
18:23:16.833583 IP 10.0.0.1.50720 > 10.0.0.7.5566: UDP, length 1470
18:23:16.834134 IP 10.0.0.1.50720 > 10.0.0.7.5566: UDP, length 1470
18:23:16.836733 IP 10.0.0.1.50720 > 10.0.0.7.5566: UDP, length 1470
18:23:16.836734 IP 10.0.0.1.50720 > 10.0.0.7.5566: UDP, length 1470
18:23:16.838917 IP 10.0.0.1.50720 > 10.0.0.7.5566: UDP, length 1470
18:23:16.838918 IP 10.0.0.1.50720 > 10.0.0.7.5566: UDP, length 1470
18:23:16.841127 IP 10.0.0.1.50720 > 10.0.0.7.5566: UDP, length 1470
18:23:16.842464 IP 10.0.0.1.50720 > 10.0.0.7.5566: UDP, length 1470
18:23:16.842983 IP 10.0.0.1.50720 > 10.0.0.7.5566: UDP, length 1470
18:23:16.844719 IP 10.0.0.1.50720 > 10.0.0.7.5566: UDP, length 1470
18:23:16.844870 IP 10.0.0.1.50720 > 10.0.0.7.5566: UDP, length 1470
18:23:16.846414 IP 10.0.0.1.50720 > 10.0.0.7.5566: UDP, length 1470
18:23:16.846415 IP 10.0.0.1.50720 > 10.0.0.7.5566: UDP, length 1470
18:23:16.848153 IP 10.0.0.1.50720 > 10.0.0.7.5566: UDP, length 1470
18:23:16.848154 IP 10.0.0.1.50720 > 10.0.0.7.5566: UDP, length 1470
18:23:16.850762 IP 10.0.0.1.50720 > 10.0.0.7.5566: UDP, length 1470
18:23:16.850763 IP 10.0.0.1.50720 > 10.0.0.7.5566: UDP, length 1470
18:23:16.852323 IP 10.0.0.1.50720 > 10.0.0.7.5566: UDP, length 1470
18:23:16.852404 IP 10.0.0.1.50720 > 10.0.0.7.5566: UDP, length 1470
18:23:16.853820 IP 10.0.0.1.50720 > 10.0.0.7.5566: UDP, length 1470
18:23:16.855283 IP 10.0.0.1.50720 > 10.0.0.7.5566: UDP, length 1470
18:23:16.857057 IP 10.0.0.1.50720 > 10.0.0.7.5566: UDP, length 1470
18:23:16.857058 IP 10.0.0.1.50720 > 10.0.0.7.5566: UDP, length 1470
18:23:16.858228 IP 10.0.0.1.50720 > 10.0.0.7.5566: UDP, length 1470
18:23:16.859832 IP 10.0.0.1.50720 > 10.0.0.7.5566: UDP, length 1470
18:23:16.859833 IP 10.0.0.1.50720 > 10.0.0.7.5566: UDP, length 1470
18:23:16.862134 IP 10.0.0.1.50720 > 10.0.0.7.5566: UDP, length 1470
18:23:16.864765 IP 10.0.0.1.50720 > 10.0.0.7.5566: UDP, length 1470
18:23:16.864886 IP 10.0.0.1.50720 > 10.0.0.7.5566: UDP, length 1470
18:23:16.867855 IP 10.0.0.1.50720 > 10.0.0.7.5566: UDP, length 1470
18:23:16.867855 IP 10.0.0.1.50720 > 10.0.0.7.5566: UDP, length 1470
18:23:16.871077 IP 10.0.0.1.50720 > 10.0.0.7.5566: UDP, length 1470
18:23:16.871078 IP 10.0.0.1.50720 > 10.0.0.7.5566: UDP, length 1470
18:23:16.872463 IP 10.0.0.1.50720 > 10.0.0.7.5566: UDP, length 1470
18:23:16.872674 IP 10.0.0.1.50720 > 10.0.0.7.5566: UDP, length 1470
18:23:16.873874 IP 10.0.0.1.50720 > 10.0.0.7.5566: UDP, length 1470
18:23:16.874772 IP 10.0.0.1.50720 > 10.0.0.7.5566: UDP, length 1470
18:23:16.875253 IP 10.0.0.1.50720 > 10.0.0.7.5566: UDP, length 1470
18:23:16.876084 IP 10.0.0.1.50720 > 10.0.0.7.5566: UDP, length 1470
18:23:16.877278 IP 10.0.0.1.50720 > 10.0.0.7.5566: UDP, length 1470
18:23:16.881894 IP 10.0.0.1.50720 > 10.0.0.7.5566: UDP, length 1470
18:23:16.881895 IP 10.0.0.1.50720 > 10.0.0.7.5566: UDP, length 1470
18:23:16.883282 IP 10.0.0.1.50720 > 10.0.0.7.5566: UDP, length 1470
18:23:16.884786 IP 10.0.0.1.50720 > 10.0.0.7.5566: UDP, length 1470
18:23:16.884787 IP 10.0.0.1.50720 > 10.0.0.7.5566: UDP, length 1470
18:23:16.887667 IP 10.0.0.1.50720 > 10.0.0.7.5566: UDP, length 1470
18:23:16.887668 IP 10.0.0.1.50720 > 10.0.0.7.5566: UDP, length 1470
18:23:16.889905 IP 10.0.0.1.50720 > 10.0.0.7.5566: UDP, length 1470
18:23:16.889906 IP 10.0.0.1.50720 > 10.0.0.7.5566: UDP, length 1470
18:23:16.892036 IP 10.0.0.1.50720 > 10.0.0.7.5566: UDP, length 1470
18:23:16.894816 IP6 fe80::b819:8aff:fece:2c67 > ff02::2: ICMP6, router solicitation, length 16
18:23:16.894805 IP 10.0.0.1.50720 > 10.0.0.7.5566: UDP, length 1470
18:23:16.894945 IP 10.0.0.1.50720 > 10.0.0.7.5566: UDP, length 1470
18:23:16.896160 IP 10.0.0.1.50720 > 10.0.0.7.5566: UDP, length 1470
18:23:16.902768 IP 10.0.0.1.50720 > 10.0.0.7.5566: UDP, length 1470
18:23:16.902769 IP 10.0.0.1.50720 > 10.0.0.7.5566: UDP, length 1470
18:23:16.904848 IP 10.0.0.1.50720 > 10.0.0.7.5566: UDP, length 1470
18:23:16.904936 IP 10.0.0.1.50720 > 10.0.0.7.5566: UDP, length 1470
18:23:16.908485 IP 10.0.0.1.50720 > 10.0.0.7.5566: UDP, length 1470
18:23:16.908485 IP 10.0.0.1.50720 > 10.0.0.7.5566: UDP, length 1470
18:23:16.909819 IP 10.0.0.1.50720 > 10.0.0.7.5566: UDP, length 1470
18:23:16.912493 IP 10.0.0.1.50720 > 10.0.0.7.5566: UDP, length 1470
18:23:16.912599 IP 10.0.0.1.50720 > 10.0.0.7.5566: UDP, length 1470
18:23:16.914869 IP 10.0.0.1.50720 > 10.0.0.7.5566: UDP, length 1470
18:23:16.914994 IP 10.0.0.1.50720 > 10.0.0.7.5566: UDP, length 1470
18:23:16.916631 IP 10.0.0.1.50720 > 10.0.0.7.5566: UDP, length 1470
18:23:16.916631 IP 10.0.0.1.50720 > 10.0.0.7.5566: UDP, length 1470
18:23:16.919068 IP 10.0.0.1.50720 > 10.0.0.7.5566: UDP, length 1470
18:23:16.919069 IP 10.0.0.1.50720 > 10.0.0.7.5566: UDP, length 1470
18:23:16.921392 IP 10.0.0.1.50720 > 10.0.0.7.5566: UDP, length 1470
18:23:16.921393 IP 10.0.0.1.50720 > 10.0.0.7.5566: UDP, length 1470
18:23:16.922886 IP 10.0.0.1.50720 > 10.0.0.7.5566: UDP, length 1470
18:23:16.924610 IP 10.0.0.1.50720 > 10.0.0.7.5566: UDP, length 1470
18:23:16.924610 IP 10.0.0.1.50720 > 10.0.0.7.5566: UDP, length 1470
18:23:16.929051 IP 10.0.0.1.50720 > 10.0.0.7.5566: UDP, length 1470
18:23:16.929051 IP 10.0.0.1.50720 > 10.0.0.7.5566: UDP, length 1470
18:23:16.931230 IP 10.0.0.1.50720 > 10.0.0.7.5566: UDP, length 1470
18:23:16.931231 IP 10.0.0.1.50720 > 10.0.0.7.5566: UDP, length 1470
18:23:16.932972 IP 10.0.0.1.50720 > 10.0.0.7.5566: UDP, length 1470
18:23:16.933661 IP 10.0.0.1.50720 > 10.0.0.7.5566: UDP, length 1470
18:23:16.934845 IP 10.0.0.1.50720 > 10.0.0.7.5566: UDP, length 1470
18:23:16.934878 IP 10.0.0.1.50720 > 10.0.0.7.5566: UDP, length 1470
18:23:16.937320 IP 10.0.0.1.50720 > 10.0.0.7.5566: UDP, length 1470
18:23:16.937321 IP 10.0.0.1.50720 > 10.0.0.7.5566: UDP, length 1470
18:23:16.939515 IP 10.0.0.1.50720 > 10.0.0.7.5566: UDP, length 1470
18:23:16.939516 IP 10.0.0.1.50720 > 10.0.0.7.5566: UDP, length 1470
18:23:16.942087 IP 10.0.0.1.50720 > 10.0.0.7.5566: UDP, length 1470
18:23:16.942213 IP 10.0.0.1.50720 > 10.0.0.7.5566: UDP, length 1470
18:23:16.944395 IP 10.0.0.1.50720 > 10.0.0.7.5566: UDP, length 1470
18:23:16.944396 IP 10.0.0.1.50720 > 10.0.0.7.5566: UDP, length 1470
18:23:16.947248 IP 10.0.0.1.50720 > 10.0.0.7.5566: UDP, length 1470
18:23:16.947249 IP 10.0.0.1.50720 > 10.0.0.7.5566: UDP, length 1470
18:23:16.949764 IP 10.0.0.1.50720 > 10.0.0.7.5566: UDP, length 1470
18:23:16.949765 IP 10.0.0.1.50720 > 10.0.0.7.5566: UDP, length 1470
18:23:16.950830 IP 10.0.0.1.50720 > 10.0.0.7.5566: UDP, length 1470
18:23:16.952113 IP 10.0.0.1.50720 > 10.0.0.7.5566: UDP, length 1470
18:23:16.952221 IP 10.0.0.1.50720 > 10.0.0.7.5566: UDP, length 1470
18:23:16.953636 IP 10.0.0.1.50720 > 10.0.0.7.5566: UDP, length 1470
18:23:16.955059 IP 10.0.0.1.50720 > 10.0.0.7.5566: UDP, length 1470
18:23:16.955575 IP 10.0.0.1.50720 > 10.0.0.7.5566: UDP, length 1470
18:23:16.956873 IP 10.0.0.1.50720 > 10.0.0.7.5566: UDP, length 1470
18:23:16.956873 IP 10.0.0.1.50720 > 10.0.0.7.5566: UDP, length 1470
18:23:16.959133 IP 10.0.0.1.50720 > 10.0.0.7.5566: UDP, length 1470
18:23:16.959133 IP 10.0.0.1.50720 > 10.0.0.7.5566: UDP, length 1470
18:23:16.960181 IP 10.0.0.1.50720 > 10.0.0.7.5566: UDP, length 1470
18:23:16.962225 IP 10.0.0.1.50720 > 10.0.0.7.5566: UDP, length 1470
18:23:16.962847 IP 10.0.0.1.50720 > 10.0.0.7.5566: UDP, length 1470
18:23:16.965438 IP 10.0.0.1.50720 > 10.0.0.7.5566: UDP, length 1470
18:23:16.965439 IP 10.0.0.1.50720 > 10.0.0.7.5566: UDP, length 1470
18:23:16.967677 IP 10.0.0.1.50720 > 10.0.0.7.5566: UDP, length 1470
18:23:16.969842 IP 10.0.0.1.50720 > 10.0.0.7.5566: UDP, length 1470
18:23:16.969843 IP 10.0.0.1.50720 > 10.0.0.7.5566: UDP, length 1470
18:23:16.972325 IP 10.0.0.1.50720 > 10.0.0.7.5566: UDP, length 1470
18:23:16.972455 IP 10.0.0.1.50720 > 10.0.0.7.5566: UDP, length 1470
18:23:16.975037 IP 10.0.0.1.50720 > 10.0.0.7.5566: UDP, length 1470
18:23:16.975220 IP 10.0.0.1.50720 > 10.0.0.7.5566: UDP, length 1470
18:23:16.976320 IP 10.0.0.1.50720 > 10.0.0.7.5566: UDP, length 1470
18:23:16.977217 IP 10.0.0.1.50720 > 10.0.0.7.5566: UDP, length 1470
18:23:16.977769 IP 10.0.0.1.50720 > 10.0.0.7.5566: UDP, length 1470
18:23:16.980198 IP 10.0.0.1.50720 > 10.0.0.7.5566: UDP, length 1470
18:23:16.980275 IP 10.0.0.1.50720 > 10.0.0.7.5566: UDP, length 1470
18:23:16.981928 IP 10.0.0.1.50720 > 10.0.0.7.5566: UDP, length 1470
18:23:16.981928 IP 10.0.0.1.50720 > 10.0.0.7.5566: UDP, length 1470
18:23:16.984571 IP 10.0.0.1.50720 > 10.0.0.7.5566: UDP, length 1470
18:23:16.984572 IP 10.0.0.1.50720 > 10.0.0.7.5566: UDP, length 1470
18:23:16.986927 IP 10.0.0.1.50720 > 10.0.0.7.5566: UDP, length 1470
18:23:16.987510 IP 10.0.0.1.50720 > 10.0.0.7.5566: UDP, length 1470
18:23:16.990011 IP 10.0.0.1.50720 > 10.0.0.7.5566: UDP, length 1470
18:23:16.992520 IP 10.0.0.1.50720 > 10.0.0.7.5566: UDP, length 1470
18:23:16.992521 IP 10.0.0.1.50720 > 10.0.0.7.5566: UDP, length 1470
18:23:16.995074 IP 10.0.0.1.50720 > 10.0.0.7.5566: UDP, length 1470
18:23:16.995075 IP 10.0.0.1.50720 > 10.0.0.7.5566: UDP, length 1470
18:23:17.000214 IP 10.0.0.1.50720 > 10.0.0.7.5566: UDP, length 1470
18:23:17.000216 IP 10.0.0.1.50720 > 10.0.0.7.5566: UDP, length 1470
18:23:17.002550 IP 10.0.0.1.50720 > 10.0.0.7.5566: UDP, length 1470
18:23:17.005202 IP 10.0.0.1.50720 > 10.0.0.7.5566: UDP, length 1470
18:23:17.005292 IP 10.0.0.1.50720 > 10.0.0.7.5566: UDP, length 1470
18:23:17.007902 IP 10.0.0.1.50720 > 10.0.0.7.5566: UDP, length 1470
18:23:17.007903 IP 10.0.0.1.50720 > 10.0.0.7.5566: UDP, length 1470
18:23:17.010348 IP 10.0.0.1.50720 > 10.0.0.7.5566: UDP, length 1470
18:23:17.010349 IP 10.0.0.1.50720 > 10.0.0.7.5566: UDP, length 1470
18:23:17.012697 IP 10.0.0.1.50720 > 10.0.0.7.5566: UDP, length 1470
18:23:17.015218 IP 10.0.0.1.50720 > 10.0.0.7.5566: UDP, length 1470
18:23:17.015296 IP 10.0.0.1.50720 > 10.0.0.7.5566: UDP, length 1470
18:23:17.016609 IP 10.0.0.1.50720 > 10.0.0.7.5566: UDP, length 1470
18:23:17.018846 IP 10.0.0.1.50720 > 10.0.0.7.5566: UDP, length 1470
18:23:17.018846 IP 10.0.0.1.50720 > 10.0.0.7.5566: UDP, length 1470
18:23:17.022785 IP 10.0.0.1.50720 > 10.0.0.7.5566: UDP, length 1470
18:23:17.023396 IP 10.0.0.1.50720 > 10.0.0.7.5566: UDP, length 1470
18:23:17.025199 IP 10.0.0.1.50720 > 10.0.0.7.5566: UDP, length 1470
18:23:17.025267 IP 10.0.0.1.50720 > 10.0.0.7.5566: UDP, length 1470
18:23:17.026598 IP 10.0.0.1.50720 > 10.0.0.7.5566: UDP, length 1470
18:23:17.029075 IP 10.0.0.1.50720 > 10.0.0.7.5566: UDP, length 1470
18:23:17.029076 IP 10.0.0.1.50720 > 10.0.0.7.5566: UDP, length 1470
18:23:17.031254 IP 10.0.0.1.50720 > 10.0.0.7.5566: UDP, length 1470
18:23:17.031255 IP 10.0.0.1.50720 > 10.0.0.7.5566: UDP, length 1470
18:23:17.032882 IP 10.0.0.1.50720 > 10.0.0.7.5566: UDP, length 1470
18:23:17.033463 IP 10.0.0.1.50720 > 10.0.0.7.5566: UDP, length 1470
18:23:17.035266 IP 10.0.0.1.50720 > 10.0.0.7.5566: UDP, length 1470
18:23:17.035266 IP 10.0.0.1.50720 > 10.0.0.7.5566: UDP, length 1470
18:23:17.037563 IP 10.0.0.1.50720 > 10.0.0.7.5566: UDP, length 1470
18:23:17.037849 IP 10.0.0.1.50720 > 10.0.0.7.5566: UDP, length 1470
18:23:17.040625 IP 10.0.0.1.50720 > 10.0.0.7.5566: UDP, length 1470
18:23:17.040626 IP 10.0.0.1.50720 > 10.0.0.7.5566: UDP, length 1470
18:23:17.042976 IP 10.0.0.1.50720 > 10.0.0.7.5566: UDP, length 1470
18:23:17.045276 IP 10.0.0.1.50720 > 10.0.0.7.5566: UDP, length 1470
18:23:17.045384 IP 10.0.0.1.50720 > 10.0.0.7.5566: UDP, length 1470
18:23:17.047377 IP 10.0.0.1.50720 > 10.0.0.7.5566: UDP, length 1470
18:23:17.047377 IP 10.0.0.1.50720 > 10.0.0.7.5566: UDP, length 1470
18:23:17.051298 IP 10.0.0.1.50720 > 10.0.0.7.5566: UDP, length 1470
18:23:17.051299 IP 10.0.0.1.50720 > 10.0.0.7.5566: UDP, length 1470
18:23:17.052336 IP 10.0.0.1.50720 > 10.0.0.7.5566: UDP, length 1470
18:23:17.054525 IP 10.0.0.1.50720 > 10.0.0.7.5566: UDP, length 1470
18:23:17.054526 IP 10.0.0.1.50720 > 10.0.0.7.5566: UDP, length 1470
18:23:17.055846 IP 10.0.0.1.50720 > 10.0.0.7.5566: UDP, length 1470
18:23:17.057772 IP 10.0.0.1.50720 > 10.0.0.7.5566: UDP, length 1470
18:23:17.057773 IP 10.0.0.1.50720 > 10.0.0.7.5566: UDP, length 1470
18:23:17.060335 IP 10.0.0.1.50720 > 10.0.0.7.5566: UDP, length 1470
18:23:17.060336 IP 10.0.0.1.50720 > 10.0.0.7.5566: UDP, length 1470
18:23:17.062126 IP 10.0.0.1.50720 > 10.0.0.7.5566: UDP, length 1470
18:23:17.062127 IP 10.0.0.1.50720 > 10.0.0.7.5566: UDP, length 1470
18:23:17.065314 IP 10.0.0.1.50720 > 10.0.0.7.5566: UDP, length 1470
18:23:17.065315 IP 10.0.0.1.50720 > 10.0.0.7.5566: UDP, length 1470
18:23:17.068164 IP 10.0.0.1.50720 > 10.0.0.7.5566: UDP, length 1470
18:23:17.068165 IP 10.0.0.1.50720 > 10.0.0.7.5566: UDP, length 1470
18:23:17.071424 IP 10.0.0.1.50720 > 10.0.0.7.5566: UDP, length 1470
18:23:17.071700 IP 10.0.0.1.50720 > 10.0.0.7.5566: UDP, length 1470
18:23:17.072356 IP 10.0.0.1.50720 > 10.0.0.7.5566: UDP, length 1470
18:23:17.074382 IP 10.0.0.1.50720 > 10.0.0.7.5566: UDP, length 1470
18:23:17.074382 IP 10.0.0.1.50720 > 10.0.0.7.5566: UDP, length 1470
18:23:17.075943 IP 10.0.0.1.50720 > 10.0.0.7.5566: UDP, length 1470
18:23:17.075952 IP 10.0.0.1.50720 > 10.0.0.7.5566: UDP, length 1470
18:23:17.077228 IP 10.0.0.1.50720 > 10.0.0.7.5566: UDP, length 1470
18:23:17.078303 IP 10.0.0.1.50720 > 10.0.0.7.5566: UDP, length 1470
18:23:17.078414 IP 10.0.0.1.50720 > 10.0.0.7.5566: UDP, length 1470
18:23:17.082763 IP 10.0.0.1.50720 > 10.0.0.7.5566: UDP, length 1470
18:23:17.084358 IP 10.0.0.1.50720 > 10.0.0.7.5566: UDP, length 1470
18:23:17.084434 IP 10.0.0.1.50720 > 10.0.0.7.5566: UDP, length 1470
18:23:17.085322 IP 10.0.0.1.50720 > 10.0.0.7.5566: UDP, length 1470
18:23:17.088486 IP 10.0.0.1.50720 > 10.0.0.7.5566: UDP, length 1470
18:23:17.088487 IP 10.0.0.1.50720 > 10.0.0.7.5566: UDP, length 1470
18:23:17.092568 IP 10.0.0.1.50720 > 10.0.0.7.5566: UDP, length 1470
18:23:17.092729 IP 10.0.0.1.50720 > 10.0.0.7.5566: UDP, length 1470
18:23:17.094365 IP 10.0.0.1.50720 > 10.0.0.7.5566: UDP, length 1470
18:23:17.094365 IP 10.0.0.1.50720 > 10.0.0.7.5566: UDP, length 1470
18:23:17.096309 IP 10.0.0.1.50720 > 10.0.0.7.5566: UDP, length 1470
18:23:17.096417 IP 10.0.0.1.50720 > 10.0.0.7.5566: UDP, length 1470
18:23:17.098471 IP 10.0.0.1.50720 > 10.0.0.7.5566: UDP, length 1470
18:23:17.098471 IP 10.0.0.1.50720 > 10.0.0.7.5566: UDP, length 1470
18:23:17.102732 IP 10.0.0.1.50720 > 10.0.0.7.5566: UDP, length 1470
18:23:17.104434 IP 10.0.0.1.50720 > 10.0.0.7.5566: UDP, length 1470
18:23:17.104530 IP 10.0.0.1.50720 > 10.0.0.7.5566: UDP, length 1470
18:23:17.110403 IP 10.0.0.1.50720 > 10.0.0.7.5566: UDP, length 1470
18:23:17.110585 IP 10.0.0.1.50720 > 10.0.0.7.5566: UDP, length 1470
18:23:17.111908 IP 10.0.0.1.50720 > 10.0.0.7.5566: UDP, length 1470
18:23:17.112048 IP 10.0.0.1.50720 > 10.0.0.7.5566: UDP, length 1470
18:23:17.112920 IP 10.0.0.1.50720 > 10.0.0.7.5566: UDP, length 1470
18:23:17.114516 IP 10.0.0.1.50720 > 10.0.0.7.5566: UDP, length 1470
18:23:17.114612 IP 10.0.0.1.50720 > 10.0.0.7.5566: UDP, length 1470
18:23:17.118095 IP 10.0.0.1.50720 > 10.0.0.7.5566: UDP, length 1470
18:23:17.118096 IP 10.0.0.1.50720 > 10.0.0.7.5566: UDP, length 1470
18:23:17.121602 IP 10.0.0.1.50720 > 10.0.0.7.5566: UDP, length 1470
18:23:17.122837 IP 10.0.0.1.50720 > 10.0.0.7.5566: UDP, length 1470
18:23:17.122837 IP 10.0.0.1.50720 > 10.0.0.7.5566: UDP, length 1470
18:23:17.124482 IP 10.0.0.1.50720 > 10.0.0.7.5566: UDP, length 1470
18:23:17.130690 IP 10.0.0.1.50720 > 10.0.0.7.5566: UDP, length 1470
18:23:17.130890 IP 10.0.0.1.50720 > 10.0.0.7.5566: UDP, length 1470
18:23:17.132391 IP 10.0.0.1.50720 > 10.0.0.7.5566: UDP, length 1470
18:23:17.132468 IP 10.0.0.1.50720 > 10.0.0.7.5566: UDP, length 1470
18:23:17.137599 IP 10.0.0.1.50720 > 10.0.0.7.5566: UDP, length 1470
18:23:17.137887 IP 10.0.0.1.50720 > 10.0.0.7.5566: UDP, length 1470
18:23:17.140283 IP 10.0.0.1.50720 > 10.0.0.7.5566: UDP, length 1470
18:23:17.142490 IP 10.0.0.1.50720 > 10.0.0.7.5566: UDP, length 1470
18:23:17.142595 IP 10.0.0.1.50720 > 10.0.0.7.5566: UDP, length 1470
18:23:17.144558 IP 10.0.0.1.50720 > 10.0.0.7.5566: UDP, length 1470
18:23:17.150709 IP 10.0.0.1.50720 > 10.0.0.7.5566: UDP, length 1470
18:23:17.150927 IP 10.0.0.1.50720 > 10.0.0.7.5566: UDP, length 1470
18:23:17.152553 IP 10.0.0.1.50720 > 10.0.0.7.5566: UDP, length 1470
18:23:17.158861 IP 10.0.0.1.50720 > 10.0.0.7.5566: UDP, length 1470
18:23:17.158862 IP 10.0.0.1.50720 > 10.0.0.7.5566: UDP, length 1470
18:23:17.160705 IP 10.0.0.1.50720 > 10.0.0.7.5566: UDP, length 1470
18:23:17.160706 IP 10.0.0.1.50720 > 10.0.0.7.5566: UDP, length 1470
18:23:17.167823 IP 10.0.0.1.50720 > 10.0.0.7.5566: UDP, length 1470
18:23:17.168073 IP 10.0.0.1.50720 > 10.0.0.7.5566: UDP, length 1470
18:23:17.170683 IP 10.0.0.1.50720 > 10.0.0.7.5566: UDP, length 1470
18:23:17.170786 IP 10.0.0.1.50720 > 10.0.0.7.5566: UDP, length 1470
18:23:17.172757 IP 10.0.0.1.50720 > 10.0.0.7.5566: UDP, length 1470
18:23:17.172845 IP 10.0.0.1.50720 > 10.0.0.7.5566: UDP, length 1470
18:23:17.177841 IP 10.0.0.1.50720 > 10.0.0.7.5566: UDP, length 1470
18:23:17.177842 IP 10.0.0.1.50720 > 10.0.0.7.5566: UDP, length 1470
18:23:17.179505 IP 10.0.0.1.50720 > 10.0.0.7.5566: UDP, length 1470
18:23:17.179628 IP 10.0.0.1.50720 > 10.0.0.7.5566: UDP, length 1470
18:23:17.180441 IP 10.0.0.1.50720 > 10.0.0.7.5566: UDP, length 1470
18:23:17.182875 IP 10.0.0.1.50720 > 10.0.0.7.5566: UDP, length 1470
18:23:17.183093 IP 10.0.0.1.50720 > 10.0.0.7.5566: UDP, length 1470
18:23:17.184804 IP 10.0.0.1.50720 > 10.0.0.7.5566: UDP, length 1470
18:23:17.184878 IP 10.0.0.1.50720 > 10.0.0.7.5566: UDP, length 1470
18:23:17.189486 IP 10.0.0.1.50720 > 10.0.0.7.5566: UDP, length 1470
18:23:17.189633 IP 10.0.0.1.50720 > 10.0.0.7.5566: UDP, length 1470
18:23:17.192897 IP 10.0.0.1.50720 > 10.0.0.7.5566: UDP, length 1470
18:23:17.192997 IP 10.0.0.1.50720 > 10.0.0.7.5566: UDP, length 1470
18:23:17.194820 IP 10.0.0.1.50720 > 10.0.0.7.5566: UDP, length 1470
18:23:17.194932 IP 10.0.0.1.50720 > 10.0.0.7.5566: UDP, length 1470
18:23:17.196380 IP 10.0.0.1.50720 > 10.0.0.7.5566: UDP, length 1470
18:23:17.196387 IP 10.0.0.1.50720 > 10.0.0.7.5566: UDP, length 1470
18:23:17.199476 IP 10.0.0.1.50720 > 10.0.0.7.5566: UDP, length 1470
18:23:17.199593 IP 10.0.0.1.50720 > 10.0.0.7.5566: UDP, length 1470
18:23:17.201938 IP 10.0.0.1.50720 > 10.0.0.7.5566: UDP, length 1470
18:23:17.202030 IP 10.0.0.1.50720 > 10.0.0.7.5566: UDP, length 1470
18:23:17.203849 IP 10.0.0.1.50720 > 10.0.0.7.5566: UDP, length 1470
18:23:17.203980 IP 10.0.0.1.50720 > 10.0.0.7.5566: UDP, length 1470
18:23:17.209490 IP 10.0.0.1.50720 > 10.0.0.7.5566: UDP, length 1470
18:23:17.209645 IP 10.0.0.1.50720 > 10.0.0.7.5566: UDP, length 1470
18:23:17.211393 IP 10.0.0.1.50720 > 10.0.0.7.5566: UDP, length 1470
18:23:17.211393 IP 10.0.0.1.50720 > 10.0.0.7.5566: UDP, length 1470
18:23:17.212643 IP 10.0.0.1.50720 > 10.0.0.7.5566: UDP, length 1470
18:23:17.217766 IP 10.0.0.1.50720 > 10.0.0.7.5566: UDP, length 1470
18:23:17.217898 IP 10.0.0.1.50720 > 10.0.0.7.5566: UDP, length 1470
18:23:17.219477 IP 10.0.0.1.50720 > 10.0.0.7.5566: UDP, length 1470
18:23:17.219520 IP 10.0.0.1.50720 > 10.0.0.7.5566: UDP, length 1470
18:23:17.220621 IP 10.0.0.1.50720 > 10.0.0.7.5566: UDP, length 1470
18:23:17.222708 IP 10.0.0.1.50720 > 10.0.0.7.5566: UDP, length 1470
18:23:17.223000 IP 10.0.0.1.50720 > 10.0.0.7.5566: UDP, length 1470
18:23:17.225347 IP 10.0.0.1.50720 > 10.0.0.7.5566: UDP, length 1470
18:23:17.229493 IP6 fe80::4819:5dff:fe94:552d > ff02::2: ICMP6, router solicitation, length 16
18:23:17.229624 IP 10.0.0.1.50720 > 10.0.0.7.5566: UDP, length 1470
18:23:17.232764 IP 10.0.0.1.50720 > 10.0.0.7.5566: UDP, length 1470
18:23:17.232853 IP 10.0.0.1.50720 > 10.0.0.7.5566: UDP, length 1470
18:23:17.241667 IP 10.0.0.1.50720 > 10.0.0.7.5566: UDP, length 1470
18:23:17.241668 IP 10.0.0.1.50720 > 10.0.0.7.5566: UDP, length 1470
18:23:17.242796 IP 10.0.0.1.50720 > 10.0.0.7.5566: UDP, length 1470
18:23:17.243551 IP 10.0.0.1.50720 > 10.0.0.7.5566: UDP, length 1470
18:23:17.252484 IP 10.0.0.1.50720 > 10.0.0.7.5566: UDP, length 1470
18:23:17.252485 IP 10.0.0.1.50720 > 10.0.0.7.5566: UDP, length 1470
18:23:17.262850 IP6 fe80::4819:5dff:fe94:552d.5353 > ff02::fb.5353: 0*- [0q] 2/0/0 (Cache flush) PTR sam-VirtualBox.local., (Cache flush) AAAA fe80::4819:5dff:fe94:552d (146)
18:23:17.263002 IP 10.0.0.1.50720 > 10.0.0.7.5566: UDP, length 1470
18:23:17.263002 IP 10.0.0.1.50720 > 10.0.0.7.5566: UDP, length 1470
18:23:17.266052 IP 10.0.0.1.50720 > 10.0.0.7.5566: UDP, length 1470
18:23:17.266136 IP 10.0.0.1.50720 > 10.0.0.7.5566: UDP, length 1470
18:23:17.271634 IP 10.0.0.1.50720 > 10.0.0.7.5566: UDP, length 1470
18:23:17.271635 IP 10.0.0.1.50720 > 10.0.0.7.5566: UDP, length 1470
18:23:17.272846 IP6 fe80::c46d:dbff:fe72:c67c > ff02::2: ICMP6, router solicitation, length 16
18:23:17.280552 IP 10.0.0.1.50720 > 10.0.0.7.5566: UDP, length 1470
18:23:17.280706 IP 10.0.0.1.50720 > 10.0.0.7.5566: UDP, length 1470
18:23:17.282914 IP 10.0.0.1.50720 > 10.0.0.7.5566: UDP, length 1470
18:23:17.292968 IP 10.0.0.1.50720 > 10.0.0.7.5566: UDP, length 1470
18:23:17.292969 IP 10.0.0.1.50720 > 10.0.0.7.5566: UDP, length 1470
18:23:17.302002 IP 10.0.0.1.50720 > 10.0.0.7.5566: UDP, length 1470
18:23:17.302166 IP 10.0.0.1.50720 > 10.0.0.7.5566: UDP, length 1470
18:23:17.303004 IP6 fe80::6457:a2ff:fef1:bd25.5353 > ff02::fb.5353: 0*- [0q] 2/0/0 (Cache flush) PTR sam-VirtualBox.local., (Cache flush) AAAA fe80::6457:a2ff:fef1:bd25 (146)
18:23:17.303527 IP 10.0.0.1.50720 > 10.0.0.7.5566: UDP, length 1470
18:23:17.309907 IP 10.0.0.1.50720 > 10.0.0.7.5566: UDP, length 1470
18:23:17.309908 IP 10.0.0.1.50720 > 10.0.0.7.5566: UDP, length 1470
18:23:17.312105 IP6 fe80::5c87:b2ff:fe73:661f.5353 > ff02::fb.5353: 0*- [0q] 2/0/0 (Cache flush) PTR sam-VirtualBox.local., (Cache flush) AAAA fe80::5c87:b2ff:fe73:661f (146)
18:23:17.321585 IP 10.0.0.1.50720 > 10.0.0.7.5566: UDP, length 1470
18:23:17.321586 IP 10.0.0.1.50720 > 10.0.0.7.5566: UDP, length 1470
18:23:17.324379 IP6 fe80::2ce8:7eff:fedf:544c > ff02::2: ICMP6, router solicitation, length 16
18:23:17.324486 IP 10.0.0.1.50720 > 10.0.0.7.5566: UDP, length 1470
18:23:17.324487 IP 10.0.0.1.50720 > 10.0.0.7.5566: UDP, length 1470
18:23:17.325544 IP 10.0.0.1.50720 > 10.0.0.7.5566: UDP, length 1470
18:23:17.329245 IP 10.0.0.1.50720 > 10.0.0.7.5566: UDP, length 1470
18:23:17.329400 IP 10.0.0.1.50720 > 10.0.0.7.5566: UDP, length 1470
18:23:17.332211 IP 10.0.0.1.50720 > 10.0.0.7.5566: UDP, length 1470
18:23:17.332212 IP 10.0.0.1.50720 > 10.0.0.7.5566: UDP, length 1470
18:23:17.334423 IP 10.0.0.1.50720 > 10.0.0.7.5566: UDP, length 1470
18:23:17.334566 IP 10.0.0.1.50720 > 10.0.0.7.5566: UDP, length 1470
18:23:17.337468 IP 10.0.0.1.50720 > 10.0.0.7.5566: UDP, length 1470
18:23:17.337469 IP 10.0.0.1.50720 > 10.0.0.7.5566: UDP, length 1470
18:23:17.342350 IP6 fe80::c46d:dbff:fe72:c67c.5353 > ff02::fb.5353: 0*- [0q] 2/0/0 (Cache flush) PTR sam-VirtualBox.local., (Cache flush) AAAA fe80::c46d:dbff:fe72:c67c (146)
18:23:17.343669 IP 10.0.0.1.50720 > 10.0.0.7.5566: UDP, length 1470
18:23:17.343670 IP 10.0.0.1.50720 > 10.0.0.7.5566: UDP, length 1470
18:23:17.352407 IP6 fe80::e4ab:acff:fed0:d9c5.5353 > ff02::fb.5353: 0*- [0q] 2/0/0 (Cache flush) PTR sam-VirtualBox.local., (Cache flush) AAAA fe80::e4ab:acff:fed0:d9c5 (146)
18:23:17.352541 IP 10.0.0.1.50720 > 10.0.0.7.5566: UDP, length 1470
18:23:17.352542 IP 10.0.0.1.50720 > 10.0.0.7.5566: UDP, length 1470
18:23:17.353988 IP 10.0.0.1.50720 > 10.0.0.7.5566: UDP, length 1470
18:23:17.360963 IP 10.0.0.1.50720 > 10.0.0.7.5566: UDP, length 1470
18:23:17.361088 IP 10.0.0.1.50720 > 10.0.0.7.5566: UDP, length 1470
18:23:17.362478 IP 10.0.0.1.50720 > 10.0.0.7.5566: UDP, length 1470
18:23:17.362558 IP 10.0.0.1.50720 > 10.0.0.7.5566: UDP, length 1470
18:23:17.365076 IP 10.0.0.1.50720 > 10.0.0.7.5566: UDP, length 1470
18:23:17.365156 IP 10.0.0.1.50720 > 10.0.0.7.5566: UDP, length 1470
18:23:17.369399 IP 10.0.0.1.50720 > 10.0.0.7.5566: UDP, length 1470
18:23:17.369508 IP 10.0.0.1.50720 > 10.0.0.7.5566: UDP, length 1470
18:23:17.372570 IP 10.0.0.1.50720 > 10.0.0.7.5566: UDP, length 1470
18:23:17.372571 IP 10.0.0.1.50720 > 10.0.0.7.5566: UDP, length 1470
18:23:17.375121 IP 10.0.0.1.50720 > 10.0.0.7.5566: UDP, length 1470
18:23:17.375385 IP 10.0.0.1.50720 > 10.0.0.7.5566: UDP, length 1470
18:23:17.376494 IP 10.0.0.1.50720 > 10.0.0.7.5566: UDP, length 1470
18:23:17.380507 IP 10.0.0.1.50720 > 10.0.0.7.5566: UDP, length 1470
18:23:17.380622 IP 10.0.0.1.50720 > 10.0.0.7.5566: UDP, length 1470
18:23:17.381707 IP 10.0.0.1.50720 > 10.0.0.7.5566: UDP, length 1470
18:23:17.382882 IP 10.0.0.1.50720 > 10.0.0.7.5566: UDP, length 1470
18:23:17.382975 IP 10.0.0.1.50720 > 10.0.0.7.5566: UDP, length 1470
18:23:17.384037 IP 10.0.0.1.50720 > 10.0.0.7.5566: UDP, length 1470
18:23:17.384523 IP 10.0.0.1.50720 > 10.0.0.7.5566: UDP, length 1470
18:23:17.387120 IP 10.0.0.1.50720 > 10.0.0.7.5566: UDP, length 1470
18:23:17.387245 IP 10.0.0.1.50720 > 10.0.0.7.5566: UDP, length 1470
18:23:17.388979 IP 10.0.0.1.50720 > 10.0.0.7.5566: UDP, length 1470
18:23:17.389042 IP 10.0.0.1.50720 > 10.0.0.7.5566: UDP, length 1470
18:23:17.390192 IP 10.0.0.1.50720 > 10.0.0.7.5566: UDP, length 1470
18:23:17.390777 IP 10.0.0.1.50720 > 10.0.0.7.5566: UDP, length 1470
18:23:17.391632 IP 10.0.0.1.50720 > 10.0.0.7.5566: UDP, length 1470
18:23:17.392220 IP 10.0.0.1.50720 > 10.0.0.7.5566: UDP, length 1470
18:23:17.393312 IP 10.0.0.1.50720 > 10.0.0.7.5566: UDP, length 1470
18:23:17.394526 IP 10.0.0.1.50720 > 10.0.0.7.5566: UDP, length 1470
18:23:17.395093 IP 10.0.0.1.50720 > 10.0.0.7.5566: UDP, length 1470
18:23:17.395923 IP 10.0.0.1.50720 > 10.0.0.7.5566: UDP, length 1470
18:23:17.396461 IP 10.0.0.1.50720 > 10.0.0.7.5566: UDP, length 1470
18:23:17.397760 IP 10.0.0.1.50720 > 10.0.0.7.5566: UDP, length 1470
18:23:17.398477 IP 10.0.0.1.50720 > 10.0.0.7.5566: UDP, length 1470
18:23:17.399063 IP 10.0.0.1.50720 > 10.0.0.7.5566: UDP, length 1470
18:23:17.399711 IP 10.0.0.1.50720 > 10.0.0.7.5566: UDP, length 1470
18:23:17.400656 IP 10.0.0.1.50720 > 10.0.0.7.5566: UDP, length 1470
18:23:17.401733 IP 10.0.0.1.50720 > 10.0.0.7.5566: UDP, length 1470
18:23:17.402200 IP 10.0.0.1.50720 > 10.0.0.7.5566: UDP, length 1470
18:23:17.403336 IP 10.0.0.1.50720 > 10.0.0.7.5566: UDP, length 1470
18:23:17.404518 IP6 fe80::2cf4:ffff:feae:f6c5 > ff02::2: ICMP6, router solicitation, length 16
18:23:17.404558 IP 10.0.0.1.50720 > 10.0.0.7.5566: UDP, length 1470
18:23:17.406081 IP 10.0.0.1.50720 > 10.0.0.7.5566: UDP, length 1470
18:23:17.406108 IP 10.0.0.1.50720 > 10.0.0.7.5566: UDP, length 1470
18:23:17.407390 IP 10.0.0.1.50720 > 10.0.0.7.5566: UDP, length 1470
18:23:17.409901 IP 10.0.0.1.50720 > 10.0.0.7.5566: UDP, length 1470
18:23:17.409999 IP 10.0.0.1.50720 > 10.0.0.7.5566: UDP, length 1470
18:23:17.412010 IP 10.0.0.1.50720 > 10.0.0.7.5566: UDP, length 1470
18:23:17.413271 IP 10.0.0.1.50720 > 10.0.0.7.5566: UDP, length 1470
18:23:17.413328 IP 10.0.0.1.50720 > 10.0.0.7.5566: UDP, length 1470
18:23:17.414496 IP 10.0.0.1.50720 > 10.0.0.7.5566: UDP, length 1470
18:23:17.416353 IP 10.0.0.1.50720 > 10.0.0.7.5566: UDP, length 1470
18:23:17.416354 IP 10.0.0.1.50720 > 10.0.0.7.5566: UDP, length 1470
18:23:17.418911 IP6 fe80::fc29:8dff:feb6:8eba > ff02::2: ICMP6, router solicitation, length 16
18:23:17.420801 IP 10.0.0.1.50720 > 10.0.0.7.5566: UDP, length 1470
18:23:17.420802 IP 10.0.0.1.50720 > 10.0.0.7.5566: UDP, length 1470
18:23:17.422036 IP 10.0.0.1.50720 > 10.0.0.7.5566: UDP, length 1470
18:23:17.424653 IP 10.0.0.1.50720 > 10.0.0.7.5566: UDP, length 1470
18:23:17.424654 IP 10.0.0.1.50720 > 10.0.0.7.5566: UDP, length 1470
18:23:17.426663 IP 10.0.0.1.50720 > 10.0.0.7.5566: UDP, length 1470
18:23:17.426797 IP 10.0.0.1.50720 > 10.0.0.7.5566: UDP, length 1470
18:23:17.430613 IP 10.0.0.1.50720 > 10.0.0.7.5566: UDP, length 1470
18:23:17.432137 IP 10.0.0.1.50720 > 10.0.0.7.5566: UDP, length 1470
18:23:17.432262 IP 10.0.0.1.50720 > 10.0.0.7.5566: UDP, length 1470
18:23:17.433726 IP 10.0.0.1.50720 > 10.0.0.7.5566: UDP, length 1470
18:23:17.433759 IP 10.0.0.1.50720 > 10.0.0.7.5566: UDP, length 1470
18:23:17.434796 IP 10.0.0.1.50720 > 10.0.0.7.5566: UDP, length 1470
18:23:17.435358 IP 10.0.0.1.50720 > 10.0.0.7.5566: UDP, length 1470
18:23:17.436573 IP 10.0.0.1.50720 > 10.0.0.7.5566: UDP, length 1470
18:23:17.438855 IP 10.0.0.1.50720 > 10.0.0.7.5566: UDP, length 1470
18:23:17.438856 IP 10.0.0.1.50720 > 10.0.0.7.5566: UDP, length 1470
18:23:17.442223 IP 10.0.0.1.50720 > 10.0.0.7.5566: UDP, length 1470
18:23:17.442326 IP 10.0.0.1.50720 > 10.0.0.7.5566: UDP, length 1470
18:23:17.444757 IP6 fe80::2cf4:ffff:feae:f6c5.5353 > ff02::fb.5353: 0*- [0q] 2/0/0 (Cache flush) PTR sam-VirtualBox.local., (Cache flush) AAAA fe80::2cf4:ffff:feae:f6c5 (146)
18:23:17.444758 IP 10.0.0.1.50720 > 10.0.0.7.5566: UDP, length 1470
18:23:17.447490 IP 10.0.0.1.50720 > 10.0.0.7.5566: UDP, length 1470
18:23:17.447490 IP 10.0.0.1.50720 > 10.0.0.7.5566: UDP, length 1470
18:23:17.448497 IP 10.0.0.1.50720 > 10.0.0.7.5566: UDP, length 1470
18:23:17.450324 IP 10.0.0.1.50720 > 10.0.0.7.5566: UDP, length 1470
18:23:17.450770 IP 10.0.0.1.50720 > 10.0.0.7.5566: UDP, length 1470
18:23:17.451428 IP 10.0.0.1.50720 > 10.0.0.7.5566: UDP, length 1470
18:23:17.451915 IP 10.0.0.1.50720 > 10.0.0.7.5566: UDP, length 1470
18:23:17.452941 IP 10.0.0.1.50720 > 10.0.0.7.5566: UDP, length 1470
18:23:17.454815 IP 10.0.0.1.50720 > 10.0.0.7.5566: UDP, length 1470
18:23:17.454917 IP 10.0.0.1.50720 > 10.0.0.7.5566: UDP, length 1470
18:23:17.462078 IP 10.0.0.1.50720 > 10.0.0.7.5566: UDP, length 1470
18:23:17.462079 IP 10.0.0.1.50720 > 10.0.0.7.5566: UDP, length 1470
18:23:17.464857 IP6 fe80::7c94:d4ff:fe95:83ec > ff02::2: ICMP6, router solicitation, length 16
18:23:17.465001 IP 10.0.0.1.50720 > 10.0.0.7.5566: UDP, length 1470
18:23:17.465002 IP 10.0.0.1.50720 > 10.0.0.7.5566: UDP, length 1470
18:23:17.472117 IP 10.0.0.1.50720 > 10.0.0.7.5566: UDP, length 1470
18:23:17.472118 IP 10.0.0.1.50720 > 10.0.0.7.5566: UDP, length 1470
18:23:17.474926 IP 10.0.0.1.50720 > 10.0.0.7.5566: UDP, length 1470
18:23:17.474927 IP 10.0.0.1.50720 > 10.0.0.7.5566: UDP, length 1470
18:23:17.476436 IP 10.0.0.1.50720 > 10.0.0.7.5566: UDP, length 1470
18:23:17.481017 IP 10.0.0.1.50720 > 10.0.0.7.5566: UDP, length 1470
18:23:17.481168 IP 10.0.0.1.50720 > 10.0.0.7.5566: UDP, length 1470
18:23:17.482369 IP 10.0.0.1.50720 > 10.0.0.7.5566: UDP, length 1470
18:23:17.482730 IP 10.0.0.1.50720 > 10.0.0.7.5566: UDP, length 1470
18:23:17.483433 IP 10.0.0.1.50720 > 10.0.0.7.5566: UDP, length 1470
18:23:17.484834 IP 10.0.0.1.50720 > 10.0.0.7.5566: UDP, length 1470
18:23:17.486470 IP 10.0.0.1.50720 > 10.0.0.7.5566: UDP, length 1470
18:23:17.486568 IP 10.0.0.1.50720 > 10.0.0.7.5566: UDP, length 1470
18:23:17.487932 IP 10.0.0.1.50720 > 10.0.0.7.5566: UDP, length 1470
18:23:17.488072 IP 10.0.0.1.50720 > 10.0.0.7.5566: UDP, length 1470
18:23:17.490758 IP 10.0.0.1.50720 > 10.0.0.7.5566: UDP, length 1470
18:23:17.492383 IP 10.0.0.1.50720 > 10.0.0.7.5566: UDP, length 1470
18:23:17.492383 IP 10.0.0.1.50720 > 10.0.0.7.5566: UDP, length 1470
18:23:17.493430 IP 10.0.0.1.50720 > 10.0.0.7.5566: UDP, length 1470
18:23:17.494067 IP 10.0.0.1.50720 > 10.0.0.7.5566: UDP, length 1470
18:23:17.494789 IP 10.0.0.1.50720 > 10.0.0.7.5566: UDP, length 1470
18:23:17.495794 IP 10.0.0.1.50720 > 10.0.0.7.5566: UDP, length 1470
18:23:17.496609 IP 10.0.0.1.50720 > 10.0.0.7.5566: UDP, length 1470
18:23:17.497253 IP 10.0.0.1.50720 > 10.0.0.7.5566: UDP, length 1470
18:23:17.498127 IP 10.0.0.1.50720 > 10.0.0.7.5566: UDP, length 1470
18:23:17.498814 IP 10.0.0.1.50720 > 10.0.0.7.5566: UDP, length 1470
18:23:17.499759 IP 10.0.0.1.50720 > 10.0.0.7.5566: UDP, length 1470
18:23:17.500459 IP 10.0.0.1.50720 > 10.0.0.7.5566: UDP, length 1470
18:23:17.501226 IP 10.0.0.1.50720 > 10.0.0.7.5566: UDP, length 1470
18:23:17.502105 IP 10.0.0.1.50720 > 10.0.0.7.5566: UDP, length 1470
18:23:17.502871 IP 10.0.0.1.50720 > 10.0.0.7.5566: UDP, length 1470
18:23:17.503886 IP 10.0.0.1.50720 > 10.0.0.7.5566: UDP, length 1470
18:23:17.504458 IP 10.0.0.1.50720 > 10.0.0.7.5566: UDP, length 1470
18:23:17.505408 IP 10.0.0.1.50720 > 10.0.0.7.5566: UDP, length 1470
18:23:17.506371 IP 10.0.0.1.50720 > 10.0.0.7.5566: UDP, length 1470
18:23:17.507094 IP 10.0.0.1.50720 > 10.0.0.7.5566: UDP, length 1470
18:23:17.507901 IP 10.0.0.1.50720 > 10.0.0.7.5566: UDP, length 1470
18:23:17.509172 IP 10.0.0.1.50720 > 10.0.0.7.5566: UDP, length 1470
18:23:17.509713 IP 10.0.0.1.50720 > 10.0.0.7.5566: UDP, length 1470
18:23:17.510319 IP 10.0.0.1.50720 > 10.0.0.7.5566: UDP, length 1470
18:23:17.512534 IP 10.0.0.1.50720 > 10.0.0.7.5566: UDP, length 1470
18:23:17.513203 IP 10.0.0.1.50720 > 10.0.0.7.5566: UDP, length 1470
18:23:17.513830 IP 10.0.0.1.50720 > 10.0.0.7.5566: UDP, length 1470
18:23:17.514332 IP 10.0.0.1.50720 > 10.0.0.7.5566: UDP, length 1470
18:23:17.515279 IP 10.0.0.1.50720 > 10.0.0.7.5566: UDP, length 1470
18:23:17.516556 IP 10.0.0.1.50720 > 10.0.0.7.5566: UDP, length 1470
18:23:17.517095 IP 10.0.0.1.50720 > 10.0.0.7.5566: UDP, length 1470
18:23:17.517627 IP 10.0.0.1.50720 > 10.0.0.7.5566: UDP, length 1470
18:23:17.518522 IP 10.0.0.1.50720 > 10.0.0.7.5566: UDP, length 1470
18:23:17.519658 IP 10.0.0.1.50720 > 10.0.0.7.5566: UDP, length 1470
18:23:17.520206 IP 10.0.0.1.50720 > 10.0.0.7.5566: UDP, length 1470
18:23:17.520789 IP 10.0.0.1.50720 > 10.0.0.7.5566: UDP, length 1470
18:23:17.521903 IP 10.0.0.1.50720 > 10.0.0.7.5566: UDP, length 1470
18:23:17.523247 IP 10.0.0.1.50720 > 10.0.0.7.5566: UDP, length 1470
18:23:17.523247 IP 10.0.0.1.50720 > 10.0.0.7.5566: UDP, length 1470
18:23:17.524270 IP 10.0.0.1.50720 > 10.0.0.7.5566: UDP, length 1470
18:23:17.525257 IP 10.0.0.1.50720 > 10.0.0.7.5566: UDP, length 1470
18:23:17.526017 IP 10.0.0.1.50720 > 10.0.0.7.5566: UDP, length 1470
18:23:17.526456 IP 10.0.0.1.50720 > 10.0.0.7.5566: UDP, length 1470
18:23:17.527477 IP 10.0.0.1.50720 > 10.0.0.7.5566: UDP, length 1470
18:23:17.528095 IP 10.0.0.1.50720 > 10.0.0.7.5566: UDP, length 1470
18:23:17.529032 IP 10.0.0.1.50720 > 10.0.0.7.5566: UDP, length 1470
18:23:17.530152 IP 10.0.0.1.50720 > 10.0.0.7.5566: UDP, length 1470
